paper_id,question_id,reasoning,evidence,answer
28,11,"The question asks whether the paper reports the number of random start values and final iterations used in the estimation of the latent trajectory model. The context provided does not mention any details about the number of random start values or final iterations. It discusses the use of Latent Growth Mixture Modeling (LGMM) and the MPlus software for analysis but does not specify the convergence criteria or the number of iterations used. Therefore, there is no evidence in the context to suggest that this information is reported. ", - [] ,NO
28,12,"The context provides detailed information about the model comparison tools used in the study, specifically mentioning the Akaike Information Criterion (AIC), Bayesian Information Criterion (BIC), sample size adjusted Bayesian Information Criterion (SSBIC), and Bootstrap Likelihood Ratio Test (BLRT). These are well-known statistical tools used for model comparison and selection. The context also discusses the use of these criteria to assess the fit of different growth mixture models, which is a statistical approach. Therefore, the model comparison tools described are indeed from a statistical perspective."," - ""Criterion (AIC), and significance indicated by the Bootstrap Likelihood Ratio Test (BLRT), along with parsimony and interpretability equally weighed."" - ""We compared progressive nested trajectory models by assessing relative fit based on reductions in the Bayesian Information Criterion (BIC), sample-size adjusted Bayesian Information Criterion (SSBIC), Aikaike Information Criterion (AIC), and significance indicated by the Bootstrap""",YES
28,13,"To determine if the total number of fitted models is reported, including a one-class solution, we need to examine the context for mentions of the number of classes considered in the models. The context provides a table titled ""Fit Indices for One- to Four-Class Growth Mixture Models of PTSD Symptom Severity,"" which lists fit indices for 1, 2, 3, and 4 classes. This indicates that models with one to four classes were fitted and reported. Therefore, the total number of fitted models, including a one-class solution, is indeed reported. "," - ""Fit Indices for One- to Four-Class Growth Mixture Models of PTSD Symptom Severity (n = 957)."" - ""Linear Weights Only Linear +Quadratic Weights Fit Indices 1 Class 2 Classes 3 Classes 4 Classes"" ",YES
28,14,"To determine if the number of cases per class is reported, we need to look for information in the context that specifies either the absolute sample size, sample size per class, or the proportion of the sample in each class. The context mentions that the three-class model identified three distinct classes: Rapid Remitting (56% of the sample), Slow Remitting (27%), and Non-Remitting (17%). These percentages indicate the proportion of the sample in each class. Additionally, the context states that the entire sample size is 957. Therefore, the number of cases per class can be calculated using these proportions. Thus, the number of cases per class is reported in terms of proportions. "," - ""This model identified three substantively distinct classes. The largest class (Rapid Remitting; 56% of the sample)..."" - ""The second largest class (Slow Remitting; 27%)..."" - ""Finally, the smallest class (Non-Remitting; 17%)..."" - ""Fit Indices for One- to Four-Class Growth Mixture Models of PTSD Symptom Severity (n = 957)."" ",YES
28,15,"To determine if entropy is reported in the context of classifying cases in a trajectory, we need to look for mentions of entropy in relation to model classification. The context states that entropy was examined but not used to determine the number of classes, and it was mentioned in the context of assessing the overall fit of the analysis. However, there is no specific mention of reporting relative entropy values or the number of misclassifications per model, which are typically used to assess classification accuracy in trajectory analysis. "," - ""Entropy was also examined but not utilized to determine the number of classes; all criteria were consistent with recommendations from the literature [41]."" ",NO
28,16,"To determine if a plot is included with the estimated mean trajectories of the final solution, we need to look for any mention of figures or diagrams that represent these trajectories. The context mentions ""Figure 1. Three Trajectory Model of PTSD Symptom Severity Recovery Trajectories (n = 957)"" and provides a DOI link associated with it. This indicates that a plot is indeed included with the estimated mean trajectories of the final solution. "," - ""Figure 1. Three Trajectory Model of PTSD Symptom Severity Recovery Trajectories (n = 957)."" - ""doi:10.1371/journal.pone.0070084.g001"" ",YES
28,17,"To determine if plots are included with the estimated mean trajectories for each model, we need to look for any mention of visual representations or plots in the context. The context discusses the analysis and results of the study, including the identification of latent trajectories and the effects of treatment. However, there is no mention of plots or visual representations of the estimated mean trajectories for each model. The context focuses on statistical measures and results without indicating the inclusion of plots. ", - [] ,NO
28,18,"To determine if a plot is included of the combination of estimated means of the final model and the observed individual trajectories split out for each latent class, we need to look for any mention of such a plot in the context. The context discusses the analysis and results of the study, including the identification of latent classes and the effects of treatment. However, there is no mention of a plot or any visual representation of the estimated means and observed individual trajectories for each latent class. The context focuses on the statistical analysis and findings rather than visual data representations. ", - [] ,NO
28,19,"To determine if the characteristics of the final class solution are numerically described, we need to look for numerical details such as means, standard deviations (SD), standard errors (SE), sample sizes (n), and confidence intervals (CI) for the identified classes. The context provides detailed numerical descriptions for the three identified classes: Rapid Remitting, Slow Remitting, and Non-Remitting. These descriptions include means, standard deviations, sample sizes, and confidence intervals for PTSD symptoms at various time points, as well as statistical parameters like slopes and quadratic parameters for the classes. Therefore, the characteristics of the final class solution are indeed numerically described. "," - ""The largest class (Rapid Remitting; 56% of the sample) displayed a precipitous drop in symptoms from 1 to 5 months as captured by a significant negative slope (Est = 226.72, SE = 2.28, p,.001), indicating a significant overall drop in symptoms from 10 days to five months, accompanied by a significant positive quadratic parameter, indicating a curvilinear rate of change (Est = 17.16.23, SE = 1.93,p,.001)."" - ""The second largest class (Slow Remitting; 27%) demonstrated a relatively consistent rate of symptom reduction across time points, as indicated by a significant negative slope ( Est = 28.83, SE = 2.50, p,.001) and a non-significant quadratic parameter (Est = 1.95,SE = 0.63,p =.23)."" - ""Finally, the smallest class (Non-Remitting; 17%) demonstrated consistently high symptom severity across time points with no significant change over time, indicated by a non-significant slope (Est = 21.19, SE = 1.68,p =.48) and a non-significant quadratic parameter (Est = 22.67, SE = 1.62,p =.10;Figure 1)."" - ""Table 1.Study Groups’ Comparisons. Non-Remitting (1) Slow Remitting (2) Rapid Remitting (3) Total Sample F (df)/X2 Post-hoc M (SD) n(%) 95% CI M (SD) n(%) 95% CI M (SD) n(%) 95% CI M (SD) n(%) 95% CI (n = 163) (n = 258) n = 536 (n = 957)"" ",YES
28,20,"To determine if the syntax files are available, we need to look for any mention of their availability in the context provided. The context includes details about the study, its results, and references to various methodologies and analyses. However, there is no mention of syntax files being available in the appendix, supplementary materials, or from the authors. The context does not provide any information about the availability of syntax files. ", - [] ,NO
29,0,"To determine if the metric or unit of time used in the statistical model is reported, we need to look for any mention of time intervals or periods in the context. The context mentions ""12 months"" and ""24 months"" in relation to the study period and the measurement of stress scores. This indicates that the unit of time used in the statistical model is months. "," - ""24 months Estimate (s.e.) Estimate (s.e.) Estimate (s.e.) Estimate (s.e.)"" - ""12 months Intercept (mean) 31.066 (2.073)** 20.837 (1.900)** 35.179 (3.854)** 26.083 (2.313)** - ""The quadratic term in the 12-month period was not significant nor did it fit the data, which demonstrates that a small increase in stress scores occurred between 12 and 24 months after the event."" ",YES
29,1,"To determine if information about the mean and variance of time within a wave is presented, we need to look for any mention of statistical measures related to time, such as mean and variance, within the context. The context discusses statistical analyses, including latent growth modeling and comparisons between groups, but does not specifically mention the mean and variance of time within a wave or measurement occasion. There is no evidence provided in the context that directly addresses the mean and variance of time within a wave. ", - [] ,NO
29,2,"To determine if the missing data mechanism is reported, we need to look for any mention of how the missing data were handled or classified in terms of MAR, MNAR, MCAR, or similar terms. The context mentions that missing data were estimated using the full information maximum likelihood method, but it does not specify the missing data mechanism such as MAR, MNAR, or MCAR. Therefore, the missing data mechanism is not reported. "," - ""Missing data were estimated using the full information maximum likelihood method."" ",NO
29,3,"To determine if a description of variables related to attrition or missing data is provided, we need to look for any mention of factors influencing dropout rates, auxiliary variables, or patterns in missing data. The context mentions that missing data were estimated using the full information maximum likelihood method and that a robust maximum likelihood estimator was applied due to non-normal distribution of some variables. However, there is no specific mention of variables related to attrition, dropout effects, auxiliary variables, or skip patterns. Therefore, the answer is NO. "," - ""Missing data were estimated using the full information maximum likelihood method."" - ""Furthermore, we applied a robust maximum likelihood estimator because some of the variables were not normally distributed (e.g., IES, anxiety and dissociation)."" ",NO
29,4,"To determine if a description is provided of how missing data in the analyses were dealt with, we need to look for any mention of specific methods used for handling missing data. The context explicitly states that ""Missing data were estimated using the full information maximum likelihood method."" This indicates that the method used for dealing with missing data is clearly described. "," - ""Missing data were estimated using the full information maximum likelihood method."" ",YES
29,5,"To determine if information about the distribution of the observed variables is included, we need to look for mentions of tests for normality or distribution of variables within the context. The context mentions that ""we applied a robust maximum likelihood estimator because some of the variables were not normally distributed (e.g., IES, anxiety and dissociation)."" This indicates that there was an assessment of the distribution of these variables, specifically noting that they were not normally distributed. Therefore, the context does include information about the distribution of the observed variables. "," - ""we applied a robust maximum likelihood estimator because some of the variables were not normally distributed (e.g., IES, anxiety and dissociation)."" ",YES
29,6,"The question asks whether the software used for statistical analysis is mentioned in the context. The context explicitly states that ""We used Mplus 6.11 [27], a statistical program for the analyses of latent variable models of which LGM is one of the model features."" This clearly indicates that Mplus was the software used for the statistical analysis. "," - ""We used Mplus 6.11 [27], a statistical program for the analyses of latent variable models of which LGM is one of the model features."" ",YES
29,7,"To determine if alternative specifications of within-class heterogeneity are considered and documented, we need to look for mentions of different modeling approaches such as Latent Growth Curve Analysis (LGCA) versus Latent Growth Mixture Modeling (LGMM) in the context. The context discusses the use of Latent Growth Modeling (LGM) and mentions the identification of latent classes, but it does not explicitly compare or document alternative specifications like LGCA or LGMM. The focus is on the application of LGM and the use of cut-off scores to describe trajectories, without mentioning other modeling approaches or a comparison between them. "," - ""Second, we examined latent growth trajectories in the total sample (thereby ignoring the four groups) to identify classes of individuals with different response trajectories during a 2-year period."" - ""Latent Growth Trajectories Investigating Response Classes"" - ""Because the samples within each group (two disaster and two comparison groups) are too small to investigate these response patterns, we described these trajectories using a cut-off score [20]."" ",NO
29,8,"To determine if alternative specifications of the between-class differences in variance-covariance matrix structure are considered and clearly documented, we need to look for any mention of different matrix structures or constraints applied across subgroups in the context. The context discusses statistical analyses, including latent growth modeling (LGM) and the use of cut-off scores to describe trajectories, but it does not mention any specific alternative specifications or constraints applied to the variance-covariance matrix structure across subgroups. There is no evidence of documentation or consideration of different matrix structures such as constrained or fixed across subgroups. ", - [] ,NO
29,9,"To determine if alternative shape/functional forms of the trajectories were described, we need to look for any mention of testing different models, such as quadratic trends or non-linear forms, in the context. The context discusses latent growth trajectories and the use of latent growth modeling (LGM) to analyze changes in posttraumatic stress scores over time. However, there is no specific mention of testing alternative shapes or functional forms, such as quadratic or non-linear trends, to see if they fit the data better. The context focuses on identifying classes of individuals with different response trajectories and using LGM to examine individual growth trajectories, but it does not indicate any exploration of alternative trajectory shapes. "," - ""we examined latent growth trajectories in the total sample (thereby ignoring the four groups) to identify classes of individuals with different response trajectories during a 2-year period."" - ""we conducted a four-group latent growth modeling (LGM) to analyze the changes in posttraumatic stress scores over time, and to identify predictors in the separate groups."" ",NO
29,10,"To determine if the analyses could be replicated, we need to check if the paper specifies how covariates or predictors were used, including whether they were time-varying or time-invariant and at what level they were applied. The context mentions the use of predictors such as TBSA, gender, anxiety, and dissociation in the LGM model, and it specifies the model fit indices (CFI, TLI, RMSEA) and the Bayesian information criterion (BIC). However, it does not explicitly state whether these covariates were time-varying or time-invariant, nor does it specify their application level in relation to the dependent or independent variables. Therefore, the necessary details for replication are not fully provided. "," - ""We added the same predictors as before to the model. Because age was not significantly related to the traumatic stress scores for any of the groups, we removed this variable from further analyses; thus, the LGM model of traumatic stress scores during the first 12 months consisted of TBSA, gender, anxiety, and dissociation (CFI = 0.95, TLI = 0.91, RMSEA = 0.11)."" - ""Moreover, the model improved according to the trade-off between model fit and model complexity as measured by the Bayesian information criterion [28] (BIC change = 106.769)."" ",NO
29,11,"The question asks whether the paper reports information about the number of random start values and final iterations, which is relevant for understanding the convergence of the maximum likelihood estimation in latent trajectory modeling. The context provided includes details about the statistical methods used, such as latent growth modeling (LGM) and the use of Mplus 6.11 for analysis. However, there is no mention of the number of random start values or final iterations in the context provided. The context does mention the use of robust maximum likelihood estimators and the full information maximum likelihood method, but it does not specify details about convergence criteria or iterations. "," - ""We used Mplus 6.11 [27], a statistical program for the analyses of latent variable models of which LGM is one of the model features."" - ""Missing data were estimated using the full information maximum likelihood method."" - ""Furthermore, we applied a robust maximum likelihood estimator because some of the variables were not normally distributed (e.g., IES, anxiety and dissociation)."" ",NO
29,12,"To determine if the model comparison and selection tools are described from a statistical perspective, we need to identify mentions of specific statistical criteria or tools used for model comparison. The context mentions the Bayesian information criterion (BIC) as a tool used to measure the trade-off between model fit and model complexity. This indicates that BIC is used as a statistical tool for model comparison. Additionally, the context refers to the R-squared statistic, which is a measure of variance explained by the model, further supporting the statistical perspective. Therefore, the answer is YES. "," - ""Moreover, the model improved according to the trade-off between model fit and model complexity as measured by the Bayesian information criterion [28] (BIC change = 106.769)."" - ""The R-squared statistic provides the proportion of variance in posttraumatic stress symptoms that is explained by the"" ",YES
29,13,"The context provides information about the latent growth modeling (LGM) analysis conducted in the study. It mentions a ""four-group Latent Growth Modeling"" and describes the evaluation of ""24-month longitudinal traumatic stress scores for the four groups"" and a subsequent analysis over a ""12-month period."" However, there is no mention of a one-class solution or any other specific number of fitted models beyond these two time frames. The context does not provide evidence of a one-class solution being reported. "," - ""Four-group Latent Growth Modeling"" - ""The first model evaluated the 24-month longitudinal traumatic stress scores for the four groups."" - ""Next, we analyzed the LGM model again over a 12-month period."" ",NO
29,14,"The question asks whether the number of cases per class is reported for each model in terms of absolute sample size, sample size per class, or proportion. The context provides specific numbers and proportions for the latent classes identified in the dataset. For example, it mentions that the majority of individuals (n = 130, proportion =.628) had relatively low scores, and it provides similar details for other classes (e.g., acute stress scores with n = 36, proportion = 0.174). This indicates that both absolute sample sizes and proportions are reported for each class. "," - ""As can be seen in Figure 2a, the majority of individuals (n = 130, proportion =.628) had relatively low scores."" - ""Figure 2b and 2c show the trajectory of individuals with acute stress scores that decreased over time (n = 36, proportion = 0.174) and rather high and chronic stress scores (n = 31, proportion = 0.150) respectively."" - ""Finally, in Figure 2d a small group of 10 individuals (proportion = 0.048) showed increased scores, indicating a delayed onset of posttraumatic stress scores."" ",YES
29,15,"To determine if entropy is reported, we need to look for any mention of entropy values, relative entropy, or the number of misclassifications per model in the context. The context provides detailed descriptions of the latent growth trajectories, the number of individuals in each class, and the statistical analysis of stress scores. However, there is no mention of entropy values or misclassification rates in the context provided. ", - [] ,NO
29,16,"The context mentions ""Figure 2. Estimated means and observed individual values representing four classes of response patterns."" This indicates that a plot is included with the estimated mean trajectories of the final solution. Therefore, the answer to the question is YES. "," - ""Figure 2. Estimated means and observed individual values representing four classes of response patterns."" ",YES
29,17,"The context mentions ""Figure 2. Estimated means and observed individual values representing four classes of response patterns"" and ""Figure 3. Trajectories of traumatic stress symptoms."" These references indicate that plots are included with the estimated mean trajectories for each model. The figures are described as showing the estimated means and trajectories, which confirms the presence of plots. "," - ""Figure 2. Estimated means and observed individual values representing four classes of response patterns."" - ""Figure 3. Trajectories of traumatic stress symptoms."" ",YES
29,18,"The context describes Figure 2, which presents the estimated means and observed individual values representing four classes of response patterns. This indicates that the plot includes both the estimated means of the final model and the observed individual trajectories split out for each latent class. "," - ""Figure 2. Estimated means and observed individual values representing four classes of response patterns."" ",YES
29,19,"To determine if the characteristics of the final class solution are numerically described, we need to look for mentions of means, standard deviations (SD), standard errors (SE), sample sizes (n), or confidence intervals (CI) specifically related to the final class solution. The context provides descriptions of the four latent classes identified in the data set, including the number of individuals in each class and their proportions. However, it does not provide numerical descriptions such as means, SD, SE, or CI for these classes. The context does include statistical analysis details and results for the study groups, but these are not specific to the final class solution's characteristics. "," - ""As can be seen in Figure 2a, the majority of individuals (n = 130, proportion =.628) had relatively low scores."" - ""Figure 2b and 2c show the trajectory of individuals with acute stress scores that decreased over time (n = 36, proportion = 0.174) and rather high and chronic stress scores (n = 31, proportion = 0.150) respectively."" - ""Finally, in Figure 2d a small group of 10 individuals (proportion = 0.048) showed increased scores, indicating a delayed onset of posttraumatic stress scores."" ",NO
29,20,"To determine if the syntax files are available, we need to look for any mention of syntax files being provided in the appendix, supplementary materials, or from the authors within the given context. The context provided does not mention any syntax files, nor does it reference any appendix, supplementary materials, or availability from the authors. Therefore, there is no evidence to suggest that syntax files are available. ", - [] ,NO
30,0,"To determine if the metric or unit of time used in the statistical model is reported, we need to look for any mention of time units in the context. The context provides information about the number of hours worked at the WTC site, but it does not specify the unit of time used in the statistical model itself. The context mentions ""Worked more than median hours"" and ""Worked adjacent to pit/pile,"" but it does not explicitly state the time unit (e.g., hours, days, weeks) used in the statistical analysis or model. Therefore, the answer is NO. "," - ""Worked more than median hoursa"" - ""Worked adjacent to pit/pilea"" - No explicit mention of the time unit used in the statistical model. ",NO
30,1,"To determine if information about the mean and variance of time within a wave is presented, we need to look for any mention of statistical measures related to time, such as mean and variance, within the context of measurement occasions or periods of time. The context provided does not mention any specific statistical measures like mean or variance related to time within a wave or any measurement occasion. The focus is on PTSD symptom trajectories, determinants, and related factors, without any explicit mention of time-related statistical measures. ", - [] ,NO
