paper_id,question_id,reasoning,evidence,answer
18,8,"To determine if alternative specifications of the between-class differences in variance-covariance matrix structure are considered and documented, we need to look for any mention of different matrix structures such as constrained or fixed across subgroups. The context provided discusses the use of a generalized, semi-parametric, mixture model and mentions the use of the Bayesian Information Criterion (BIC) for model comparison. However, there is no specific mention of alternative specifications of the variance-covariance matrix structure, such as constrained or fixed across subgroups. Therefore, based on the given context, it appears that these alternative specifications are not considered or documented. "," - ""Different possible models of one to seven groups were compared using the criterion of reasonableness of group size as well as the difference in likelihood expressed as twice the Bayesian Information Criterion (BIC) value (Jones, Nagin, & Roeder, 2001)."" - No mention of alternative specifications of the variance-covariance matrix structure. ",NO
18,9,"The context mentions the use of a generalized, semi-parametric, mixture model to identify trajectories and specifies that maximum likelihood was used to model the shape of the trajectories using polynomial parameters. This implies that different shapes, such as linear or quadratic trends, were considered in the modeling process. The mention of polynomial parameters suggests that non-linear forms were tested to determine the best fit for the data. "," - ""Maximum likelihood was used to model the number (H2), shape (polynomial parameters) and probability of trajectory group membership based on IES scores (H3-H5)."" - ""To avoid correlation of polynomial coefficients, time of measurement was recoded to center at zero."" ",YES
18,10,"To determine if the analyses could be replicated, we need to check if the paper specifies how covariates or predictors were used, including whether they were time-varying or time-invariant and at what level they were applied. The context mentions that potential injury, child, and parent risk factors assessed at Time 1 were analyzed using univariate and multivariate models to affect the probability of trajectory group membership. However, it does not specify whether these covariates were time-varying or time-invariant, nor does it detail their application at the level of dependent or independent variables. Therefore, the necessary information for replication is not provided. "," - ""Potential injury, child and parent risk factors assessed at Time 1 (current and pre-injury status) which could affect the probability of trajectory group membership were analyzed using univariate and multivariate models (H6)."" ",NO
18,11,"The context provides detailed information about the statistical methods and analyses used, including the use of a generalized, semi-parametric, mixture model and maximum likelihood estimation. However, it does not mention specific details about the number of random start values or final iterations used in the analysis. The context focuses on the model comparison, trajectory identification, and statistical criteria used, but it lacks explicit reporting on the convergence criteria or the number of iterations, which are crucial for ensuring that the solution has converged to the global maximum rather than a local maximum. "," - ""Maximum likelihood was used to model the number (H2), shape (polynomial parameters) and probability of trajectory group membership based on IES scores (H3-H5)."" - ""The iterative procedure fine tunes group membership and the parameters of the trajectories until a criterion of little further change in likelihood is achieved."" - No mention of the number of random start values or final iterations. ",NO
18,12,"To determine if the model comparison tools are described from a statistical perspective, we need to identify any mention of statistical criteria or methods used for model comparison. The context mentions the use of the Bayesian Information Criterion (BIC) for comparing different possible models of one to seven groups. The BIC is a well-known statistical criterion used for model selection, indicating that the model comparison tools are indeed described from a statistical perspective."," - ""Different possible models of one to seven groups were compared using the criterion of reasonableness of group size as well as the difference in likelihood expressed as twice the Bayesian Information Criterion (BIC) value (Jones, Nagin, & Roeder, 2001).""",YES
18,13,"The context mentions that different possible models of one to seven groups were compared. This implies that models with one to seven groups were considered. However, it does not explicitly state the total number of fitted models or confirm that a one-class solution was indeed fitted. The context only indicates that models with one to seven groups were compared, not the total number of models fitted. "," - ""Different possible models of one to seven groups were compared using the criterion of reasonableness of group size as well as the difference in likelihood expressed as twice the Bayesian Information Criterion (BIC) value (Jones, Nagin, & Roeder, 2001)."" ",NO
18,14,"To determine if the number of cases per class is reported, we need to look for information in the context that specifies absolute sample sizes, sample sizes per class, or proportions for each model. The context mentions that trajectory analyses identified three optimum trajectories: resilient (78%), recovery (8%), and chronic subclinical (14%). These percentages represent the proportion of parents in each trajectory class. However, there is no mention of the absolute sample size or the sample size per class for each trajectory. Therefore, while proportions are provided, the absolute sample sizes or sample sizes per class are not reported. "," - ""These were either (1) well below clinical level values for the entire period (resilient: 78%), (2) a linear decline from above clinical levels in the first 3 months to below the clinical cutoff (recovery: 8%) or (3) a constant, elevated but subclinical level throughout the post injury period (chronic subclinical: 14%)."" - ""Trajectory modeling does not require individuals to have complete outcome records across time however the gender differences in attrition are addressed in the discussion. No other significant differences were observed for all other relevant factors and outcomes between those with and without complete data at six months."" ",NO
18,15,"To determine if entropy is reported, we need to look for mentions of relative entropy values or the number of misclassifications per model in the context. The context discusses the use of a generalized, semi-parametric, mixture model and mentions criteria like the Bayesian Information Criterion (BIC) for model comparison. However, there is no mention of entropy or misclassification rates in the context provided. Therefore, the answer is NO. ", - [] ,NO
18,16,"The context mentions that the study presents analysis up to 6 months and includes a description of Figure 1, which shows sample mean values and trajectories of weighted average and predicted symptom profiles for parent total subjective distress symptoms (IES) up to six months post-injury. This indicates that a plot is indeed included with the estimated mean trajectories of the final solution. "," - ""Figure 1. Sample mean values and trajectories of weighted average and predicted symptom profiles for parent total subjective distress symptoms (IES) up to six months post-injury."" - ""Solid lines are weighted group averages Dashed lines are predicted values"" ",YES
18,17,"To determine if plots are included with the estimated mean trajectories for each model, we need to look for any mention of figures or visual representations of the trajectories in the context. The context mentions ""Figure 1. Sample mean values and trajectories of weighted average and predicted symptom profiles for parent total subjective distress symptoms (IES) up to six months post-injury."" This indicates that there is a figure included that shows the estimated mean trajectories for the parent total subjective distress symptoms. Therefore, the answer is YES. "," - ""Figure 1. Sample mean values and trajectories of weighted average and predicted symptom profiles for parent total subjective distress symptoms (IES) up to six months post-injury."" ",YES
18,18,"To determine if a plot is included of the combination of estimated means of the final model and the observed individual trajectories split out for each latent class, we need to look for any mention of such a plot in the context. The context describes Figure 1, which shows ""sample mean values and trajectories of weighted average and predicted symptom profiles for parent total subjective distress symptoms (IES) up to six months post-injury."" It mentions ""solid lines are weighted group averages"" and ""dashed lines are predicted values,"" indicating that the figure includes estimated means and predicted trajectories. However, it does not specify that these are split out for each latent class. "," - ""Figure 1. Sample mean values and trajectories of weighted average and predicted symptom profiles for parent total subjective distress symptoms (IES) up to six months post-injury."" - ""Solid lines are weighted group averages"" - ""Dashed lines are predicted values"" ",NO
18,19,"To determine if the characteristics of the final class solution are numerically described, we need to look for any mention of statistical measures such as means, standard deviations (SD), standard errors (SE), sample sizes (n), or confidence intervals (CI) in the context. The context discusses the use of a generalized, semi-parametric, mixture model to identify clusters of trajectories and mentions the use of maximum likelihood and Bayesian Information Criterion (BIC) for model comparison. However, it does not provide specific numerical descriptions of the final class solution, such as means, SD, SE, n, or CI. "," - ""Maximum likelihood was used to model the number (H2), shape (polynomial parameters) and probability of trajectory group membership based on IES scores (H3-H5)."" - ""Different possible models of one to seven groups were compared using the criterion of reasonableness of group size as well as the difference in likelihood expressed as twice the Bayesian Information Criterion (BIC) value (Jones, Nagin, & Roeder, 2001)."" ",NO
18,20,"To determine if the syntax files are available, we need to look for any mention of syntax files in the context provided. The context includes references to various studies and articles, but there is no mention of syntax files being available in the appendix, supplementary materials, or from the authors. The context focuses on the content of the studies and their findings rather than the availability of syntax files. ", - [] ,NO
19,0,"To determine if the metric or unit of time used in the statistical model is reported, we need to look for any mention of time units in the context. The context mentions ""Trajectories of disaster-related PTSD symptoms as a function of time since Hurricane Ike in older persons."" This indicates that the time since the hurricane is a factor in the model. Additionally, it states ""even 15 months later,"" which suggests that months are used as the unit of time in the study. Therefore, the metric or unit of time used in the statistical model is reported as months. "," - ""Trajectories of disaster-related PTSD symptoms as a function of time since Hurricane Ike in older persons."" - ""even 15 months later"" ",YES
19,1,"To determine if information about the mean and variance of time within a wave is presented, we need to look for any mention of statistical measures related to time, such as mean and variance, within the context. The context discusses various assessments and data analysis methods, including latent growth mixture modeling and PTSD symptom assessments, but does not mention any specific statistical measures related to the mean and variance of time within a wave or any similar time-related metrics. ", - [] ,NO
19,2,"To determine if the missing data mechanism is reported, I need to look for any mention of how missing data was handled or characterized in the context. The context discusses the methodology and analysis of the data, including the use of robust full-information maximum likelihood estimation in Mplus, which can handle missing data. However, there is no explicit mention of the missing data mechanism such as MAR, MNAR, or MCAR. The context does not provide any information about how missing data was addressed or classified. ", - [] ,NO
19,3,"To determine if a description is provided about variables related to attrition or missing data, we need to look for any mention of dropout effects, auxiliary variables, or skip patterns in the context. The context discusses data analysis methods, model selection criteria, and determinants of PTSD symptom trajectories but does not mention any specific variables or methods related to attrition or missing data. Therefore, there is no evidence in the context that describes variables related to attrition or missing data.", - [],NO
19,4,"The context mentions the use of ""robust full-information maximum likelihood estimation in Mplus"" for conducting latent growth mixture modeling (LGMM). This indicates that the method used to handle missing data in the analyses is Full Information Maximum Likelihood (FIML). Therefore, a description of how missing data were dealt with is provided in the context. "," - ""To characterize longitudinal trajectories of Hurricane Ike-related PTSD symptoms, we conducted latent growth mixture modeling (LGMM) using robust full-information maximum likelihood estimation in Mplus (Muthén, 2004)."" ",YES
19,5,"To determine if information about the distribution of the observed variables is included, we need to look for mentions of tests for normality or distribution of variables within the context. The context discusses the use of latent growth mixture modeling (LGMM) and various fit statistics like BIC, SSA-BIC, AIC, entropy, LRT, and BLRT to evaluate model fit. However, there is no mention of tests for normality or distribution of the observed variables, such as tests for normally distributed variables within classes or multivariate normality. "," - ""To characterize longitudinal trajectories of Hurricane Ike-related PTSD symptoms, we conducted latent growth mixture modeling (LGMM) using robust full-information maximum likelihood estimation in Mplus (Muthén, 2004)."" - ""We then compared 2- to 6-class unconditional LGMMs and assessed their relative fit using conventional indices, including the Bayesian Information Criterion (BIC), sample size-adjusted BIC (SSA-BIC), Akaike Information Criterion (AIC), entropy, the Lo-Mendell-Rubin likelihood ratio test (LRT; Lo et al., 2001), and the bootstrapped likelihood ratio test (BLRT; McLachlan and Peel, 2000; Nylund et al., 2007)."" ",NO
19,6,"To determine if the software used for statistical analysis is mentioned, we need to look for any references to specific software in the context. The context explicitly states that ""latent growth mixture modeling (LGMM) using robust full-information maximum likelihood estimation in Mplus"" was conducted. This indicates that Mplus was the software used for the statistical analysis. There is no mention of other software like R in the context provided. "," - ""To characterize longitudinal trajectories of Hurricane Ike-related PTSD symptoms, we conducted latent growth mixture modeling (LGMM) using robust full-information maximum likelihood estimation in Mplus (Muthén, 2004)."" ",YES
19,7,"To determine if alternative specifications of within-class heterogeneity are considered, we need to look for mentions of different modeling approaches or comparisons between them. The context discusses the use of latent growth mixture modeling (LGMM) and mentions specific criteria for model selection. However, there is no mention of alternative specifications such as latent growth curve analysis (LGCA) or any comparison between LGCA and LGMM. The focus is solely on LGMM and its application without reference to other models. "," - ""To characterize longitudinal trajectories of Hurricane Ike-related PTSD symptoms, we conducted latent growth mixture modeling (LGMM) using robust full-information maximum likelihood estimation in Mplus (Muthén, 2004)."" - ""We then compared 2- to 6-class unconditional LGMMs and assessed their relative fit using conventional indices..."" ",NO
19,8,"To determine if alternative specifications of the between-class differences in variance-covariance matrix structure are considered and clearly documented, we need to look for any mention of such specifications in the context. The context discusses the use of latent growth mixture modeling (LGMM) and the criteria for selecting the best-fitting model, but it does not mention any specific alternative specifications of the variance-covariance matrix structure, such as constrained or fixed across subgroups. Therefore, there is no evidence in the context that these specifications were considered or documented. ", - [] ,NO
19,9,"The context discusses the use of latent growth mixture modeling (LGMM) to evaluate longitudinal trajectories of PTSD symptoms. It mentions the use of conventional indices like BIC, SSA-BIC, AIC, entropy, LRT, and BLRT to assess model fit. However, there is no mention of testing alternative shape or functional forms of the trajectories, such as quadratic trends or non-linear forms. The focus is on determining the number of classes (trajectories) rather than the shape of the trajectories themselves. "," - ""To characterize longitudinal trajectories of Hurricane Ike-related PTSD symptoms, we conducted latent growth mixture modeling (LGMM) using robust full-information maximum likelihood estimation in Mplus (Muthén, 2004)."" - ""We then compared 2- to 6-class unconditional LGMMs and assessed their relative fit using conventional indices, including the Bayesian Information Criterion (BIC), sample size-adjusted BIC (SSA-BIC), Akaike Information Criterion (AIC), entropy, the Lo-Mendell-Rubin likelihood ratio test (LRT;Lo et al., 2001), and the bootstrapped likelihood ratio test (BLRT; McLachlan and Peel, 2000; Nylund et al., 2007)."" ",NO
19,10,"To determine if the analyses could be replicated, we need to check if the study specifies how covariates or predictors were used, including whether they were time-varying or time-invariant and at what level they were applied. The context describes the use of pre-, peri-, and post-disaster variables in a stepwise multinomial logistic regression analysis, with variables associated with trajectory group membership at the p < 0.05 level in bivariate analysis being entered as independent variables. It also mentions handling correlated variables by computing a composite score. However, it does not explicitly state whether these covariates are time-varying or time-invariant, nor does it specify the level at which they were applied (dependent or independent variables). Therefore, the context does not provide enough detail to confirm that the analyses could be replicated based on the use of covariates or predictors. "," - ""To characterize determinants of longitudinal trajectories of Hurricane Ike-related PTSD symptoms, we conducted a stepwise multinomial logistic regression analysis."" - ""Pre-, peri-, and post-disaster variables associated with trajectory group membership at the p < 0.05 level in bivariate analysis of variance or c2 analyses were entered as independent variables."" - ""If any of the independent variables were correlated at the r > 0.50 level (e.g., number of traumas and stressors before and after Ike), a composite score was computed and entered into this analysis."" ",NO
19,11,"To determine if information about the number of random start values and final iterations is reported, we need to look for any mention of these details in the context. The context discusses the use of latent growth mixture modeling (LGMM) and mentions the use of robust full-information maximum likelihood estimation in Mplus. However, it does not provide specific details about the number of random start values or final iterations used in the analysis. There is no mention of convergence criteria or whether the final class solution has converged to the maximum of the ML distribution. "," - ""To characterize longitudinal trajectories of Hurricane Ike-related PTSD symptoms, we conducted latent growth mixture modeling (LGMM) using robust full-information maximum likelihood estimation in Mplus (Muthén, 2004)."" - No mention of the number of random start values or final iterations. ",NO
19,12,"The context provides detailed information about the model comparison and selection tools used in the study. It mentions several statistical indices such as the Bayesian Information Criterion (BIC), sample size-adjusted BIC (SSA-BIC), Akaike Information Criterion (AIC), entropy, the Lo-Mendell-Rubin likelihood ratio test (LRT), and the bootstrapped likelihood ratio test (BLRT). These are all well-known statistical tools used for model comparison and selection in statistical analysis. The context also explains how these tools are used to determine the best-fitting model, indicating a statistical perspective in their application. "," - ""We then compared 2- to 6-class unconditional LGMMs and assessed their relative fit using conventional indices, including the Bayesian Information Criterion (BIC), sample size-adjusted BIC (SSA-BIC), Akaike Information Criterion (AIC), entropy, the Lo-Mendell-Rubin likelihood ratio test (LRT;Lo et al., 2001), and the bootstrapped likelihood ratio test (BLRT; McLachlan and Peel, 2000; Nylund et al., 2007)."" - ""We identiﬁed the best-ﬁtting model based on smaller BIC, SSA-BIC, and AIC values, higher entropy values, and on results of the LRT and the BLRT, which quantify the likelihood that the data can be better described by a model with one less trajectory."" ",YES
19,13,"To determine if the total number of fitted models is reported, including a one-class solution, we need to examine the section of the context that lists the fit statistics of latent growth mixture models. The context provides a table with fit statistics for models ranging from 1-class to 6-class solutions. This indicates that the total number of fitted models, including the one-class solution, is indeed reported. "," - ""1-class /C0 2067.02 4176.67 4151.32 4150.04 ee e"" - ""2-class /C0 2007.53 4073.68 4038.82 4037.07.965.0009 <.00001"" - ""3-class /C0 1975.70 4025.98 3981.62 3979.39.933.20 <.0001"" - ""4-class /C0 1955.90 4002.38 3948.51 3945.80.931.22 <.00001"" - ""5-class /C0 1935.94 3978.44 3915.07 3911.88.928.18 <.00001"" - ""6-class /C0 1918.53 3959.59 3886.72 3883.05.932.19 <.0001"" ",YES
19,14,"To determine if the number of cases per class is reported for each model, we need to look for information in the context that specifies the absolute sample size, sample size per class, or proportion for each class in the models. The context mentions that in the 3-class model, 162 (78.7%) respondents had no/low disaster-related PTSD symptoms over time. This provides the sample size per class and the proportion for one of the classes in the 3-class model. However, there is no mention of the absolute sample size or sample size per class for the other models (1-class, 2-class, 4-class, 5-class, 6-class). Therefore, the number of cases per class is not reported for each model. "," - ""In this model, 162 (78.7%) respondents had no/low disaster-related PTSD symptoms over time."" - ""Table 1 shows fit statistics of 1e6 class solutions of disaster-related PTSD symptoms over the three assessments."" ",NO
19,15,"The context discusses the use of entropy values in the process of selecting the best-fitting model for characterizing longitudinal trajectories of PTSD symptoms. Specifically, it mentions that entropy values were highest for the 2- and 3-class models, indicating that entropy is indeed reported as part of the model evaluation process. This suggests that entropy is used to assess the classification accuracy of the models, which aligns with the goal of classifying cases in a trajectory. "," - ""entropy values were highest for the 2- and 3-class models"" - ""we chose the 3-class model as optimal. In this model, 162 (78.7%) respon-"" ",YES
19,16,"To determine if a plot is included with the estimated mean trajectories of the final solution, we need to look for any mention of a figure or plot that represents these trajectories. The context mentions ""Fig. 1. Trajectories of disaster-related PTSD symptoms as a function of time since Hurricane Ike in older persons."" This indicates that a figure is included in the paper, which likely represents the estimated mean trajectories of the final solution. "," - ""Fig. 1. Trajectories of disaster-related PTSD symptoms as a function of time since Hurricane Ike in older persons."" ",YES
19,17,"To determine if plots are included with the estimated mean trajectories for each model, we need to look for any mention of figures or visual representations of the trajectories in the context. The context mentions ""Fig. 1. Trajectories of disaster-related PTSD symptoms as a function of time since Hurricane Ike in older persons."" This indicates that there is a figure included that represents the trajectories of PTSD symptoms over time. "," - ""Fig. 1. Trajectories of disaster-related PTSD symptoms as a function of time since Hurricane Ike in older persons."" ",YES
