paper_id,question_id,reasoning,evidence,answer
0,0,"To determine if the metric or unit of time used in the statistical model is reported, we need to look for any mention of time intervals in the context. The context provides specific time points at which data was collected or analyzed: 3 months, 12 months, 24 months, and 6 years. These time points indicate that the units of time used in the statistical model are months and years. "," - ""Table 2 presents the odds ratios of impaired functioning (as indexed by the WHOQOL) for each trajectory class at 3, 12, 24 months and 6 years."" - ""Participants in the worsening/recovery class (8%) displayed a pattern of relatively low initial symptoms of PTSD that increase over the subsequent 24 months before returning to their initial level by the 6-year measurement."" - ""Individuals in the worsening class (10%) displayed a trajectory in which participants report relatively low levels of PTSD symptoms at baseline but these increase gradually over the subsequent 6 years."" ",YES
0,1,"To determine if information about the mean and variance of time within a wave is presented, I need to look for any mention of statistical measures such as mean and variance related to time within a specific measurement occasion or period. The context provided discusses various aspects of PTSD assessment, demographic characteristics, and data analysis methods, but does not mention any specific statistical measures related to time within a wave. There is no evidence of mean and variance calculations for time within a wave in the provided context. ", - [] ,NO
0,2,"To determine if the missing data mechanism is reported, we need to look for any mention of how missing data was handled or characterized in the context. The context mentions that Mplus employs a robust full information maximum likelihood estimation procedure to account for missing data. However, it does not specify the missing data mechanism such as missing at random (MAR), missing not at random (MNAR), or missing completely at random (MCAR). Therefore, the missing data mechanism is not reported in the context. "," - ""Mplus employs a robust full information maximum likelihood estimation procedure to account for missing data."" ",NO
0,3,"To determine if a description of variables related to attrition or missing data is provided, we need to look for any mention of how missing data was handled or any factors related to dropout. The context mentions that Mplus employs a robust full information maximum likelihood estimation procedure to account for missing data, but it does not provide specific details about variables related to attrition or dropout effects. There is no mention of auxiliary variables, skip patterns, or specific dropout effects in the context provided. "," - ""Mplus employs a robust full information maximum likelihood estimation procedure to account for missing data."" ",NO
0,4,"The context provides information on how missing data were handled in the analyses. It mentions that Mplus employs a robust full information maximum likelihood estimation procedure to account for missing data. Additionally, it states that multiple imputation in MPlus was used to impute missing values of covariates. Both methods are explicitly described, indicating that the paper provides a description of how missing data were dealt with. "," - ""Mplus employs a robust full information maximum likelihood estimation procedure to account for missing data."" - ""We used multiple imputation in MPlus to impute missing values of covariates."" ",YES
0,5,"To determine if information about the distribution of the observed variables is included, we need to look for mentions of tests for normality, such as tests for normally distributed variables within classes or multivariate normality. The context provided discusses the structure of the models, class membership proportions, and the impact of covariates on model fit. However, there is no mention of tests for normality or the distribution of observed variables. Therefore, the answer is NO. "," - ""The structure of the five-class solution remained consistent between the unconditional and conditional models."" - ""Class membership proportions, and intercept, linear slope and quadratic slope parameters for each class are presented in online Table DS2 for the unconditional and conditional models."" - ""We employed latent class growth analysis (LCGA) to examine PTSD trajectories, using Mplus version 6.2 for Windows."" - ""Mplus employs a robust full information maximum likelihood estimation procedure to account for missing data."" ",NO
0,6,"The question asks whether the software used for statistical analysis is mentioned in the context. The context explicitly states that ""We employed latent class growth analysis (LCGA) to examine PTSD trajectories, using Mplus version 6.2 for Windows."" This clearly identifies the software used for the analysis as Mplus. "," - ""We employed latent class growth analysis (LCGA) to examine PTSD trajectories, using Mplus version 6.2 for Windows."" ",YES
0,7,"To determine if alternative specifications of within-class heterogeneity, such as Latent Class Growth Analysis (LCGA) versus Latent Growth Mixture Modeling (LGMM), are considered and documented, we need to look for mentions of these methods in the context. The context explicitly mentions the use of LCGA to examine PTSD trajectories. However, there is no mention of LGMM or any comparison between LCGA and LGMM. The context does mention LGMM in a different context, referring to its application in studying PTSD responses following traumatic events, but it does not indicate that LGMM was used or compared in this study. Therefore, alternative specifications of within-class heterogeneity are not considered or documented in this context. "," - ""We employed latent class growth analysis (LCGA) to examine PTSD trajectories, using Mplus version 6.2 for Windows."" - ""In recent years latent growth mixture modelling (LGMM) has been applied to studying PTSD responses following traumatic events."" ",NO
0,8,"To determine if alternative specifications of the between-class differences in variance-covariance matrix structure are considered and documented, we need to look for any mention of different matrix structures or constraints applied across subgroups in the context. The context discusses the inclusion of covariates and the consistency of class membership and parameters across models but does not mention any specific alternative specifications or constraints on the variance-covariance matrix structure. Therefore, there is no evidence in the context that alternative specifications are considered or documented. ", - [] ,NO
0,9,"The context discusses the use of latent class growth analysis (LCGA) to examine PTSD trajectories and mentions the inclusion of linear and quadratic slope parameters for each class. This indicates that both linear and quadratic trends were considered in the analysis. However, there is no mention of testing alternative shape or functional forms beyond these linear and quadratic trends. The context does not provide evidence of testing non-linear forms or other alternative shapes for the trajectories. "," - ""Class membership proportions, and intercept, linear slope and quadratic slope parameters for each class are presented in online Table DS2 for the unconditional and conditional models."" - ""Similarly, the magnitude and significance of intercept, linear slope and quadratic slope parameters remained consistent across the unconditional and conditional models, with the exception of the quadratic slope component of the resilient class, which was statistically significant in the unconditional model, but not in the conditional model."" ",NO
0,10,"To determine if the analyses could be replicated, we need to check if the context provides details on how covariates or predictors were used, such as specifying whether they were time-varying or time-invariant, and at what level they were applied. The context mentions the inclusion of covariates in the conditional model and lists specific covariates like gender, mTBI, and life events at different time points. It also states that only significant covariates that improved model fit were retained. However, it does not explicitly mention whether these covariates were time-varying or time-invariant, nor does it specify their application at the level of dependent or independent variables. Therefore, the context lacks sufficient detail for replication. "," - ""Following the unconditional model, we examined a series of nested five-class models to investigate the impact of the inclusion of covariates on model fit."" - ""Significant covariates included gender, mTBI and life events at 3 months, 12 months and 24 months following trauma exposure."" - ""Only covariates that were significant predictors of class membership and improved model fit were retained in the final solution."" ",NO
0,11,"To determine if information about the number of random start values and final iterations is reported, we need to look for specific details in the context regarding the estimation process of the latent trajectory model. The context mentions the use of Mplus version 6.2 and a robust full information maximum likelihood estimation procedure, but it does not provide details about the number of random start values or final iterations. There is no mention of convergence criteria or whether the final class solution has converged to the maximum of the ML distribution. "," - ""We employed latent class growth analysis (LCGA) to examine PTSD trajectories, using Mplus version 6.2 for Windows."" - ""Mplus employs a robust full information maximum likelihood estimation procedure to account for missing data."" ",NO
0,12,"To determine if the model comparison and selection tools are described from a statistical perspective, we need to look for mentions of specific statistical criteria or methods used for model comparison, such as BIC (Bayesian Information Criterion), AIC (Akaike Information Criterion), or other statistical measures. The context discusses the process of identifying the best-fitting unconditional trajectory model by comparing the model fit of progressive numbers of classes and integrating covariates into the model. However, it does not mention any specific statistical criteria or tools like BIC or AIC used for this comparison. Therefore, the context does not describe the model comparison tools from a statistical perspective. "," - ""We first identified the best-fitting unconditional trajectory model by comparing the model fit of progressive numbers of classes."" - ""We then tested a series of nested models using the five-class solution to identify covariates that improved model fit."" ",NO
0,13,"To determine if the total number of fitted models, including a one-class solution, is reported, we need to look for any mention of the number of models compared in the context. The context discusses the identification of the best-fitting unconditional trajectory model by comparing the model fit of progressive numbers of classes. However, it does not specify the exact number of models, including whether a one-class solution was considered. There is no explicit mention of the total number of models fitted. "," - ""We first identified the best-fitting unconditional trajectory model by comparing the model fit of progressive numbers of classes."" ",NO
0,14,"To determine if the number of cases per class is reported, we need to look for information about absolute sample sizes, sample sizes per class, or proportions for each model. The context provides class membership proportions for both unconditional and conditional models, such as ""Chronic unconditional 5.2% v. conditional 5.2%"". This indicates that proportions are reported. However, there is no mention of absolute sample sizes or sample sizes per class. Therefore, only proportions are reported, not the absolute or per-class sample sizes. "," - ""Class membership proportions, and intercept, linear slope and quadratic slope parameters for each class are presented in online Table DS2 for the unconditional and conditional models."" - ""Class membership remained largely consistent across the unconditional and conditional models (Chronic unconditional 5.2% v. conditional 5.2%; worsening/recovery unconditional 8.1%v. conditional 8.1%, worsening unconditional 9.6% v. conditional 10.2%, recovery unconditional 5.7% v. conditional 8.2%, resilient unconditional 72.3% v. conditional 68.3%)."" ",NO
0,15,"To determine if entropy is reported, we need to look for mentions of entropy values or misclassification rates in the context. The context discusses the structure of the five-class solution, class membership proportions, and the impact of covariates on model fit. However, there is no mention of entropy values or misclassification rates, which are typically used to assess the quality of classification in trajectory models.", - [],NO
0,16,"To determine if a plot is included with the estimated mean trajectories of the final solution, we need to look for any mention of a figure or plot that displays these trajectories. The context mentions ""Figure 1 displays the trajectories identified in the five-class solution,"" which indicates that a plot is indeed included with the estimated mean trajectories of the final solution. "," - ""Figure 1 displays the trajectories identified in the five-class solution."" ",YES
0,17,"To determine if plots are included with the estimated mean trajectories for each model, we need to look for any mention of figures or visual representations of the trajectories in the context. The context mentions ""Figure 1 displays the trajectories identified in the five-class solution,"" indicating that there is a figure included that shows the trajectories. This suggests that plots are indeed included with the estimated mean trajectories for the models discussed. "," - ""Figure 1 displays the trajectories identified in the five-class solution."" ",YES
0,18,"To determine if a plot is included of the combination of estimated means of the final model and the observed individual trajectories split out for each latent class, we need to look for any mention of such a plot in the context. The context discusses the identification of PTSD trajectories using latent class growth analysis and mentions Figure 1, which displays the trajectories identified in the five-class solution. However, it does not specify that Figure 1 includes both the estimated means of the final model and the observed individual trajectories split out for each latent class. Therefore, based on the provided context, there is no explicit evidence that such a plot is included. "," - ""Figure 1 displays the trajectories identified in the five-class solution."" - No mention of a plot combining estimated means and observed individual trajectories split out for each latent class. ",NO
0,19,"To determine if the characteristics of the final class solution are numerically described, we need to look for mentions of statistical measures such as means, standard deviations, standard errors, sample sizes, or confidence intervals in the context. The context provides information about class membership proportions and mentions that intercept, linear slope, and quadratic slope parameters are presented in an online table. However, it does not provide specific numerical descriptions like means, SD/SE, n, or CI within the given text. Therefore, based on the provided context, there is no evidence of numerical descriptions of the final class solution characteristics. "," - ""Class membership proportions, and intercept, linear slope and quadratic slope parameters for each class are presented in online Table DS2 for the unconditional and conditional models."" - No mention of means, SD/SE, n, CI, etc., in the provided context. ",NO
0,20,"To determine if the syntax files are available, we need to look for any mention of syntax files being provided in the appendix, supplementary materials, or from the authors. The context mentions the use of Mplus version 6.2 for Windows and multiple imputation in MPlus, but it does not specify that syntax files are included in the appendix, supplementary materials, or available from the authors. There is no direct evidence in the provided context that syntax files are available. ", - [] ,NO
1,0,"To determine if the metric or unit of time used in the statistical model is reported, we need to look for any mention of time intervals or units in the context. The context specifies that the intervals between follow-up time points were unequal, with the first time point set to 0, the second to 1, and the third to 5. However, it does not explicitly state the unit of time (e.g., months, years) used for these intervals. Therefore, the metric or unit of time is not reported in the context. "," - ""In the current study, the intervals between the follow-up time points were unequal, so the first time point was set to 0, the second to 1 and the third to 5."" ",NO
1,1,"To determine if information about the mean and variance of time within a wave is presented, we need to look for any mention of statistical measures such as mean and variance related to time within a specific measurement occasion or period. The context provided does not include any specific details or data about the mean and variance of time within a wave, measurement occasion, or period. The context primarily discusses various scales, questionnaires, and their applications in studies, but does not provide statistical details about time measures. ", - [] ,NO
1,2,"To determine if the missing data mechanism is reported, we need to look for any mention of how the missing data was handled or characterized in the context. The context mentions that Mplus 7 estimates missing data using maximum-likelihood procedures, but it does not specify the missing data mechanism such as MAR, MNAR, or MCAR. Therefore, there is no evidence in the context that explicitly reports the missing data mechanism. "," - ""Mplus 7 estimates missing data using maximum-likelihood procedures."" ",NO
1,3,"To determine if a description of variables related to attrition or missing data is provided, we need to look for any mention of factors influencing dropout rates, auxiliary variables, or patterns in missing data. The context discusses the number of participants who dropped out, were not located, and those who completed follow-ups, but it does not provide specific variables or factors related to these attrition rates or missing data. There is no mention of dropout effects, auxiliary variables, or skip patterns in the context provided. "," - ""Drop-outs (n = 16)"" - ""Not located (n = 4)"" - ""3 months follow-up"" - ""1 year follow-up"" - ""The IES-R data were available for 114 out of the 118 patients at 3 months, 107 patients at 1 year and 89 patients at 5 years after the injury."" - ""One case had missing data for the IES-R at all of the time points; thus, the data were estimated from 117 individuals."" ",NO
1,4,"To determine if a description of how missing data were handled is provided, we need to look for any mention of specific methods such as listwise deletion, multiple imputation, or full information maximum likelihood (FIML). The context mentions that ""Mplus 7 estimates missing data using maximum-likelihood procedures."" This indicates that the method used to handle missing data is maximum likelihood estimation, which is a form of full information maximum likelihood (FIML). Therefore, the answer to the question is YES. "," - ""Mplus 7 estimates missing data using maximum-likelihood procedures."" ",YES
1,5,"To determine if information about the distribution of the observed variables is included, we need to look for mentions of tests for normality or multivariate normality within the context. The context discusses various statistical methods and tests used for model selection and comparison, such as the Bayesian Information Criterion (BIC), Bootstrap likelihood ratio test (BLRT), and Lo-Mendell-Rubin adjusted likelihood ratio test (LMR). It also mentions the use of chi-square tests and ANOVA for examining differences between class memberships. However, there is no mention of tests for the normal distribution of variables within classes or multivariate normality. Therefore, the answer is NO. "," - ""The Bayesian Information Criterion (BIC), Bootstrap likelihood ratio test (BLRT) and Lo-Mendell-Rubin adjusted likelihood ratio test (LMR) were evaluated to compare the fit of alternative models."" - ""Differences between class memberships were examined with chi-square tests on the nominal level data and with one-way analyses of variance (ANOVA) on the interval level data."" - No mention of tests for normality or multivariate normality. ",NO
1,6,"To determine if the software used for statistical analysis is mentioned, we need to look for any references to specific software tools in the context. The context mentions ""PAWS Statistics 18.0 (formerly SPSS)"" and ""Mplus version 7"" as the software used for data analyses and growth mixture modelling (GMM), respectively. Therefore, the answer to the question is YES. "," - ""Data analyses were performed using PAWS Statistics 18.0 (formerly SPSS)."" - ""we applied growth mixture modelling (GMM) using Mplus version 7 [47]."" ",YES
1,7,"To determine if alternative specifications of within-class heterogeneity, such as Latent Growth Curve Analysis (LGCA) versus Latent Growth Mixture Modeling (LGMM), are considered and documented, we need to look for mentions of these methods in the context. The context discusses the use of Growth Mixture Modeling (GMM) and mentions the Bayesian Information Criterion (BIC), Bootstrap likelihood ratio test (BLRT), and Lo-Mendell-Rubin adjusted likelihood ratio test (LMR) for model comparison. However, there is no mention of LGCA or any comparison between LGCA and LGMM. The focus is solely on GMM without reference to alternative models or specifications. "," - ""Growth mixture modelling (GMM) using Mplus version 7 [47]."" - ""The GMM is a longitudinal analysis that explores within and between individual differences in change and individual membership within growth trajectories (classes)."" ",NO
1,8,"To determine if alternative specifications of the between-class differences in variance-covariance matrix structure are considered and documented, we need to look for any mention of different matrix structures such as constrained or fixed across subgroups in the context. The context discusses the use of GMM and mentions model fit statistics, but it does not provide any specific details about the variance-covariance matrix structure or its specifications across subgroups. There is no evidence in the context that alternative specifications of the variance-covariance matrix structure were considered or documented. ", - [] ,NO
1,9,"The context provides details about the methods used to evaluate model fit, such as the Bayesian Information Criterion (BIC), Bootstrap likelihood ratio test (BLRT), and Lo-Mendell-Rubin adjusted likelihood ratio test (LMR). It also mentions the use of growth mixture models (GMM) to examine emotional distress trajectories. However, there is no mention of testing alternative shape or functional forms of the trajectories, such as quadratic trends or non-linear forms. The context focuses on comparing different class solutions and evaluating the fit of these models but does not indicate any exploration of different trajectory shapes or functional forms. "," - ""study, the Bayesian Information Criterion (BIC), Bootstrap likelihood ratio test (BLRT) and Lo-Mendell-Rubin adjusted likelihood ratio test (LMR) were evaluated to compare the fit of alternative models (i.e. 1- to 6-class solutions)."" - ""The GMM analysis was used to examine the emotional distress trajectories (IES-R total score)."" - ""The 4-class model provided the strongest goodness of fit to the data with significantp values for both the LMR and BLRT and lower values for the BIC."" ",NO
1,10,"To determine if the analyses could be replicated, we need to check if the study reports the use of covariates or predictors, and how they were applied (e.g., time-varying or time-invariant). The context mentions the use of the Bayesian Information Criterion (BIC), Bootstrap likelihood ratio test (BLRT), and Lo-Mendell-Rubin adjusted likelihood ratio test (LMR) for model selection, and chi-square tests and ANOVA for examining differences between class memberships. However, it does not specify whether covariates or predictors were used, nor does it detail if they were time-varying or time-invariant. Without this information, we cannot conclude that the analyses could be replicated based on the use of covariates or predictors. "," - ""The Bayesian Information Criterion (BIC), Bootstrap likelihood ratio test (BLRT) and Lo-Mendell-Rubin adjusted likelihood ratio test (LMR) were evaluated to compare the fit of alternative models."" - ""Differences between class memberships were examined with chi-square (/C312) tests on the nominal level data (e.g. gender, marital status, substance abuse and employment) and with one-way analyses of variance (ANOVA) on the interval level data (e.g. age, education and questionnaires)."" ",NO
