paper_id,question_id,reasoning,evidence,answer
8,9,"The context mentions that the researchers used Latent Growth Mixture Modeling (LGMM) to identify heterogeneous trajectories of PTSD symptoms over time. It specifically states that they estimated linear as well as quadratic terms to accommodate expected fluctuations over time. This indicates that they considered both linear and quadratic trends in their analysis. There is no mention of testing other non-linear forms beyond these two, so the context does not provide evidence of alternative shape/functional forms being tested. "," - ""To accommodate expected fluctuations over time, we estimated linear as well as quadratic terms."" ",NO
8,10,"To determine if the analyses could be replicated, we need to check if the study provides sufficient details about the covariates or predictors used, including whether they are time-varying or time-invariant, and how they are related to the dependent or independent variables. The context mentions that stepwise multivariable hierarchical logistic regression analyses were used, with variables selected based on their significance in univariate analyses. Variables were entered in the order of collection, which includes background, demographic, and personality variables at Time 1, deployment stressors at Time 3, and post-deployment support and life events at Time 6. This suggests a structured approach to including covariates. However, the context does not explicitly state whether these covariates are time-varying or time-invariant, nor does it provide detailed information on how they are related to the dependent or independent variables. Therefore, while the study provides some structure, it lacks explicit details necessary for full replication. "," - ""Stepwise multivariable hierarchical logistic regression analyses were used to examine potential predictors of class membership."" - ""Potential predictors entered into these analyses were entered into the full model in the order of collection; namely background, demographic, and personality variables collected at Time 1, deployment stressors collected at Time 3, and post deployment support and life events after deployment collected at Time 6."" - ""Only results from the final model will be described."" ",NO
8,11,"The context provides detailed information about the data analytic approach, including the use of Latent Growth Mixture Modeling (LGMM) and the criteria for model selection. However, it does not mention specific details about the number of random start values or final iterations used in the estimation process. The context focuses on the model selection criteria such as fit indices, entropy, and parsimony, but does not provide information on the convergence criteria or the number of iterations. "," - ""We used Latent Growth Mixture Modeling (LGMM) to empirically identify heterogeneous trajectories of PTSD-symptoms over time."" - ""Initially, we estimated a series of LGMM-models with number of classes ranging from 1-8."" - ""We evaluated these models based on available fit indices, namely the Bayesian Information Criteria (BIC), the Akaike Information Criteria (AIC), and the Sample-Size adjusted BIC (SSBIC)."" - ""Since the fit indices of these models did not unequivocally suggest on model over the others, we evaluated meaningfulness and parsimony of each model carefully."" ",NO
8,12,"The context provides detailed information about the model comparison and selection tools used in the study. It mentions specific statistical criteria such as the Bayesian Information Criteria (BIC), Akaike Information Criterion (AIC), and Sample-Size adjusted BIC (SSBIC), which are standard statistical tools for model comparison. Additionally, it discusses the entropy of the model and the use of the Lo-Mendell-Rubin likelihood ratio test (LMR) and the Bootstrap Likelihood Ratio Test (BLRT), which are also statistical methods for evaluating model fit and improvement. The context explicitly states that these fit indices are used to evaluate the models, indicating a statistical perspective in model comparison and selection. "," - ""We evaluated these models based on available fit indices, namely the Bayesian Information Criteria (BIC), the Akaike Information Criteria (AIC; 4), and the Sample-Size adjusted BIC (SSBIC)."" - ""Furthermore, we assessed the entropy of the model, which assesses the ability of the model to distinguish between classes (ranges from 0-1, where values closer to 1 represents better distinction by the model)."" - ""Finally, we tested the improvement in fit with the addition of each extra class by implementing the Lo-Mendell-Rubin likelihood ratio test (LMR; 5) and the Bootstrap Likelihood Ratio Test (BLRT)."" ",YES
8,13,"To determine if the total number of fitted models reported includes a one-class solution, we need to examine the context for any mention of models with varying numbers of classes. The context provides a table titled ""Goodness-of-Fit Statistics for 1 to 8 Class Solutions,"" which lists models ranging from 1 to 8 classes. This indicates that models with 1 to 8 classes were indeed fitted and reported. "," - ""Model AIC BIC Adj BIC Entropy"" - ""1 class 16,574.38 16,617.68 16,585.94"" - ""2 classes 16,320.67 16,381.29 16,366.85 0.92 <.001 <.001"" - ""3 classes 16,128.74 16,206.68 16,149.54 0.93.27 <.001"" - ""4 classes 16,003.76 16,099.02 16,029.18 0.93.19 <.001"" - ""5 classes 15,933.67 16,046.25 15,936.71 0.93.8 <.001"" - ""6 classesa 15,836.67 15,966.56 15,871.32 0.93.35 <.001"" - ""7 classes 15,765.28 15,903.49 15,795.56 0.94.11 <.001"" - ""8 classes 15,707.89 15,872.42 15,751.79 0.93.21 <.001"" ",YES
8,14,"To determine if the number of cases per class is reported for each model, we need to look for information in the context that specifies either the absolute sample size, sample size per class, or the proportion of participants in each class. The context mentions that one class in the 7-class model contained only 1.5% of the participants and that two classes in the six-class model were small (2.0% and 2.7% of the participants, respectively). However, it does not provide the absolute sample size or the sample size per class for each model. The context only provides proportions for specific classes in the 7-class and six-class models, not for all classes across all models. "," - ""One class in the 7-class model contained only 1.5% of the participants."" - ""Two classes in this model were small (2.0 and 2.7% of the participants, respectively)."" ",NO
8,15,"The context discusses the use of entropy as a measure to assess the ability of the model to distinguish between classes. It specifically mentions that entropy values are reported for models with 3 through 8 classes, indicating that entropy is indeed used as a metric in the classification of cases in a trajectory. The entropy values range from 0 to 1, with values closer to 1 representing better distinction by the model. Therefore, the context confirms that entropy is reported when classifying cases in a trajectory. "," - ""The entropy was identical for models with 3 through 6 classes (.93) increasing marginally with the addition of the 7th (.94) class and then returning to the 6-class entropy level for the 8-class model (.93)."" - ""Furthermore, we assessed the entropy of the model, which assesses the ability of the model to distinguish between classes (ranges from 0-1, where values closer to 1 represents better distinction by the model)."" ",YES
8,16,"To determine if a plot is included with the estimated mean trajectories of the final solution, we need to look for any mention of a figure or plot that represents these trajectories. The context mentions ""Figure 2. Developmental Trajectories of Posttraumatic Stress Disorder (PTSD) Symptoms at 6 Time Points Before, During, and After Deployment (N = 561)"" which suggests that a plot is indeed included. This figure is described as showing the developmental trajectories of PTSD symptoms, which aligns with the estimated mean trajectories of the final solution. "," - ""Figure 2. Developmental Trajectories of Posttraumatic Stress Disorder (PTSD) Symptoms at 6 Time Points Before, During, and After Deployment (N = 561)"" - ""Six unique PTSD symptom trajectories were identified (Figure 2), for which we here present trajectory slopes (S) and quadratic (Q) estimates."" ",YES
8,17,"To determine if plots are included with the estimated mean trajectories for each model, we need to look for any mention of figures or visual representations of the trajectories in the context. The context mentions ""Figure 2. Developmental Trajectories of Posttraumatic Stress Disorder (PTSD) Symptoms at 6 Time Points Before, During, and After Deployment (N = 561)"" which indicates that there is a figure included that shows the developmental trajectories of PTSD symptoms. This suggests that plots are indeed included with the estimated mean trajectories for the models. "," - ""Figure 2. Developmental Trajectories of Posttraumatic Stress Disorder (PTSD) Symptoms at 6 Time Points Before, During, and After Deployment (N = 561)"" - ""Abbreviations: PCL = PTSD Checklist, SE = standard error."" ",YES
8,18,"To determine if a plot is included of the combination of estimated means of the final model and the observed individual trajectories split out for each latent class, we need to look for any mention of such a plot in the context. The context discusses the use of Latent Growth Mixture Modeling (LGMM) and the selection of a six-class model based on various criteria. However, there is no mention of a plot that combines estimated means of the final model with observed individual trajectories split out for each latent class. The context does not provide any evidence of such a plot being included. ", - [] ,NO
8,19,"To determine if the characteristics of the final class solution are numerically described, we need to look for any mention of numerical descriptors such as means, standard deviations/standard errors, sample sizes, or confidence intervals for the selected model. The context provides details about the goodness-of-fit statistics for various class solutions and mentions the selection of the six-class model. However, it does not provide specific numerical characteristics (like means, SD/SE, n, CI) for the classes within the six-class model. The context focuses on the selection process and the theoretical relevance of the trajectories rather than providing detailed numerical descriptions of the final class solution. "," - ""Hence, we settled on the six class model as the best fit of our data."" - ""Table 1. Goodness-of-Fit Statistics for 1 to 8 Class Solutions"" provides fit indices but not detailed numerical characteristics of the classes. - ""Six unique PTSD symptom trajectories were identified (Figure 2), for which we here present trajectory slopes (S) and quadratic (Q) estimates."" ",NO
8,20,"To determine if the syntax files are available, we need to look for any mention of syntax files in the context provided. The context includes information about the article, its supplementary materials, and references, but there is no mention of syntax files being available in the appendix, supplementary materials, or from the authors. The context focuses on the data analytic approach, the use of Latent Growth Mixture Modeling, and references to various studies and methodologies, but does not specify the availability of syntax files. ", - [] ,NO
9,0,"To determine if the metric or unit of time used in the statistical model is reported, we need to identify any mention of time units in the context. The context mentions three time points: T1 (less than 4 weeks post-trauma), T2 (6 months post-trauma), and T3 (3 years post-trauma). These time points indicate that the units of time used in the statistical model are weeks, months, and years. "," - ""The majority of participants were mothers (n = 80, 83%), with the remainder comprising fathers (n = 7, 7%) and other relations (e.g., aunts, adult siblings, n = 8, 8%). Eighty-eight of the 95 participants completed the assessment at T1 ( <4 weeks posttrauma), 56 completed the T2 assessment (6 months posttrauma), and 52 completed the T3 assessment (3 years posttrauma)."" - ""To perform the trajectory analysis, scores on the PTSD measure are required on at least two of the time points (explained in more detail in the ‘Statistical Analysis’ section)."" ",YES
9,1,"To determine if information about the mean and variance of time within a wave is presented, we need to look for any mention of statistical measures related to time, such as mean and variance, within the context. The context provided includes statistical data and references to various studies, but it does not explicitly mention any mean or variance related to time within a wave or measurement occasion. The data presented (e.g., numbers in parentheses) appear to be related to statistical results of variables rather than time-specific measures. "," - The context includes statistical data such as ""(13.85) (.97) (.004) ( <.001) (.24) ( <.001) (.01)"" but does not specify these as mean and variance of time. - There is no mention of ""mean and variance of time within a wave"" or similar phrases in the context. ",NO
9,2,"To determine if the missing data mechanism is reported, we need to look for any mention of how missing data was handled or classified in the context. The context provides information about the number of participants who could not be contacted and those who agreed to participate, as well as the number of participants who completed assessments at different time points. However, there is no mention of the missing data mechanism, such as whether the data is missing at random (MAR), missing not at random (MNAR), or missing completely at random (MCAR). Therefore, the answer is NO. "," - ""Participants were parents/carers of 2–10-year-old children who were consecutively admitted to a participating emergency department (ED) following the child’s involvement in a MVC."" - ""A total of 312 children were eligible to participate in the study; the families of 120 (38.5%) could not be contacted, while the families of 114 (36.5%) agreed to participate."" - ""To perform the trajectory analysis, scores on the PTSD measure are required on at least two of the time points (explained in more detail in the ‘Statistical Analysis’ section). Consequently, of the 114 parents who consented to participate, data from 95 parents were included in the current study."" - ""There was no difference in the baseline parental PTSD symptom severity (t(86) = 1.09, p =.28) of those who did and did not complete follow-ups."" ",NO
9,3,"The context discusses the study's methodology, results, and limitations, including the issue of high attrition at 3 years post-trauma. It mentions that the study would benefit from replication with a larger sample maintained at long-term follow-up assessments. However, it does not provide a detailed description of variables related to attrition or missing data, such as dropout effects, auxiliary variables, or skip patterns. The context only acknowledges the high attrition rate as a limitation without specifying related variables. "," - ""The analysis assists in accounting for missing data, because of the relatively high attrition at 3 years posttrauma the study would benefit from replication using a larger sample, maintained at long-term follow-up assessments."" ",NO
9,4,"To determine if a description of how missing data were handled is provided, I need to look for any mention of specific methods such as listwise deletion, multiple imputation, or full information maximum likelihood (FIML) in the context. The context mentions that the analysis ""assists in accounting for missing data,"" but it does not specify the method used. Therefore, there is no explicit description of how missing data were dealt with. "," - ""The analysis assists in accounting for missing data, because of the relatively high attrition at 3 years posttrauma the study would benefit from replication using a larger sample, maintained at long-term follow-up assessments."" ",NO
9,5,"To determine if information about the distribution of the observed variables is included, we need to look for mentions of tests for normality or distribution checks within the context. The context provides statistical results and mentions variables, but there is no explicit mention of tests for normality, such as tests for normally distributed variables within classes or multivariate normality. The context focuses on descriptive statistics, logistic regression, and results related to PTSD symptom severity, but does not detail any distribution tests. ", - The context includes statistical results and mentions variables but does not mention tests for normality or distribution checks. - There is no mention of tests for normally distributed variables within classes or multivariate normality. ,NO
9,6,"To determine if the software used for the statistical analysis is mentioned, we need to look for any references to specific software tools in the context. The context mentions the use of the TRAJ command in STATA for group-based trajectory analysis. It also references the adaptation from PROC TRAJ, which is associated with STATA. There is no mention of other software like Mplus or R in the context provided. "," - ""Group-based trajectory analysis was performed using the TRAJ command (Jones & Nagin, 2013) in STATA (Stata, 2013)"" - ""adapted from PROC TRAJ (Jones, Nagin and Roeder, 2001)."" ",YES
9,7,"To determine if alternative specifications of within-class heterogeneity were considered, we need to look for mentions of different models or methods used for trajectory analysis, such as Latent Growth Curve Analysis (LGCA) or Latent Growth Mixture Modeling (LGMM). The context describes the use of the TRAJ command in STATA and the zero-inflated Poisson model for group-based trajectory analysis. It also mentions the use of the Bayesian information criterion (BIC) for model selection. However, there is no mention of alternative models like LGCA or LGMM being considered or documented. Therefore, the answer is NO. "," - ""Group-based trajectory analysis was performed using the TRAJ command (Jones & Nagin, 2013) in STATA (Stata, 2013), adapted from PROC TRAJ (Jones, Nagin and Roeder, 2001)."" - ""We used the zero-inflated Poisson model."" - ""We followed the lead of D’Unger, Land, McCall, and Nagin (1998) and used the Bayesian information criterion (BIC) as a basis for selecting the optimal model."" ",NO
9,8,"To determine if alternative specifications of the between-class differences in variance-covariance matrix structure are considered and clearly documented, we need to look for any mention of such specifications in the context. The context discusses the use of group-based trajectory analysis and mentions the use of the Bayesian information criterion (BIC) for model selection. However, there is no specific mention of alternative specifications of the between-class differences in variance-covariance matrix structure, such as constrained or fixed across subgroups. Therefore, based on the provided context, it appears that these specifications are not considered or documented. "," - ""Group-based trajectory analysis was performed using the TRAJ command (Jones & Nagin, 2013) in STATA (Stata, 2013), adapted from PROC TRAJ (Jones, Nagin and Roeder, 2001)."" - ""We used the zero-inflated Poisson model."" - ""We followed the lead of D’Unger, Land, McCall, and Nagin (1998) and used the Bayesian information criterion (BIC) as a basis for selecting the optimal model (see Raftery, 1995)."" - ""They recommend selection of the model with the maximum BIC."" ",NO
9,9,"The context provides details about the statistical analyses used, specifically mentioning the use of group-based trajectory analysis and the zero-inflated Poisson model. It also discusses the use of the Bayesian information criterion (BIC) for model selection. However, there is no mention of testing alternative shape or functional forms of the trajectories, such as quadratic trends or non-linear forms. The context focuses on identifying clusters of individuals with similar growth trajectories and selecting the optimal model based on BIC, but it does not indicate any exploration of different trajectory shapes or forms. "," - ""Group-based trajectory analysis was performed using the TRAJ command (Jones & Nagin, 2013) in STATA (Stata, 2013), adapted from PROC TRAJ (Jones, Nagin and Roeder, 2001)."" - ""We used the zero-inflated Poisson model."" - ""We followed the lead of D’Unger, Land, McCall, and Nagin (1998) and used the Bayesian information criterion (BIC) as a basis for selecting the optimal model (see Raftery, 1995)."" - ""They recommend selection of the model with the maximum BIC."" ",NO
9,10,"To determine if the analyses could be replicated, we need to check if the paper provides sufficient detail on how covariates or predictors were used. The context mentions that logistic regressions were used to explore early predictors of trajectory membership, with variables grouped based on the construct measured. It specifies that each logistic regression assessed the predictive value of a different construct, and variables were added as a single step. However, it does not explicitly state whether these covariates were time-varying or time-invariant, nor does it detail their level (dependent or independent variables). The lack of this specific information suggests that the analyses might not be fully replicable based on the provided context. "," - ""Logistic regressions were then used to explore early predictors (from T1) of trajectory membership."" - ""Variables were grouped based on the construct measured."" - ""In all regressions, variables were added as a single step."" - ""A final logistic regression was then run with all significant predictors to explore what variables would be the sole unique predictor of trajectory membership."" ",NO
9,11,"The question asks whether the paper reports information about the number of random start values and final iterations used in the estimation of the latent trajectory model. The context provided does not mention any details about random start values, final iterations, or convergence criteria related to the estimation process. The context focuses on the methods used, such as group-based trajectory analysis and logistic regression, but does not provide specifics on the estimation process of the latent trajectory model. ", - [] ,NO
9,12,"The context mentions the use of the Bayesian information criterion (BIC) for model selection, which is a statistical tool used to compare models. The context also references the work of Raftery (1995) and Jones et al. (2001) in relation to BIC, indicating a statistical perspective on model comparison. Additionally, the context discusses the use of logistic regressions to explore predictors, which is another statistical method. Therefore, the context does describe model comparison tools from a statistical perspective. "," - ""We used the zero-inflated Poisson model."" - ""We followed the lead of D’Unger, Land, McCall, and Nagin (1998) and used the Bayesian information criterion (BIC) as a basis for selecting the optimal model (see Raftery, 1995)."" - ""They recommend selection of the model with the maximum BIC."" - ""Jones et al. (2001) suggest criteria for strength of evidence against the null model, using the difference in model BICs."" - ""A final logistic regression was then run with all significant predictors to explore what variables would be the sole unique predictor of trajectory membership."" ",YES
9,13,"To determine if the total number of fitted models, including a one-class solution, is reported, we need to look for any mention of the number of models considered in the trajectory analysis. The context describes the use of group-based trajectory analysis and mentions the Bayesian information criterion (BIC) for selecting the optimal model. However, it does not specify the total number of models fitted, including a one-class solution. The context only discusses the selection of models based on BIC and the identification of two trajectories with maximum BIC and adequate internal reliability. There is no explicit mention of the total number of models considered. "," - ""Group-based trajectory analysis was performed using the TRAJ command (Jones & Nagin, 2013) in STATA (Stata, 2013), adapted from PROC TRAJ (Jones, Nagin and Roeder, 2001)."" - ""We used the zero-inflated Poisson model. This analysis was used to identify clusters of individuals with similar growth trajectories."" - ""As two trajectories, which we discuss later, were identified (having the maximum BIC and with an average posterior group probability>0.70), logistic regressions were then used to explore early predictors (from T1) of trajectory membership."" - ""They recommend selection of the model with the maximum BIC."" ",NO
9,14,"To determine if the number of cases per class is reported for each model, we need to look for information in the context that specifies the absolute sample size, sample size per class, or proportion for each identified trajectory. The context mentions that two trajectories were identified with an average posterior group probability >0.70, but it does not provide specific numbers or proportions for the sample size per class or the absolute sample size for each trajectory. Therefore, the context does not report the number of cases per class for each model. "," - ""As two trajectories, which we discuss later, were identified (having the maximum BIC and with an average posterior group probability>0.70), logistic regressions were then used to explore early predictors (from T1) of trajectory membership."" - No specific numbers or proportions for the sample size per class or absolute sample size are mentioned. ",NO
