paper_id,question_id,reasoning,evidence,answer
0,0,"To determine if the metric of time is used in the statistical model, we need to identify any mention of time intervals or periods in the context. The context provides specific time points: ""12 months,"" ""24 months,"" and ""6 years."" These time points are used in the presentation of statistical data, indicating that time is indeed a metric in the model. Therefore, the answer to the question is YES. "," - ""12 months"" - ""24 months"" - ""6 years"" ",YES
0,1,"To determine if information about the mean and variance of time within a wave is presented, we need to look for any mention of these statistical measures in the context. The context includes details about life events at different time intervals (3 months, 12 months, 24 months) and model parameters such as intercept, linear slope, and quadratic slope. However, there is no mention of the mean and variance of time within a wave. Therefore, the answer is NO. "," - ""Life events 3 months 1.24 (0.99–1.57)"" - ""Life events 12 months 1.24 (0.87–1.77)"" - ""Life events 24 months 1.16 (0.95–1.41)"" - ""Class membership proportions, and intercept, linear slope and quadratic slope parameters for each class are presented in online Table DS2 for the unconditional and conditional models."" ",NO
0,2,"To determine if the missing data mechanism is reported, we need to look for any mention of how the missing data is handled or characterized in the context. The context mentions the use of multiple imputation in MPlus to impute missing values of covariates and that MPlus employs a robust full information maximum likelihood estimation procedure to account for missing data. However, it does not specify the missing data mechanism (e.g., Missing Completely at Random (MCAR), Missing at Random (MAR), or Missing Not at Random (MNAR)). Therefore, the missing data mechanism is not reported. "," - ""Mplus employs a robust full information maximum likelihood estimation procedure to account for missing data."" - ""We used multiple imputation in MPlus to impute missing values of covariates."" ",NO
0,3,"To determine if a description is provided of what variables are related to attrition/missing data, we need to look for any mention of variables specifically associated with attrition or missing data in the context. The context discusses model fit, class membership, and covariates such as gender, mTBI, and life events at various time points. However, there is no mention of variables related to attrition or missing data. The focus is on the impact of covariates on model fit and class membership, not on attrition or missing data. "," - ""Model fit was improved by the inclusion of these covariates."" - ""Significant covariates included gender, mTBI and life events at 3 months, 12 months and 24 months."" - No mention of attrition or missing data. ",NO
0,4,"To determine if a description is provided of how missing data in the analyses were dealt with, we need to look for any mention of methods or techniques used to handle missing data. The context states that ""multiple imputation in MPlus to impute missing values of covariates"" was used. This indicates that the authors described the method they used to address missing data in their analyses. "," - ""We used multiple imputation in MPlus to impute missing values of covariates."" ",YES
0,5,"To determine if information about the distribution of the observed variables is included, we need to look for any mention of how the variables are distributed or any statistical analysis that describes their distribution. The context discusses the inclusion of covariates in a model and mentions variables that influence PTSD risk, but it does not provide specific details about the distribution of these variables. There is no mention of statistical measures or descriptions that would indicate the distribution of the observed variables.", - [],NO
0,6,"To determine if the software is mentioned, we need to look for any references to specific software used in the context. The context mentions ""MPlus"" as the software used for multiple imputation and latent class growth analysis (LCGA). Therefore, the answer to the question is YES."," - ""We used multiple imputation in MPlus to impute missing values of covariates."" - ""We employed latent class growth analysis (LCGA) to examine PTSD trajectories, using Mplus version 6.2 for Windows.""",YES
0,7,"To determine if alternative specifications of within-class heterogeneity are considered and documented, we need to identify any mention of different models or approaches being compared or discussed. The context mentions the use of latent growth mixture modelling (LGMM) and latent class growth analysis (LCGA) in studying PTSD responses. However, it does not explicitly state that these models are compared or that their specifications are clearly documented. The context only describes the use of these models without indicating a comparison or documentation of alternative specifications. "," - ""In recent years latent growth mixture modelling (LGMM) has been applied to studying PTSD responses following traumatic events."" - ""We employed latent class growth analysis (LCGA) to examine PTSD trajectories, using Mplus version 6.2 for Windows."" - ""LCGA models heterogeneity in longitudinal data by identifying symptom trajectories across time."" ",NO
0,8,"To determine if alternative specifications of the between-class differences in variance-covariance matrix structure are considered and clearly documented, we need to look for any mention of such considerations or documentation in the context. The context provided discusses class membership consistency across models, the significance of slope parameters, and covariate predictors of trajectory class. However, there is no mention of alternative specifications of the variance-covariance matrix structure or any documentation regarding them. Therefore, based on the given context, it appears that this aspect is not addressed. ", - [] ,NO
0,9,"To determine if alternative shape/functional forms of the trajectories are described, we need to look for any mention of different models or forms of growth curves beyond the ones already identified. The context discusses the use of latent growth mixture modelling (LGMM) to identify different trajectories of PTSD responses, specifically mentioning four major trajectories: chronic, worsening, recovery, and worsening/recovery. However, there is no mention of alternative shape or functional forms of these trajectories. The context focuses on the identified trajectories and their characteristics over time, without indicating any exploration of different models or forms. "," - ""Most studies of PTSD trajectory have identified four major trajectories"" - ""The growth curves can be modelled separately, which permits identification of different trajectories of response."" ",NO
0,10,"To determine if analyses can still be replicated, we need to consider whether the methods and data used in the study are sufficiently detailed and accessible. The context mentions the use of multiple imputation in MPlus to handle missing values and the testing of nested models with specific covariates. However, it does not provide detailed information about the exact data, the full methodology, or the specific values of the covariates used. Without access to the raw data and complete methodological details, replication may be challenging. Therefore, the answer is NO. "," - ""We used multiple imputation in MPlus to impute missing values of covariates."" - ""Only covariates that were significant predictors of class membership and improved model fit were retained in the final solution."" - ""We recognise several limitations. First, nearly half the sample was lost by the 6-year assessment, and these participants were younger."" ",NO
0,11,"To determine if information about the number of random start values and final iterations is reported, we need to look for any mention of these specific details in the context. The context discusses the use of latent class growth analysis (LCGA) with Mplus version 6.2 for Windows, but it does not provide specific details about the number of random start values or final iterations used in the analysis. There is no mention of these parameters in the provided text. ", - [] ,NO
0,12,"To determine if the model comparison and selection tools are described from a statistical perspective, we need to identify any mention of statistical methods or criteria used for model comparison. The context mentions ""nested models,"" ""improved model fit,"" and ""significant predictors of class membership,"" which are statistical concepts. Additionally, the use of ""multiple imputation in MPlus"" and ""odds ratios"" are statistical techniques. These elements indicate that the model comparison and selection tools are indeed described from a statistical perspective."," - ""We then tested a series of nested models using the five-class solution to identify covariates that improved model fit."" - ""Only covariates that were significant predictors of class membership and improved model fit were retained in the final solution."" - ""We used multiple imputation in MPlus to impute missing values of covariates."" - ""the odds ratios of impaired functioning in the worsening/recovery class were at least one-third of those at the 24- and 12-month assessments.""",YES
0,13,"To determine if the total number of fitted models, including a one-class solution, is reported, we need to look for any mention of the number of models tested. The context discusses testing a series of nested models using a five-class solution and mentions both unconditional and conditional models. However, there is no specific mention of a one-class solution being tested or the total number of models. The context only specifies the five-class solution and does not provide a count of all models tested. "," - ""We then tested a series of nested models using the five-class solution to identify covariates that improved model fit."" - ""Following the unconditional model, we examined a series of nested five-class models to investigate the impact of the inclusion of covariates on model fit."" ",NO
0,14,"To determine if the number of cases per class is reported as either absolute sample size or proportion, we need to examine the context for any mention of these metrics. The context provides percentages for class membership in both unconditional and conditional models (e.g., ""Chronic unconditional 5.2% v. conditional 5.2%""). These percentages represent proportions of the total sample size. There is no mention of absolute sample sizes for each class. Therefore, the number of cases per class is reported as proportions. "," - ""Chronic unconditional 5.2% v. conditional 5.2%"" - ""worsening/recovery unconditional 8.1%v. conditional 8.1%"" - ""worsening unconditional 9.6% v. conditional 10.2%"" - ""recovery unconditional 5.7% v. conditional 8.2%"" - ""resilient unconditional 72.3% v. conditional 68.3%"" ",YES
0,15,"To determine if entropy is reported in the context of classifying cases in a trajectory, we need to look for any mention of entropy or related statistical measures used for classification. The context discusses the classification of patients into different trajectories based on their PTSD symptoms and mentions the use of monitoring over time as a method for identifying PTSD. However, there is no mention of entropy or any statistical measure related to entropy in the provided context. Therefore, the answer is NO. ", - [] ,NO
0,16,"To determine if a plot is included with the estimated mean trajectories of the final solution, we need to look for any mention of a plot or graphical representation in the context. The context discusses the methodology and results of the study, including the identification of PTSD response trajectories and the use of statistical models. However, there is no mention of a plot or graphical representation being included with the estimated mean trajectories. Therefore, based on the provided context, there is no evidence to suggest that a plot is included. ", - [] ,NO
0,17,"To determine if plots are included with the estimated mean trajectories for each model, we need to look for any mention of visual representations or plots in the context. The context discusses the methodology and results of the study, including the identification of symptom trajectories and the use of latent growth mixture modeling. However, there is no mention of plots or visual representations being included with the estimated mean trajectories. The context focuses on the statistical analysis and results without reference to any accompanying plots. ", - [] ,NO
0,18,"To determine if a plot is included of the combination of estimated means of the final model and the observed individual trajectories split out for each latent class, we need to look for any mention of such a plot in the context. The context discusses the use of latent growth mixture modelling (LGMM) and the process of identifying the best-fitting model, but it does not mention the inclusion of any plots. There is no evidence provided in the context that a plot of the estimated means and observed individual trajectories is included. ", - [] ,NO
0,19,"To determine if the characteristics of the final class solution are numerically described, we need to look for mentions of statistical measures such as means, standard deviations (SD), standard errors (SE), sample sizes (n), or confidence intervals (CI) in the context. The context mentions ""Class membership proportions, and intercept, linear slope and quadratic slope parameters for each class are presented in online Table DS2 for the unconditional and conditional models."" However, it does not specify whether these parameters include numerical descriptions like means, SD/SE, n, or CI. The context does not provide explicit evidence of these numerical descriptions being included in the main text. "," - ""Class membership proportions, and intercept, linear slope and quadratic slope parameters for each class are presented in online Table DS2 for the unconditional and conditional models."" ",NO
0,20,"To determine if the syntax files are available, we need to look for any mention of supplementary materials, appendices, or availability from the authors in the context provided. The context includes references to articles from the British Journal of Psychiatry and a mention of the DSM-IV, but there is no mention of syntax files, supplementary materials, appendices, or availability from the authors. Therefore, based on the given context, there is no evidence to suggest that syntax files are available. ", - [] ,NO
1,0,"To determine if the metric of time used in the statistical model is reported, we need to look for information about how time points were set in the context. The context specifies that ""the first time point was set to 0, the second to 1 and the third to 5."" This indicates that the metric of time used in the statistical model is indeed reported. "," - ""the first time point was set to 0, the second to 1 and the third to 5."" ",YES
1,1,"To determine if information about the mean and variance of time within a wave is presented, we need to look for any mention of these statistical measures in the context. The context discusses the use of parametric statistics, including means and standard deviations, for questionnaire scores at different time points. However, it does not specifically mention the mean and variance of time within a wave. The context focuses on the analysis of emotional distress symptom profiles over time using growth mixture modelling and the handling of missing data, but it does not provide details about the mean and variance of time within a wave."," - ""Parametric statistics, including the means and standard deviations (SD) for the questionnaire scores, were examined at the following three time points: 3 months, 1 year and 5 years."" - ""The intervals between the follow-up time points were unequal, so the first time point was set to 0, the second to 1 and the third""",NO
1,2,"To determine if the missing data mechanism is reported, we need to look for any mention of how the missing data was handled or any assumptions made about the nature of the missing data. The context mentions that ""Mplus 7 estimates missing data using maximum-likelihood procedures,"" which implies a method for handling missing data but does not explicitly state the missing data mechanism (e.g., Missing Completely at Random, Missing at Random, Missing Not at Random). The context does not provide specific information about the mechanism of the missing data, only the method used to estimate it. "," - ""Mplus 7 estimates missing data using maximum-likelihood procedures."" ",NO
1,3,"To determine if a description of variables related to attrition or missing data is provided, we need to look for any mention of factors or variables that explain why data might be missing. The context discusses the availability of IES-R data at different time points and mentions that one case had missing data at all time points, with data being estimated from 117 individuals. However, it does not provide any specific variables or factors that explain why data might be missing. There is no mention of any analysis or description of variables related to attrition or missing data."," - ""The IES-R data were available for 114 out of the 118 patients at 3 months, 107 patients at 1 year and 89 patients at 5 years after the injury."" - ""One case had missing data for the IES-R at all of the time points; thus, the data were estimated from 117 individuals."" - No mention of variables related to attrition or missing data.",NO
1,4,"To determine if a description is provided of how missing data in the analyses were dealt with, we need to look for any mention of methods or procedures used to handle missing data. The context states that ""Mplus 7 estimates missing data using maximum-likelihood procedures."" This indicates that a specific method (maximum-likelihood procedures) was used to handle missing data. Therefore, a description of how missing data were dealt with is indeed provided. "," - ""Mplus 7 estimates missing data using maximum-likelihood procedures."" ",YES
1,5,"To determine if information about the distribution of the observed variables is included, we need to look for any mention of how the data is distributed or any statistical tests related to the distribution. The context mentions the use of parametric statistics, which implies that the data is assumed to follow a normal distribution. However, there is no explicit mention of the distribution of the observed variables themselves, such as skewness, kurtosis, or normality tests. The context focuses on the analysis methods and the results of the GMM, but does not provide specific details about the distribution of the observed variables. "," - ""Parametric statistics, including the means and standard deviations (SD) for the questionnaire scores, were examined at the following three time points: 3 months, 1 year and 5 years."" - ""The GMM is a longitudinal analysis that explores within and between individual differences in change and individual membership within growth trajectories (classes)."" - ""The number of latent unobserved classes is inferred from the observed data (i.e. the IES-R total scores) and the GMM generates goodness-of-fit statistics."" ",NO
1,6,"To determine if software is mentioned, we need to identify any references to software in the context. The context includes a mention of ""Mplus User’s Guide. 7th ed."" which is a software package used for statistical analysis. This indicates that software is indeed mentioned in the context."," - ""Mplus User’s Guide. 7th ed.""",YES
1,7,"To determine if alternative specifications of within-class heterogeneity are considered and documented, we need to look for mentions of different models or methods such as LGCA (Latent Growth Curve Analysis) or LGMM (Latent Growth Mixture Modeling) in the context. The context discusses the use of GMM (Growth Mixture Modeling) and goodness-of-fit statistics like BIC, BLRT, and LMR for model comparison. However, there is no mention of alternative models like LGCA or LGMM being considered or documented. Therefore, the answer is NO. "," - ""The number of latent unobserved classes is inferred from the observed data (i.e. the IES-R total scores) and the GMM generates goodness-of-fit statistics."" - ""The Bayesian Information Criterion (BIC), Bootstrap likelihood ratio test (BLRT) and Lo-Mendell-Rubin adjusted likelihood ratio test (LMR) were evaluated to compare the fit of alternative models (i.e. 1- to 6-class solutions)."" - No mention of LGCA or LGMM. ",NO
1,8,"To determine if alternative specifications of the between-class differences in variance-covariance matrix structure are considered and clearly documented, we need to look for any mention of such considerations or documentation in the context. The context discusses the use of chi-square tests, ANOVA, and Hochberg’s GT2 post-hoc testing for examining differences between class memberships. However, there is no mention of alternative specifications of the variance-covariance matrix structure or any documentation regarding such considerations. The references provided (e.g., Mplus User’s Guide, Monte Carlo simulation study) do not directly address this specific aspect either. Therefore, based on the given context, there is no evidence that alternative specifications of the between-class differences in variance-covariance matrix structure are considered and clearly documented. ", - [] ,NO
1,9,"To determine if alternative shape/functional forms of the trajectories are described, we need to look for any mention of different forms or models of trajectories in the context. The context discusses the identification of four prototypical long-term trajectories (resilient, recovery, delayed, and chronic) following aversive events, as well as the hypothesis of three to four trajectories for distress symptomatology in TBI samples. However, there is no mention of alternative shape or functional forms of these trajectories. The context focuses on the types of trajectories rather than their shapes or functional forms."," - ""Studies by Bonanno and his associates [23, 24] have identified four prototypical long-term trajectories that follow aversive events, which were defined as resilient, recovery, delayed and chronic patterns."" - ""Because there is mounting evidence regarding the existence of three to four trajectories for distress symptomatology in other trauma samples, it was hypothesized that either three or four trajectories would be found within the TBI population.""",NO
1,10,"To determine if analyses can still be replicated when covariates are used, we need to assess whether the context provides information about the use of covariates in the analyses. The context describes the statistical methods used, such as chi-square tests, ANOVA, and Hochberg’s GT2 post-hoc testing, but does not mention the use of covariates. Without information on covariates, we cannot conclude that their use would affect the replicability of the analyses. Therefore, based on the given context, there is no evidence that covariates were used, and thus, the analyses can still be replicated as described. "," - ""solution, differences between class memberships were examined with chi-square tests on the nominal level data (e.g. gender, marital status, substance abuse and employment) and with one-way analyses of variance (ANOVA) on the interval level data (e.g. age, education and questionnaires), with the optimal class solution as between-subjects variable."" - ""The Hochberg’s GT2 post-hoc testing was used to analyse pairwise comparisons."" - ""ANOVA was used to evaluate differences between the 4-class membership groups."" ",YES
1,11,"To determine if information about the number of random start values and final iterations is reported, we need to look for any mention of these specific details in the context. The context provides information about the IES-R data, missing data estimation using Mplus 7, and the structure of the IES-R sub-scales. However, there is no mention of the number of random start values or final iterations in the context provided. ", - [] ,NO
1,12,"To determine if the model comparison and selection tools are described from a statistical perspective, we need to identify if the context provides statistical details about these tools. The context mentions the Bayesian Information Criterion (BIC), Bootstrap likelihood ratio test (BLRT), and Lo-Mendell-Rubin adjusted likelihood ratio test (LMR) as tools used for model comparison. It also provides specific statistical criteria, such as lower BIC values indicating a better fit and BLRT and LMRp values of 50.05 indicating significant improvements. These details are statistical in nature, as they involve criteria and thresholds used in statistical model evaluation. "," - ""The Bayesian Information Criterion (BIC), Bootstrap likelihood ratio test (BLRT) and Lo-Mendell-Rubin adjusted likelihood ratio test (LMR) were evaluated to compare the fit"" - ""Lower BIC values suggest having a better fit and BLRT and LMRp values of 50.05 indicate significant improvements in the model compared to a model with one less class."" - ""These indexes are accurate for evaluating model selection in simulation studies [48]."" ",YES
