paper_id,question_id,reasoning,evidence,answer
27,2,"To determine if the missing data mechanism is reported, we need to look for any mention of how missing data was handled or classified in the context. The context discusses the use of a semi-parametric group-based trajectory analytical technique that does not require complete records, but it does not specify the missing data mechanism such as MAR, MNAR, or MCAR. There is no mention of how the missing data was treated or classified in terms of these mechanisms. "," - ""A semi-parametric group-based trajectory analytical technique, developed by Nagin[16], not requiring complete records, was used to investigate the possibility of underlying clusters of participants with different longitudinal post injury outcome profiles (trajectories) as measured by NDI and the PDS."" ",NO
27,3,"To determine if a description is provided of what variables are related to attrition/missing data, we need to look for any mention of dropout effects, auxiliary variables, or skip patterns in the context. The context discusses statistical modeling tools, trajectory models, and the association between compensation claims and health outcomes. However, there is no mention of variables related to attrition or missing data, such as dropout effects or auxiliary variables. Therefore, the answer is NO. ", - [] ,NO
27,4,"To determine if a description of how missing data were handled is provided, we need to look for any mention of methods such as listwise deletion, multiple imputation, or full information maximum likelihood (FIML) in the context. The context discusses the use of SAS version 9.1 and PROC TRAJ for analyses, the coding of compensation claims, and statistical tests used, but it does not mention any specific method for dealing with missing data. Therefore, there is no evidence in the context that describes how missing data were addressed. ", - [] ,NO
27,5,"To determine if information about the distribution of observed variables is included, we need to look for mentions of tests for normality or distribution checks within the context. The context discusses group-based trajectory models and mentions that most statistical approaches assume linear relationships, but it does not specify any tests for normality or distribution checks. There is no mention of tests for normally distributed variables within classes or multivariate normality. Therefore, the answer is NO. "," - ""Most statistical approaches assume linear relationships of variables over time but this may not necessarily be the case."" - No mention of tests for normally distributed variables or multivariate normality. ",NO
27,6,"To determine if the software used for statistical analysis is mentioned, we need to identify any references to specific software in the context. The context states that ""SAS version 9.1 and the SAS-based procedure PROC TRAJ[11]"" were used for all analyses. This clearly indicates the software used for the statistical analysis. Therefore, the answer to the question is YES. "," - ""SAS version 9.1 and the SAS-based procedure PROC TRAJ[11] were used for all analyses."" ",YES
27,7,"To determine if alternative specifications of within-class heterogeneity are considered and documented, we need to look for mentions of different models or approaches, such as Latent Growth Curve Analysis (LGCA) versus Latent Growth Mixture Modeling (LGMM), in the context. The provided context discusses the association of making a claim with trajectory profiles, shapes, and probabilities of group membership, and mentions a new search for optima and trajectories. However, there is no explicit mention of alternative specifications like LGCA or LGMM, nor is there any documentation of such considerations. Therefore, based on the given context, it appears that alternative specifications are not considered or documented. "," - ""With regard to PDS, making a claim was associated not only with the trajectory profile, but also with the trajectory shapes and probabilities of group membership, requiring a new search for optima and trajectories."" - No mention of LGCA, LGMM, or alternative specifications. ",NO
27,8,"To determine if alternative specifications of the between-class differences in variance-covariance matrix structure are considered and clearly documented, we need to look for any mention of such specifications in the context. The context provides references to works by Jones, Nagin, and Roeder on group-based trajectory modeling and an SAS procedure. However, there is no specific mention of alternative specifications of the variance-covariance matrix structure, such as constrained or fixed across subgroups, in the provided context. The context discusses the general use of group-based trajectory models and the exploration of non-linear changes but does not detail the variance-covariance matrix structure. "," - ""Group-based trajectory models are designed to identify clusters of individuals following similar progressions of some behaviour or outcome over time[10]."" - ""Most statistical approaches assume linear relationships of variables over time but this may not necessarily be the case."" - ""To date these"" ",NO
27,9,"To determine if alternative shape/functional forms of the trajectories were described, we need to look for any mention of testing different models, such as quadratic or non-linear forms. The context mentions that group-based trajectory models allow for the exploration of non-linear changes in symptoms, suggesting that non-linear forms might be considered. However, there is no explicit mention of testing specific alternative forms like quadratic trends or other non-linear models. The context does not provide evidence that such tests were conducted or described. "," - ""Group-based trajectory models are designed to identify clusters of individuals following similar progressions of some behaviour or outcome over time."" - ""This design also allows exploration of non-linear changes in symptoms that might, for example, be more rapid initially or less rapid at later stages."" ",NO
27,10,"To determine if the analyses could be replicated, we need to check if the study reported the use of covariates or predictors in a detailed manner. The context specifies that ""compensation claim was coded as a time-varying variable,"" indicating that the type of covariate used is clearly defined. Additionally, the context mentions the use of ""SAS version 9.1 and the SAS-based procedure PROC TRAJ"" for the analyses, which provides specific software and procedures used, allowing for replication. The context also states that ""all tests were two-tailed and alpha levels of 0.05 were used throughout,"" which further supports the replicability of the analyses by providing details on statistical testing parameters. Therefore, the analyses were conducted in a manner that allows for replication. "," - ""Compensation claim was coded as a time-varying variable, where for each time point: 0 = no claim made prior to then, and 1 = claim made in the interval since the previous time."" - ""SAS version 9.1 and the SAS-based procedure PROC TRAJ[11] were used for all analyses."" - ""All tests were two-tailed and alpha levels of 0.05 were used throughout."" ",YES
27,11,"To determine if information about the number of random start values and final iterations is reported, we need to look for specific details regarding the estimation process of the latent trajectory model, such as convergence criteria or the use of maximum likelihood (ML) estimation. The context mentions the use of a semi-parametric group-based trajectory analytical technique and the use of maximum likelihood to model probabilities, but it does not provide details about the number of random start values or final iterations. There is no mention of convergence to the maximum of the ML distribution or any local maxima, which are typically reported in such analyses. Therefore, the answer is NO. "," - ""A semi-parametric group-based trajectory analytical technique, developed by Nagin[16], not requiring complete records, was used to investigate the possibility of underlying clusters of participants with different longitudinal post injury outcome profiles (trajectories) as measured by NDI and the PDS."" - ""For a specified number of underlying latent groups the method uses maximum likelihood to model the probability of group membership, as well as the shape"" - No mention of the number of random start values or final iterations. ",NO
27,12,"To determine if the model comparison and selection tools described are from a statistical perspective, we need to identify if the context mentions statistical criteria or methods used for model comparison. The context specifically mentions the use of the Bayesian Information Criterion (BIC) for comparing models. BIC is a well-known statistical criterion used for model selection, which supports the idea that the tools described are from a statistical perspective. Additionally, the context refers to the change in twice the BIC, which is a statistical method for comparing models. Therefore, the answer to the question is YES. "," - ""Different possible models for number of groups and their profiles were compared using the criterion of reasonableness of group size as well as the difference in likelihood, expressed as twice the Bayesian Information Criterion (BIC) value[11]."" - ""Models consisting of one to five groups were compared using the criteria."" - ""Given the optimum group number, non-significant higher-order polynomial terms were dropped one at a time for each group and the models were compared using the change in twice the BIC."" - ""Choice of the number of groups best identified by the methodology was based on a combination of twice the change in BIC, stability of the model and group sizes, clear segregation of the trajectories using the 95% confidence intervals and parsimony."" ",YES
27,13,"To determine if the total number of fitted models, including a one-class solution, is reported, we need to look for any mention of the specific number of models compared. The context states that models consisting of one to five groups were compared. This implies that models with one group (a one-class solution) up to five groups were considered. However, the context does not explicitly state the total number of models fitted, only the range of group numbers considered. Therefore, the total number of fitted models is not directly reported. "," - ""Models consisting of one to five groups were compared using the criteria."" ",NO
27,14,"To determine if the number of cases per class is reported for each model, we need to look for any mention of absolute sample sizes, sample sizes per class, or proportions in the context. The context provides information about the total number of cases analyzed (155 WAD cases) and the number of cases with complete data for NDI (94 cases) and PDS (91 cases). However, it does not mention any specific numbers or proportions related to the number of cases per class for each model. Therefore, the answer is NO. "," - ""Analyses were conducted on 155 WAD cases all of whom had at least 1 data point for NDI and PDS over the 12-month time period."" - ""94 (61%) of cases had complete NDI data and 91 (59%) had complete PDS data."" - No mention of number of cases per class for each model. ",NO
27,15,"To determine if entropy is reported, we need to look for mentions of entropy values or misclassification rates in the context. The context discusses trajectory models, statistical approaches, and the use of PROC TRAJ for analyses. However, there is no mention of entropy values or the number of misclassifications per model. The context focuses on trajectory profiles, shapes, probabilities, and the coding of compensation claims, but does not provide information on entropy or misclassification rates.", - [],NO
27,16,"To determine if a plot is included with the estimated mean trajectories of the final solution, we need to look for any mention of plots being created or included in the context. The context states that ""the predicted values with 95% confidence bands were plotted against time of measurement."" This indicates that plots were indeed created as part of the analysis. However, it does not explicitly state that these plots are included with the final solution. The context does not provide information about the inclusion of these plots in the final presentation or solution. "," - ""the predicted values with 95% confidence bands were plotted against time of measurement."" ",NO
27,17,"To determine if plots are included with the estimated mean trajectories for each model, we need to look for any mention of plotting or visual representation of the trajectories in the context. The context states that ""the predicted values with 95% confidence bands were plotted against time of measurement."" This indicates that plots were indeed created to visualize the predicted values and their confidence intervals over time. Therefore, the answer to the question is YES. "," - ""the predicted values with 95% confidence bands were plotted against time of measurement."" ",YES
27,18,"To determine if a plot is included of the combination of estimated means of the final model and the observed individual trajectories split out for each latent class, we need to look for any mention of such a plot in the context. The context describes the use of a semi-parametric group-based trajectory analytical technique and mentions plotting predicted values with confidence bands against time. However, it does not specifically mention a plot that combines estimated means of the final model with observed individual trajectories split out for each latent class. Therefore, based on the provided context, there is no evidence of such a plot being included. "," - ""For each trajectory, the predicted values with 95% confidence bands were plotted against time of measurement."" - No mention of a plot combining estimated means of the final model with observed individual trajectories split out for each latent class. ",NO
27,19,"To determine if the characteristics of the final class solution are numerically described, we need to look for mentions of statistical measures such as means, standard deviations (SD), standard errors (SE), sample sizes (n), or confidence intervals (CI) in the context. The context provides descriptions of the trajectory polynomials and the percentage of participants in each category, but it does not include any numerical statistical measures like means, SD/SE, or CIs. Therefore, the characteristics of the final class solution are not numerically described in the given context. "," - ""70 (45%) Mild Cubic Mild disability and pain 1 month post injury, negligible thereafter"" - ""60 (39%) Moderate Cubic Moderate disability and pain 1 month post injury, mild thereafter"" - ""25 (16%) Chronic-severe Quadratic Severe disability and pain for 6 months, moderate thereafter"" - ""62 (40%) Resilient Quadratic Mild PDS for the entire study period"" - ""66 (43%) Recovering Cubic Moderate PDS 1 month post injury, mild thereafter"" ",NO
27,20,"To determine if the syntax files are available, we need to look for any mention of their availability in the appendix, supplementary materials, or from the authors. The context provided does not mention anything about syntax files being available in any of these forms. There is no reference to supplementary materials or any indication that the authors have made syntax files available. Therefore, based on the given context, there is no evidence to suggest that the syntax files are available. ", - [] ,NO
28,0,"To determine if the metric or unit of time used in the statistical model is reported, we need to identify any mention of time units in the context. The context specifies time lags as 'ten days,''seven months,' and 'fifteen months,' as well as 'one month' and 'five months' for clinical interviews. These are clear indications of the time units used in the study. Therefore, the metric or unit of time is indeed reported in the context. "," - ""We refer to these time lags as ‘ten days,’ ‘seven months’ and ‘fifteen months.’"" - ""The clinical interviews took place 29.51 SD = 4.93 and 143.00 SD = 32.33 days after ED admission (alias ‘one month’ and ‘five months’)."" ",YES
28,1,"To determine if information about the mean and variance of time within a wave is presented, we need to look for details about the mean and variance of time intervals within specific measurement occasions or periods. The context provides specific time lags and their standard deviations for different time points after ED admission, such as ""9.21 SD = 3.20"" days, ""221.34 SD = 33.90"" days, and ""468.07 SD = 109.32"" days. These details indicate the mean and variance of time within specific periods after ED admission. Therefore, the answer is YES. "," - ""The mean age of the in this sample took place, respectively 9.21 SD = 3.20, 221.34 SD = 33.90 and 468.07 SD = 109.32 days after ED admission."" - ""The clinical interviews took place 29.51 SD = 4.93 and 143.00 SD = 32.33 days after ED admission."" ",YES
28,2,"To determine if the missing data mechanism is reported, we need to look for any mention of how missing data was handled or characterized in the context. The context describes the use of robust full information maximum-likelihood (FIML) procedures in Mplus 6.0 for data analysis. FIML is a method often used to handle missing data under the assumption that the data are missing at random (MAR). However, the context does not explicitly state the missing data mechanism (e.g., MAR, MNAR, MCAR). It only mentions the use of FIML without specifying the assumption about the missing data mechanism. "," - ""We utilized Mplus 6.0 [38], employing robust full information maximum-likelihood (FIML) procedures to identify heterogeneous latent classes of PTSD symptom severity over time using LGMM."" ",NO
28,3,"To determine if a description is provided of what variables are related to attrition or missing data, we need to look for any mention of dropout effects, auxiliary variables, or skip patterns in the context. The context discusses the imputation of missing cases and mentions that full clinical assessments were not conducted on the entire cohort, indicating some missing data. However, it does not specify any variables related to attrition or missing data, such as dropout effects or auxiliary variables. Therefore, the answer is NO. "," - ""We found some indication that current depression differentiates trajectories. These data are limited, however, because full clinical assessments were not conducted on the entire cohort."" - ""understanding the underlying problems, and with an eye towards imputation of missing cases (e.g., by collecting enriched initial assessments)."" ",NO
28,4,"To determine if a description of how missing data were handled is provided, we need to look for any mention of specific methods used for dealing with missing data in the context. The context mentions the use of ""robust full information maximum-likelihood (FIML) procedures"" in the data analytic plan. This indicates that FIML was used to handle missing data. Therefore, the answer to the question is YES. "," - ""We utilized Mplus 6.0 [38], employing robust full information maximum-likelihood (FIML) procedures to identify heterogeneous latent classes of PTSD symptom severity over time using LGMM."" ",YES
28,5,"To determine if information about the distribution of the observed variables is included, we need to look for mentions of tests for normality or distribution characteristics within the context. The context discusses the use of latent growth mixture modeling (LGMM) and mentions modeling covariates as predictors of class membership and slope parameters. However, there is no mention of tests for normally distributed variables within classes or multivariate normality. The context focuses on the modeling techniques and criteria for determining the number of classes, but does not specify any distributional tests for the observed variables. "," - ""These modeling techniques allowed us to test whether the population under study is composed of a mixture of discrete distributions characterized as classes of individuals with differing profiles of growth [39], while also allowing for the modeling of covariates as predictors of class membership and slope parameters [40]."" - ""all criteria were consistent with recommendations from the literature [41]."" ",NO
28,6,"To determine if the software used for statistical analysis is mentioned, we need to look for any references to specific software in the context. The context explicitly states, ""We utilized Mplus 6.0 [38], employing robust full information maximum-likelihood (FIML) procedures to identify heterogeneous latent classes of PTSD symptom severity over time using LGMM."" This clearly indicates that Mplus was the software used for the analysis. Therefore, the answer to the question is YES. "," - ""We utilized Mplus 6.0 [38], employing robust full information maximum-likelihood (FIML) procedures to identify heterogeneous latent classes of PTSD symptom severity over time using LGMM."" ",YES
28,7,"To determine if alternative specifications of within-class heterogeneity are considered and documented, we need to look for mentions of different modeling techniques or comparisons between them in the context. The context discusses the use of LGMM (Latent Growth Mixture Modeling) and mentions comparisons of models in terms of overall fit and entropy. However, there is no mention of LGCA (Latent Growth Curve Analysis) or any other alternative specifications being considered or compared. The focus is solely on LGMM and its application, without any reference to other models or a clear documentation of alternatives."," - ""latent classes of PTSD symptom severity over time using LGMM."" - ""These modeling techniques allowed us to test whether the population under study is composed of a mixture of discrete distributions characterized as classes of individuals with differing profiles of growth [39], while also allowing for the modeling of covariates as predictors of class membership and slope parameters [40]."" - ""The classes differed in the overall fit in terms of entropy, but recovered the same classes in roughly the same proportions."" - No mention of LGCA or other alternative specifications.",NO
28,8,"To determine if alternative specifications of the between-class differences in variance-covariance matrix structure are considered and clearly documented, we need to look for any mention of such specifications in the context. The context discusses the comparison of progressive nested trajectory models and the criteria used for assessing model fit, such as BIC, SSBIC, AIC, BLRT, and entropy. However, there is no mention of alternative specifications of the variance-covariance matrix structure, such as constraints across subgroups or fixed structures across subgroups. Therefore, based on the provided context, it appears that these specifications are not considered or documented. "," - ""We compared progressive nested trajectory models by assessing relative fit based on reductions in the Bayesian Information Criterion (BIC), sample-size adjusted Bayesian Information Criterion (SSBIC), Aikaike Information Criterion (AIC), and significance indicated by the Bootstrap Likelihood Ratio Test (BLRT), along with parsimony and interpretability equally weighed."" - ""Entropy was also examined but not utilized to determine the number of classes; all criteria were"" ",NO
28,9,"To determine if alternative shape/functional forms of the trajectories were described, we need to look for mentions of testing different forms such as quadratic or non-linear trends. The context states that models with both ""linear only"" and ""linear+quadratic parameters"" were considered, and it mentions that ""linear +quadratic parameters consistently out-performed linear alone."" This indicates that alternative forms, specifically quadratic, were indeed tested to see if they fit the data better. "," - ""Based on the AIC, BIC, SSBIC, and BLRT, we found that successive models continued to demonstrate improved fit through four classes, both with linear only, and linear+quadratic parameters, with linear +quadratic parameters consistently out-performing linear alone (Table 2)."" ",YES
28,10,"To determine if the analyses could be replicated, we need to check if the study reported the use of covariates or predictors in a detailed manner, such as specifying whether they were time-varying or time-invariant and at what level they were applied. The context mentions that covariates were used as predictors of class membership and slope parameters, but it does not specify whether these covariates were time-varying or time-invariant, nor does it detail their application at the level of dependent or independent variables. Therefore, the necessary information for replication is not provided."," - ""Next, we examined further covariates as predictors of the classes including age, gender, and ten days symptom"" - ""while also allowing for the modeling of covariates as predictors of class membership and slope parameters"" - ""These modeling techniques allowed us to test whether the population under study is composed of a mixture of discrete distributions characterized as classes of individuals with differing profiles of growth""",NO
