paper_id,question_id,reasoning,evidence,answer
0,0,"To determine if the metric or unit of time used in the statistical model is reported, we need to look for any mention of time units in the context. The context lists several time intervals such as ""12 months,"" ""24 months,"" and ""6 years."" These clearly indicate the units of time used in the statistical model. Therefore, the answer to the question is YES. "," - ""12 months"" - ""24 months"" - ""6 years"" ",YES
0,1,"To determine if information about the mean and variance of time within a wave is presented, we need to look for any mention of statistical measures such as mean and variance related to time within a specific period or measurement occasion. The context provided includes references to studies and articles, but none of these references explicitly mention the mean and variance of time within a wave. The only numerical data provided are related to life events over different time periods (3 months, 12 months, 24 months) and their associated values, but these do not specify mean and variance of time within a wave. Therefore, there is no evidence in the context that directly addresses the mean and variance of time within a wave. ", - [] ,NO
0,2,"To determine if the missing data mechanism is reported, we need to look for any mention of how the missing data is handled or characterized in the context. The context mentions that Mplus employs a robust full information maximum likelihood estimation procedure to account for missing data. However, it does not specify the mechanism of missing data, such as missing at random (MAR), missing not at random (MNAR), or missing completely at random (MCAR). Therefore, the missing data mechanism is not reported in the context. "," - ""Mplus employs a robust full information maximum likelihood estimation procedure to account for missing data."" ",NO
0,3,"To determine if a description of variables related to attrition or missing data is provided, we need to look for any mention of dropout effects, auxiliary variables, or skip patterns in the context. The context discusses trajectory classes, functional impairment, and covariate predictors of trajectory class, but does not mention anything about attrition, missing data, or related variables. Therefore, there is no evidence in the context that describes variables related to attrition or missing data.", - [],NO
0,4,"To determine if a description is provided of how missing data in the analyses were dealt with, we need to look for specific methods mentioned in the context. The context states that ""Mplus employs a robust full information maximum likelihood estimation procedure to account for missing data."" Additionally, it mentions ""We used multiple imputation in MPlus to impute missing values of covariates."" Both of these statements describe methods used to handle missing data, specifically Full Information Maximum Likelihood (FIML) and multiple imputation. "," - ""Mplus employs a robust full information maximum likelihood estimation procedure to account for missing data."" - ""We used multiple imputation in MPlus to impute missing values of covariates."" ",YES
0,5,"To determine if information about the distribution of the observed variables is included, we need to look for mentions of tests for normality or distribution of variables within the context. The context discusses testing nested models, identifying significant covariates, and using multiple imputation for missing values. However, there is no mention of tests for normality, such as tests for normally distributed variables within classes or multivariate normality. Therefore, the answer is NO. "," - ""We then tested a series of nested models using the five-class solution to identify covariates that improved model fit."" - ""We used multiple imputation in MPlus to impute missing values of covariates."" - No mention of tests for normality or distribution of variables. ",NO
0,6,"To determine if the software used for statistical analysis is mentioned, we need to look for any references to specific software in the context. The context explicitly states that ""We employed latent class growth analysis (LCGA) to examine PTSD trajectories, using Mplus version 6.2 for Windows."" This clearly identifies the software used for the analysis. Therefore, the answer to the question is YES. "," - ""We employed latent class growth analysis (LCGA) to examine PTSD trajectories, using Mplus version 6.2 for Windows."" - ""Mplus employs a robust full information maximum likelihood estimation procedure to account for missing data."" ",YES
0,7,"To determine if alternative specifications of within-class heterogeneity are considered and documented, we need to identify any mention of different models or approaches being compared or discussed. The context mentions the use of latent growth mixture modelling (LGMM) and latent class growth analysis (LCGA) in studying PTSD responses. However, it does not explicitly state that these models are compared or that their differences are clearly documented. The context only describes the application of these models without indicating a comparison or documentation of alternative specifications. "," - ""In recent years latent growth mixture modelling (LGMM) has been applied to studying PTSD responses following traumatic events."" - ""We employed latent class growth analysis (LCGA) to examine PTSD trajectories, using Mplus version 6.2 for Windows."" - ""LCGA models heterogeneity in longitudinal data by identifying symptom trajectories across time."" ",NO
0,8,"To determine if alternative specifications of the between-class differences in variance-covariance matrix structure are considered and clearly documented, we need to look for any mention of such specifications in the context. The context discusses class membership consistency across unconditional and conditional models and mentions the magnitude and significance of intercept, linear slope, and quadratic slope parameters. However, there is no mention of alternative specifications of the variance-covariance matrix structure, such as constrained or fixed across subgroups. Therefore, the answer is NO. "," - ""Class membership remained largely consistent across the unconditional and conditional models (Chronic unconditional 5.2% v. conditional 5.2%; worsening/recovery unconditional 8.1%v. conditional 8.1%, worsening unconditional 9.6% v. conditional 10.2%, recovery unconditional 5.7% v. conditional 8.2%, resilient unconditional 72.3% v. conditional 68.3%)."" - ""Similarly, the magnitude and significance of intercept, linear slope and quadratic slope parameters remained consistent."" - No mention of alternative specifications of the variance-covariance matrix structure. ",NO
0,9,"To determine if alternative shape/functional forms of the trajectories were described, we need to look for evidence in the context that indicates testing of different trajectory forms, such as quadratic trends or non-linear forms. The context mentions that ""linear slope and quadratic slope parameters remained consistent across the unconditional and conditional models,"" which implies that both linear and quadratic forms were considered. However, there is no explicit mention of testing non-linear forms beyond the quadratic trend. Therefore, the context does not provide evidence that alternative non-linear forms were tested. "," - ""linear slope and quadratic slope parameters remained consistent across the unconditional and conditional models"" - ""the quadratic slope component of the resilient class, which was statistically significant in the unconditional model, but not in the conditional model"" ",NO
0,10,"To determine if the analyses could be replicated, we need to check if the study provides sufficient detail on how covariates were used, including whether they were time-varying or time-invariant, and how they were integrated into the models. The context mentions the use of covariates such as gender, mTBI, and life events at specific time points (3, 12, and 24 months), and the use of multiple imputation in MPlus to handle missing values. However, it does not specify whether these covariates were time-varying or time-invariant, nor does it detail their role as dependent or independent variables. The lack of this specific information makes it unclear if the analyses could be fully replicated based on the provided context. "," - ""Significant covariates included gender, mTBI and life events at 3 months, 12 months and 24 months"" - ""We used multiple imputation in MPlus to impute missing values of covariates."" - No mention of whether covariates were time-varying or time-invariant, or their role as dependent or independent variables. ",NO
0,11,"To determine if information about the number of random start values and final iterations is reported, we need to look for specific details regarding the estimation process, such as convergence criteria or the use of multiple random starts. The context discusses the use of Mplus and latent growth mixture modelling (LGMM) for identifying PTSD trajectories, but it does not mention any details about the number of random start values or final iterations. There is no evidence provided about convergence criteria or the estimation process specifics that would include such information. ", - [] ,NO
0,12,"To determine if the model comparison and selection tools are described from a statistical perspective, we need to look for mentions of specific statistical criteria or tools such as BIC (Bayesian Information Criterion) or AIC (Akaike Information Criterion) in the context. The context discusses class membership consistency, discriminant validity, and the significance of intercept and slope parameters, but it does not mention any specific statistical tools or criteria used for model comparison or selection. Therefore, there is no evidence in the context that model comparison tools like BIC or AIC are described. ", - [] ,NO
0,13,"To determine if the total number of fitted models, including a one-class solution, is reported, we need to look for any mention of the number of models tested. The context discusses testing a series of nested models using a five-class solution and mentions both unconditional and conditional models. However, there is no specific mention of a one-class solution or the total number of models tested. The context only specifies the use of a five-class solution and does not provide a count of all models, including a one-class solution. "," - ""We then tested a series of nested models using the five-class solution to identify covariates that improved model fit."" - ""Following the unconditional model, we examined a series of nested five-class models to investigate the impact of the inclusion of covariates on model fit."" ",NO
0,14,"To determine if the number of cases per class is reported, we need to look for any mention of absolute sample sizes, sample sizes per class, or proportions for each class in the context. The context provides percentages for class membership in both unconditional and conditional models, but it does not provide absolute numbers or sample sizes per class. It only mentions the total sample size (n = 1084) and demographic breakdowns, but not specific to each class. Therefore, the answer is NO. "," - ""Class membership remained largely consistent across the unconditional and conditional models (Chronic unconditional 5.2% v. conditional 5.2%; worsening/recovery unconditional 8.1%v. conditional 8.1%, worsening unconditional 9.6% v. conditional 10.2%, recovery unconditional 5.7% v. conditional 8.2%, resilient unconditional 72.3% v. conditional 68.3%)."" - ""Table 1 Demographic characteristics Total, % (n) (n = 1084)"" ",NO
0,15,"To determine if entropy is reported, we need to look for any mention of entropy values or misclassification rates in the context. The context discusses the identification of symptom trajectories, the use of Mplus for estimation, and the consistency of class membership between unconditional and conditional models. However, there is no mention of entropy values or misclassification rates, which are typically used to assess the quality of classification in trajectory models. Therefore, the answer is NO. ", - [] ,NO
0,16,"To determine if a plot is included with the estimated mean trajectories of the final solution, we need to look for any mention of a plot or graphical representation in the context. The context discusses the methodology and results of the study, including the identification of PTSD response trajectories and the use of statistical models. However, there is no mention of a plot or graphical representation being included with the estimated mean trajectories. Therefore, based on the provided context, there is no evidence to suggest that a plot is included. ", - [] ,NO
0,17,"To determine if plots are included with the estimated mean trajectories for each model, we need to look for any mention of visual representations or plots in the context. The context discusses the methodology and results of the study, including the identification of symptom trajectories and the use of latent growth mixture modeling. However, there is no mention of plots or visual representations being included with the estimated mean trajectories. The context focuses on the statistical analysis and results without reference to any accompanying plots. ", - [] ,NO
0,18,"To determine if a plot is included of the combination of estimated means of the final model and the observed individual trajectories split out for each latent class, we need to look for any mention of such a plot in the context. The context discusses the use of latent growth mixture modelling (LGMM) and the process of identifying the best-fitting model, but it does not mention the inclusion of any plots. There is no evidence provided in the context that a plot of the estimated means and observed individual trajectories is included. ", - [] ,NO
0,19,"To determine if the characteristics of the final class solution are numerically described, we need to look for mentions of statistical measures such as means, standard deviations (SD), standard errors (SE), sample sizes (n), or confidence intervals (CI) in the context. The context mentions ""Class membership proportions, and intercept, linear slope and quadratic slope parameters for each class are presented in online Table DS2 for the unconditional and conditional models."" However, it does not specify whether these parameters include numerical descriptions like means, SD/SE, n, or CI. The context does not provide explicit evidence of these numerical descriptions being included in the main text. "," - ""Class membership proportions, and intercept, linear slope and quadratic slope parameters for each class are presented in online Table DS2 for the unconditional and conditional models."" ",NO
0,20,"To determine if the syntax files are available, we need to look for any mention of supplementary materials, appendices, or availability from the authors in the context provided. The context includes references to articles from the British Journal of Psychiatry and a mention of the DSM-IV, but there is no mention of syntax files, supplementary materials, appendices, or availability from the authors. Therefore, based on the given context, there is no evidence to suggest that syntax files are available. ", - [] ,NO
1,0,"To determine if the metric or unit of time used in the statistical model is reported, we need to look for any mention of time units in the context. The context specifies that the time points for the analysis are 3 months, 1 year, and 5 years. Additionally, it mentions that the first time point was set to 0, the second to 1, and the third to 5, which implies a scaling based on years. Therefore, the metric or unit of time used in the statistical model is indeed reported as months and years. "," - ""Parametric statistics, including the means and standard deviations (SD) for the questionnaire scores, were examined at the following three time points: 3 months, 1 year and 5 years."" - ""the first time point was set to 0, the second to 1 and the third to 5."" ",YES
1,1,"To determine if information is presented about the mean and variance of time within a wave, we need to identify any mention of such statistical measures in the context. The context discusses parametric statistics, including means and standard deviations (SD) for questionnaire scores at different time points (3 months, 1 year, and 5 years). However, it does not specify whether these statistics are calculated within a single measurement occasion or across a period of time. The context focuses on the application of growth mixture modelling (GMM) and the handling of missing data, but it does not provide details about the mean and variance of time within a wave. Therefore, the answer is NO. "," - ""Parametric statistics, including the means and standard deviations (SD) for the questionnaire scores, were examined at the following three time points: 3 months, 1 year and 5 years."" - ""The context discusses the application of growth mixture modelling (GMM) and handling of missing data."" ",NO
1,2,"To determine if the missing data mechanism is reported, we need to look for any mention of how the missing data is treated or classified, such as missing at random (MAR), missing not at random (MNAR), or missing completely at random (MCAR). The context mentions that Mplus 7 estimates missing data using maximum-likelihood procedures, but it does not specify the missing data mechanism. Therefore, the missing data mechanism is not reported in the context. "," - ""Mplus 7 estimates missing data using maximum-likelihood procedures."" - No mention of MAR, MNAR, or MCAR. ",NO
1,3,"To determine if a description of variables related to attrition or missing data is provided, we need to look for any mention of factors influencing dropout rates, auxiliary variables, or patterns in the missing data. The context discusses the availability of IES-R data at different time points and mentions that missing data were estimated using maximum-likelihood procedures. However, it does not provide any specific information about variables related to attrition, such as dropout effects, auxiliary variables, or skip patterns. Therefore, the answer is NO. "," - ""The IES-R data were available for 114 out of the 118 patients at 3 months, 107 patients at 1 year and 89 patients at 5 years after the injury."" - ""Mplus 7 estimates missing data using maximum-likelihood procedures."" - ""One case had missing data for the IES-R at all of the time points; thus, the data were estimated from 117 individuals."" ",NO
1,4,"To determine if a description is provided of how missing data were dealt with, we need to look for specific methods mentioned in the context. The context states that ""Mplus 7 estimates missing data using maximum-likelihood procedures."" This indicates that the method used to handle missing data is Full Information Maximum Likelihood (FIML), which is a type of maximum-likelihood procedure. Therefore, a description of how missing data were dealt with is indeed provided. "," - ""Mplus 7 estimates missing data using maximum-likelihood procedures."" ",YES
1,5,"To determine if information about the distribution of the observed variables is included, we need to look for mentions of tests for normality or multivariate normality within the context. The context discusses the use of chi-square tests and ANOVA for examining differences between class memberships, but it does not mention any specific tests for normality or multivariate normality of the observed variables within classes. Therefore, there is no evidence provided in the context that addresses the distribution of the observed variables in terms of normality. "," - ""solution, differences between class memberships were examined with chi-square (/C312) tests on the nominal level data (e.g. gender, marital status, substance abuse and employment) and with one-way analyses of variance (ANOVA) on the interval level data (e.g. age, education and questionnaires), with the optimal class solution as between-subjects variable."" - ""The Hochberg’s GT2 post-hoc testing was used to analyse pairwise comparisons."" ",NO
1,6,"To determine if the software used for statistical analysis is mentioned, we need to identify any references to specific software in the context. The context explicitly mentions ""Mplus version 7"" as the software used for growth mixture modelling (GMM). Additionally, it states that the ""membership estimated by Mplus (GMM) was imported into SPSS,"" indicating that both Mplus and SPSS were used in the analysis. Therefore, the software used for statistical analysis is indeed mentioned. "," - ""we applied growth mixture modelling (GMM) using Mplus version 7 [47]."" - ""membership estimated by Mplus (GMM) was imported into SPSS."" ",YES
1,7,"To determine if alternative specifications of within-class heterogeneity are considered and documented, we need to look for mentions of different models or methods such as LGCA (Latent Growth Curve Analysis) or LGMM (Latent Growth Mixture Modeling) in the context. The context discusses the use of GMM (Growth Mixture Modeling) and goodness-of-fit statistics like BIC, BLRT, and LMR for model comparison. However, there is no mention of alternative models like LGCA or LGMM being considered or documented. Therefore, the answer is NO. "," - ""The number of latent unobserved classes is inferred from the observed data (i.e. the IES-R total scores) and the GMM generates goodness-of-fit statistics."" - ""The Bayesian Information Criterion (BIC), Bootstrap likelihood ratio test (BLRT) and Lo-Mendell-Rubin adjusted likelihood ratio test (LMR) were evaluated to compare the fit of alternative models (i.e. 1- to 6-class solutions)."" - No mention of LGCA or LGMM. ",NO
1,8,"To determine if alternative specifications of the between-class differences in variance-covariance matrix structure are considered and clearly documented, we need to look for any mention of such specifications in the context. The context discusses the use of ANOVA and chi-square tests to evaluate differences between class memberships, as well as the use of Hochberg’s GT2 for pairwise comparisons. However, there is no mention of alternative specifications of the variance-covariance matrix structure, such as constrained or fixed across subgroups. Therefore, the answer is NO. "," - ""ANOVA was used to evaluate differences between the 4-class membership groups."" - ""Further evaluation with pairwise comparisons (Hochberg’s GT2)"" - ""differences between class memberships were examined with chi-square tests on the nominal level data and with one-way analyses of variance (ANOVA) on the interval level data"" - No mention of alternative specifications of the variance-covariance matrix structure. ",NO
1,9,"To determine if alternative shape or functional forms of the trajectories were described, we need to look for any mention of testing different trajectory shapes, such as quadratic or non-linear forms. The context discusses the use of growth mixture modeling (GMM) and goodness-of-fit statistics like BIC, BLRT, and LMR to compare the fit of the model. However, there is no mention of testing alternative shapes or functional forms of the trajectories, such as quadratic or non-linear trends. The context focuses on the number of latent classes and the statistical tests used to evaluate the fit, but it does not specify any exploration of different trajectory shapes. "," - ""The number of latent unobserved classes is inferred from the observed data (i.e. the IES-R total scores) and the GMM generates goodness-of-fit statistics."" - ""In the current study, the Bayesian Information Criterion (BIC), Bootstrap likelihood ratio test (BLRT) and Lo-Mendell-Rubin adjusted likelihood ratio test (LMR) were evaluated to compare the fit"" - No mention of testing alternative shape/functional forms like quadratic or non-linear trends. ",NO
1,10,"To determine if the analyses could be replicated, we need to check if the context provides information on how covariates or predictors were used, specifically whether they were time-varying or time-invariant, and at what level they were applied. The context mentions the use of ANOVA and chi-square tests to examine differences between class memberships, and it specifies the use of Hochberg’s GT2 for pairwise comparisons. However, there is no mention of how covariates or predictors were handled, whether they were time-varying or time-invariant, or at what level they were applied. Therefore, there is no evidence in the context to suggest that the analyses could be replicated based on the use of covariates or predictors. ", - [] ,NO
1,11,"To determine if information about the number of random start values and final iterations is reported, we need to look for specific mentions of these details in the context. The context discusses the use of goodness-of-fit statistics like BIC, BLRT, and LMR to evaluate model fit, and mentions the entropy value indicating classification accuracy. However, there is no mention of the number of random start values or final iterations, nor any discussion about convergence to the maximum of the ML distribution or avoiding local maxima. Therefore, the answer is NO. ", - [],NO
