paper_id,question_id,reasoning,evidence,answer
27,12,"To determine if the model comparison and selection tools are described from a statistical perspective, we need to identify any mention of statistical methods or criteria used in the context. The context refers to the use of the Bayesian Information Criterion (BIC) for comparing models, which is a statistical criterion. Additionally, it mentions group-based trajectory models, which are statistical tools used to identify clusters of individuals following similar progressions over time. These references indicate that the tools are indeed described from a statistical perspective."," - ""compared using the criterion of reasonableness of group size as well as the difference in likelihood, expressed as twice the Bayesian Information Criterion (BIC) value[11]."" - ""Group-based trajectory models are designed to identify clusters of individuals following similar progressions of some behaviour or outcome over time[10].""",YES
27,13,"To determine if the total number of fitted models, including a one-class solution, is reported, we need to look for any mention of the specific number of models compared. The context states that models consisting of one to five groups were compared. This implies that models with one group (a one-class solution) up to five groups were considered. However, the context does not explicitly state the total number of models fitted. It only mentions the range of group numbers considered. Therefore, the total number of fitted models is not directly reported. "," - ""Models consisting of one to five groups were compared using the criteria."" ",NO
27,14,"To determine if the number of cases per class is reported for each model, we need to look for any mention of absolute sample sizes or proportions of cases within each class in the context. The context provides information about the total number of cases analyzed (155 WAD cases) and the number of cases with complete data for NDI (94 cases) and PDS (91 cases). However, it does not specify the number of cases per class or the proportion of cases within each class for the models. There is no mention of class-specific sample sizes or proportions in the context. "," - ""Analyses were conducted on 155 WAD cases all of whom had at least 1 data point for NDI and PDS over the 12-month time period."" - ""94 (61%) of cases had complete NDI data and 91 (59%) had complete PDS data."" - No mention of number of cases per class or proportion for each model. ",NO
27,15,"To determine if entropy is reported in the context of classifying cases in a trajectory, we need to look for any mention of entropy in relation to trajectory analysis or classification. The context discusses group-based trajectory models and the use of a semi-parametric group-based trajectory analytical technique by Nagin. It mentions the modeling of the probability of group membership and the shape of trajectories. However, there is no mention of entropy in the context provided. Entropy is often used as a measure of classification accuracy in trajectory analysis, but its absence in the context suggests it is not reported here. "," - ""Group-based trajectory models are designed to identify clusters of individuals following similar progressions of some behaviour or outcome over time."" - ""A semi-parametric group-based trajectory analytical technique, developed by Nagin, not requiring complete records, was used to investigate the possibility of underlying clusters of participants with different longitudinal post injury outcome profiles (trajectories) as measured by NDI and the PDS."" - ""For a specified number of underlying latent groups the method uses maximum likelihood to model the probability of group membership, as well as the shape."" ",NO
27,16,"To determine if a plot is included with the estimated mean trajectories of the final solution, we need to look for any mention of plots being created or included in the context. The context states that ""the predicted values with 95% confidence bands were plotted against time of measurement."" This indicates that plots were indeed created as part of the analysis. However, it does not explicitly state that these plots are included with the final solution. The context does not provide information about the inclusion of these plots in the final presentation or solution. "," - ""the predicted values with 95% confidence bands were plotted against time of measurement."" ",NO
27,17,"To determine if plots are included with the estimated mean trajectories for each model, we need to look for any mention of plotting or visual representation of the trajectories in the context. The context states that ""the predicted values with 95% confidence bands were plotted against time of measurement."" This indicates that plots were indeed created to visualize the predicted values and their confidence intervals over time. Therefore, the answer to the question is YES. "," - ""the predicted values with 95% confidence bands were plotted against time of measurement."" ",YES
27,18,"To determine if a plot is included of the combination of estimated means of the final model and the observed individual trajectories split out for each latent class, we need to look for any mention of such a plot in the context. The context describes the use of a semi-parametric group-based trajectory analytical technique and mentions plotting predicted values with confidence bands against time. However, it does not specifically mention a plot that combines estimated means of the final model with observed individual trajectories split out for each latent class. Therefore, based on the provided context, there is no evidence of such a plot being included. "," - ""For each trajectory, the predicted values with 95% confidence bands were plotted against time of measurement."" - No mention of a plot combining estimated means of the final model with observed individual trajectories split out for each latent class. ",NO
27,19,"To determine if the characteristics of the final class solution are numerically described, we need to look for mentions of statistical measures such as means, standard deviations (SD), standard errors (SE), sample sizes (n), or confidence intervals (CI) in the context. The context provides descriptions of the trajectory polynomials and the percentage of participants in each category, but it does not include any numerical statistical measures like means, SD/SE, or CIs. Therefore, the characteristics of the final class solution are not numerically described in the given context. "," - ""70 (45%) Mild Cubic Mild disability and pain 1 month post injury, negligible thereafter"" - ""60 (39%) Moderate Cubic Moderate disability and pain 1 month post injury, mild thereafter"" - ""25 (16%) Chronic-severe Quadratic Severe disability and pain for 6 months, moderate thereafter"" - ""62 (40%) Resilient Quadratic Mild PDS for the entire study period"" - ""66 (43%) Recovering Cubic Moderate PDS 1 month post injury, mild thereafter"" ",NO
27,20,"To determine if the syntax files are available, we need to look for any mention of their availability in the appendix, supplementary materials, or from the authors. The context provided does not mention anything about syntax files being available in any of these forms. There is no reference to supplementary materials or any indication that the authors have made syntax files available. Therefore, based on the given context, there is no evidence to suggest that the syntax files are available. ", - [] ,NO
28,0,"To determine if the metric of time is reported in the statistical model, we need to identify any mention of time-related measurements or intervals used in the analysis. The context provides specific time lags such as 'ten days,''seven months,' and 'fifteen months' after ED admission, as well as 'one month' and 'five months' for clinical interviews. These time intervals are clearly specified, indicating that time is indeed a metric used in the statistical model. "," - ""In this sample took place, respectively 9.21 SD = 3.20, 221.34 SD = 33.90 and 468.07 SD = 109.32 days after ED admission. We refer to these time lags as ‘ten days,’ ‘seven months’ and ‘fifteen months.’"" - ""The clinical interviews took place 29.51 SD = 4.93 and 143.00 SD = 32.33 days after ED admission (alias ‘one month’ and ‘five months’)."" ",YES
28,1,"To determine if information about the mean and variance of time within a wave is presented, we need to look for specific mentions of these statistical measures in the context. The context provides specific mean and standard deviation (SD) values for different time lags after ED admission, such as ""9.21 SD = 3.20"" for ten days, ""221.34 SD = 33.90"" for seven months, and ""468.07 SD = 109.32"" for fifteen months. These values indicate both the mean and variance (since variance is the square of the standard deviation) for these time points. Therefore, the context does present information about the mean and variance of time within a wave. "," - ""The mean age of the in this sample took place, respectively 9.21 SD = 3.20, 221.34 SD = 33.90 and 468.07 SD = 109.32 days after ED admission."" - ""The clinical interviews took place 29.51 SD = 4.93 and 143.00 SD = 32.33 days after ED admission."" ",YES
28,2,"To determine if the missing data mechanism is reported, we need to look for any mention of how missing data was handled or any assumptions made about the nature of the missing data. The context mentions the use of ""robust full information maximum-likelihood (FIML) procedures"" and ""imputation of missing cases,"" which suggests that there is some handling of missing data. However, it does not explicitly state the missing data mechanism (e.g., Missing Completely at Random (MCAR), Missing at Random (MAR), or Missing Not at Random (MNAR)). The context does not provide a detailed explanation of the missing data mechanism itself."," - ""We utilized Mplus 6.0 [38], employing robust full information maximum-likelihood (FIML) procedures to identify heterogeneous latent classes of PTSD symptom severity over time using LGMM."" - ""understanding the underlying problems, and with an eye towards imputation of missing cases (e.g., by collecting enriched initial assessments).""",NO
28,3,"To determine if a description is provided of what variables are related to attrition/missing data, we need to look for any mention of variables specifically associated with missing data or attrition in the context. The context discusses the coding of responses to traumatic events and the use of Mplus 6.0 for trajectory analysis, but it does not mention any variables related to attrition or missing data. The context focuses on the analysis of PTSD symptom severity and the effects of treatment, without addressing attrition or missing data variables.", - [],NO
28,4,"To determine if a description is provided of how missing data in the analyses were dealt with, we need to look for any mention of methods or strategies used to handle missing data. The context mentions ""imputation of missing cases"" and ""employing robust full information maximum-likelihood (FIML) procedures."" These references indicate that there is a description of how missing data were addressed in the analyses."," - ""understanding the underlying problems, and with an eye towards imputation of missing cases (e.g., by collecting enriched initial assessments)."" - ""employing robust full information maximum-likelihood (FIML) procedures to identify heterogeneous latent classes of PTSD symptom severity over time using LGMM.""",YES
28,5,"To determine if information about the distribution of the observed variables is included, we need to look for any mention of statistical measures or descriptions that indicate how the data is distributed. The context discusses the use of central tendency statistics, which implies examining the arithmetic mean over time. It also mentions the exclusion of individuals based on data collection times that deviate from the mean by more than two standard deviations. However, there is no explicit mention of measures like variance, skewness, kurtosis, or any other specific distributional characteristics of the observed variables. The context focuses on the mean and standard deviations for data collection times but does not provide detailed information about the distribution of the observed variables themselves. "," - ""Central tendency statistics assess groups as a whole by examining change to their arithmetic mean over time."" - ""individuals whose data were collected at inconsistent time intervals from the rest of the sample (as determined by being further than two standard deviations from the mean data collection time for each assessment) were not included."" ",NO
28,6,"To determine if the software is mentioned, we need to look for any references to software used in the study. The context states, ""We utilized Mplus 6.0 [38], employing robust full information maximum-likelihood (FIML) procedures to identify heterogeneous latent classes of PTSD symptom severity over time using LGMM."" This clearly indicates that Mplus 6.0 is the software mentioned for data analysis in the study. "," - ""We utilized Mplus 6.0 [38], employing robust full information maximum-likelihood (FIML) procedures to identify heterogeneous latent classes of PTSD symptom severity over time using LGMM."" ",YES
28,7,"To determine if alternative specifications of within-class heterogeneity are considered and documented, we need to look for mentions of different modeling techniques or comparisons between them in the context. The context discusses the use of LGMM (Latent Growth Mixture Modeling) and mentions the comparison of models in terms of overall fit and entropy. However, there is no mention of LGCA (Latent Growth Curve Analysis) or any other alternative specifications being considered or compared. The focus is solely on LGMM and its application, without any reference to other models or a clear documentation of alternatives."," - ""latent classes of PTSD symptom severity over time using LGMM."" - ""These modeling techniques allowed us to test whether the population under study is composed of a mixture of discrete distributions characterized as classes of individuals with differing profiles of growth [39], while also allowing for the modeling of covariates as predictors of class membership and slope parameters [40]."" - ""The classes differed in the overall fit in terms of entropy, but recovered the same classes in roughly the same proportions."" - No mention of LGCA or other alternative specifications.",NO
28,8,"To determine if alternative specifications of the between-class differences in variance-covariance matrix structure are considered and clearly documented, we need to look for any mention of such considerations or documentation in the context. The context discusses the use of various criteria (AIC, BIC, SSBIC, BLRT) to assess model fit and mentions the use of linear and quadratic parameters. However, there is no mention of alternative specifications of the between-class differences in variance-covariance matrix structure or any documentation of such considerations. Therefore, the answer is NO. "," - ""We compared progressive nested trajectory models by assessing relative fit based on reductions in the Bayesian Information Criterion (BIC), sample-size adjusted Bayesian Information Criterion (SSBIC), Aikaike Information Criterion (AIC), and significance indicated by the Bootstrap Likelihood Ratio Test (BLRT), along with parsimony and interpretability equally weighed."" - ""Based on the AIC, BIC, SSBIC, and BLRT, we found that successive models continued to demonstrate improved fit through four classes, both with linear only, and linear+quadratic parameters, with linear +quadratic parameters consistently out-performing linear alone (Table 2)."" - No mention of alternative specifications of the between-class differences in variance-covariance matrix structure. ",NO
28,9,"To determine if alternative shape/functional forms of the trajectories are described, we need to look for any mention of different trajectory models or forms in the context. The context discusses the use of LGMM (Latent Growth Mixture Modeling) to identify trajectories and mentions comparing progressive nested trajectory models. It also refers to assessing relative fit using various criteria like BIC, SSBIC, AIC, and BLRT. This indicates that different trajectory models were considered and compared, suggesting that alternative shape/functional forms were indeed described. "," - ""We compared progressive nested trajectory models by assessing relative fit based on reductions in the Bayesian Information Criterion (BIC), sample-size adjusted Bayesian Information Criterion (SSBIC), Aikaike Information Criterion (AIC), and significance indicated by the Bootstrap Likelihood Ratio Test (BLRT), along with parsimony and interpretability equally weighed."" ",YES
28,10,"To determine if analyses can still be replicated despite the use of covariates, we need to assess whether the inclusion of covariates affects the replicability of the study. The context mentions that covariates such as age, gender, and ten days symptom scores were used as predictors of class membership and slopes. However, it also states that the analyses were repeated with certain individuals removed, resulting in similar effects, which suggests that the core findings are robust. Additionally, the context does not indicate that the use of covariates prevents replication; rather, it implies that the analyses were conducted in a methodologically sound manner, consistent with literature recommendations. Therefore, the analyses can still be replicated. "," - ""We compared a progressive number of classes characterized by linear only or linear and quadratic parameters while accounting for non-specific psychological distress by residualizing PTSD symptom scores at 10 days and 7 months on K6 scores."" - ""We accounted for the effect of eventual trauma exposure during the study by regressing PTSD symptom scores at 7 and 15 months on our dummy-coded trauma-re-exposure variable as a time variant covariate."" - ""After establishing our best-fitting model, we first regressed class membership and then the freely estimated slopes within each class on a dummy-coded variable indicating the receipt of treatment."" - ""Next, we examined further covariates as predictors of the classes including age, gender, and ten days symptom."" - ""We therefore repeated the analysis with these individuals removed, which resulted in similar effect of treatment on class membership and slopes."" ",YES
28,11,"To determine if information about the number of random start values and final iterations is reported, we need to look for any mention of these specific details in the context. The context provided includes data on entropy, BLRT, and various criteria like AIC, BIC, and SSBIC, but does not mention random start values or final iterations. The context focuses on the study's methodology, participant data, and statistical results, but lacks any specific mention of random start values or final iterations. ", - [] ,NO
28,12,"To determine if the model comparison and selection tools are described from a statistical perspective, we need to identify if the context discusses statistical criteria and methods used for model comparison. The context mentions several statistical criteria such as the Bayesian Information Criterion (BIC), sample-size adjusted Bayesian Information Criterion (SSBIC), Aikaike Information Criterion (AIC), and the Bootstrap Likelihood Ratio Test (BLRT). These are all statistical tools used to assess model fit and compare models. Additionally, the context refers to the literature for recommendations on these criteria, further indicating a statistical approach. Therefore, the model comparison and selection tools are indeed described from a statistical perspective. "," - ""We compared progressive nested trajectory models by assessing relative fit based on reductions in the Bayesian Information Criterion (BIC), sample-size adjusted Bayesian Information Criterion (SSBIC), Aikaike Information Criterion (AIC), and significance indicated by the Bootstrap Likelihood Ratio Test (BLRT)"" - ""all criteria were consistent with recommendations from the literature [41]"" ",YES
28,13,"To determine if the total number of fitted models is reported, we need to identify the range of classes for which models were fitted. The context lists fit indices for 1 class, 2 classes, 3 classes, and 4 classes. This indicates that models were fitted for each of these class solutions. Therefore, the total number of fitted models, including a one-class solution, is reported. "," - ""1 Class 2 Classes 3 Classes 4 Classes"" - ""Fit Indices for One- to Four-Class Growth Mixture Models of PTSD Symptom Severity (n = 957)."" ",YES
28,14,"To determine if the number of cases per class is reported as either an absolute sample size or a proportion, we need to look for specific mentions of these metrics in the context. The context states that the largest class, ""Rapid Remitting,"" comprises ""56% of the sample,"" which indicates a proportion. There is no mention of an absolute sample size for any class. Therefore, the number of cases per class is reported as a proportion, not an absolute sample size. "," - ""The largest class (Rapid Remitting; 56% of the sample) displayed a precipitous drop in symptoms from 1 to 5 months..."" ",YES
28,15,"To determine if entropy is reported in the context of classifying cases in a trajectory, we need to look for any mention of entropy in the provided context. The context states, ""This analysis revealed weaker overall fit in terms of entropy,"" which indicates that entropy is indeed reported in relation to the analysis of trajectories. Therefore, the answer to the question is YES. "," - ""This analysis revealed weaker overall fit in terms of entropy"" ",YES
28,16,"To determine if a plot is included with the estimated mean trajectories of the final solution, we need to look for any mention of a plot or graphical representation in the context. The context provides information about the growth factor parameter estimates, post-hoc analyses, and the identification of three trajectories. However, there is no mention of a plot or graphical representation of the estimated mean trajectories. Therefore, based on the given context, there is no evidence to suggest that a plot is included. ", - [] ,NO
28,17,"To determine if plots are included with the estimated mean trajectories for each model, we need to look for any mention of plots or visual representations in the context. The context discusses various analyses, including the examination of trajectories, PTSD diagnostic criteria, and demographic differences, as well as statistical comparisons and criteria for model fit. However, there is no mention of plots or visual representations of the estimated mean trajectories. The context focuses on statistical analyses and criteria without indicating the inclusion of plots. ", - [] ,NO
28,18,"To determine if a plot is included of the combination of estimated means of the final model and the observed individual trajectories split out for each latent class, we need to look for any mention of such a plot in the context. The context discusses the use of latent trajectory approaches and growth mixture modeling to discern outcome groups and mentions parameter estimates and modeling techniques. However, there is no mention of a plot or visual representation of estimated means and observed individual trajectories for each latent class. Therefore, the answer is NO. ", - [] ,NO
28,19,"To determine if the characteristics of the final class solution are numerically described, we need to look for mentions of means, standard deviations/standard errors, sample sizes, or confidence intervals in the context. The context provides parameter estimates, standard errors, and p-values for different classes, but it does not mention means, standard deviations, sample sizes, or confidence intervals for the final class solution. Therefore, the characteristics of the final class solution are not numerically described in terms of means, SD/SE, n, CI, etc."," - ""The second largest class (Slow Remitting; 27%) demonstrated a relatively consistent rate of symptom reduction across time points, as indicated by a significant negative slope (Est = 28.83, SE = 2.50, p,.001) and a non-significant quadratic parameter (Est = 1.95,SE = 0.63,p =.23)."" - ""Finally, the smallest class (Non-Remitting; 17%) demonstrated consistently"" - ""The largest class (Rapid Remitting; 56% of the sample) displayed a precipitous drop in symptoms from 1 to 5 months as captured by a significant negative slope (Est = 226.72, SE = 2.28, p,.001), indicating a significant overall drop in symptoms from 10 days to five months, accompanied by a significant positive quadratic parameter, indicating a curvilinear rate of change (Est = 17.16.23,""",NO
28,20,"To determine if the syntax files are available, we need to look for any mention of syntax files in the context provided. The context includes information about the publication details, references to other works, and some brief descriptions of studies. However, there is no mention of syntax files being available in the appendix, supplementary materials, or from the authors. The context does not provide any evidence that syntax files are included or accessible. ", - [] ,NO
