paper_id,question_id,reasoning,evidence,answer
9,15,"To determine if entropy is reported, we need to look for any mention of entropy values or misclassification rates in the context. The context discusses the use of group-based trajectory analysis and mentions the TRAJ command and zero-inflated Poisson model. However, there is no mention of entropy values or the number of misclassifications per model, which are typically reported to assess the quality of classification in trajectory analysis. ", - [] ,NO
9,16,"To determine if a plot is included with the estimated mean trajectories of the final solution, we need to look for any mention of a figure or plot in the context. The context mentions ""Two distinct symptom trajectories were identified (see Figure 1)."" This indicates that a figure, likely a plot, is included to show the estimated mean trajectories. Therefore, the answer to the question is YES. "," - ""Two distinct symptom trajectories were identified (see Figure 1)."" ",YES
9,17,"To determine if plots are included with the estimated mean trajectories for each model, we need to look for any mention of figures or plots in the context. The context specifically references ""Figure 1"" in relation to the identification of symptom trajectories. This suggests that there is at least one plot included with the estimated mean trajectories. Therefore, the answer to the question is YES. "," - ""Two distinct symptom trajectories were identified (see Figure 1)."" ",YES
9,18,"To determine if a plot is included of the combination of estimated means of the final model and the observed individual trajectories split out for each latent class, we need to look for any mention of such a plot in the context. The context discusses the identification of two distinct symptom trajectories and mentions a figure (Figure 1) related to these trajectories. However, it does not specify that Figure 1 or any other figure includes the combination of estimated means of the final model and the observed individual trajectories split out for each latent class. There is no explicit mention of such a plot in the provided context. "," - ""Two distinct symptom trajectories were identified (see Figure 1)."" - No mention of a plot combining estimated means of the final model and observed individual trajectories split out for each latent class. ",NO
9,19,"To determine if the characteristics of the final class solution are numerically described, we need to look for numerical descriptions such as means, standard deviations (SD), standard errors (SE), sample sizes (n), or confidence intervals (CI) related to the class solution. The context provides numerical data for dissociation, subjective threat, thought suppression, and rumination, including means and standard errors. However, it does not explicitly mention these statistics in the context of a ""final class solution."" The context does not provide specific numerical descriptions for a class solution, such as means, SD/SE, n, or CI, related to the trajectory analysis or class solution itself."," - ""Dissociation 12.77.47.31.37.23.11.41.29.18.19.34 (3.56) ( <.001) (.004) ( <.001) (.04) (.33) ( <.001) (.01) (.11) (.09) (.002)"" - ""Subjective threat 10.37.20.42.11.17.39.40 /C0.20.15.26 (3.18) (.09) ( <.001) (.33) (.15) ( <.001) ( <.001) (.08) (.18) (.03)"" - ""Thought suppression 2.48.43.25.14.35.29.23.22.24 (1.12) ( <.001) (.03) (.21) (.001) (.01) (.04) (.04) (.03)"" - ""Rumination 5.66.41.02.25.59.06.11.09 (2.20) ( <.001) (.83) (.02) ( <.001) (.58) (.58) (.41)"" - ""Variables v2(1) p OR [95% CI] Subjective threat 6.88.01 1.32 [1.07, 1.61] Thought suppression 4.32.04 1.96 [1.04, 3.71] Maladaptive cognitions, damage to child 4.34.04 1.30 [1.10, 1.66] Family irritable distress 0.53.47 1.19 [0.74, 1.91]"" ",NO
9,20,"To determine if the syntax files are available, we need to look for any mention of syntax files in the context provided. The context includes publication details, references to other works, and download information, but there is no mention of syntax files being available in the appendix, supplementary materials, or from the authors. Therefore, based on the given context, there is no evidence to suggest that syntax files are available. ", - [] ,NO
10,0,"To determine if the metric or unit of time used in the statistical model is reported, we need to look for any mention of time units in the context. The context discusses the use of the PCL-S and CAPS measures at different time points (T1, T0, T2, T3) and mentions minimizing participant burden in the early weeks postdeployment. However, it does not specify the exact time units (e.g., hours, days, weeks, months, years) used in the statistical model itself. The mention of ""early weeks postdeployment"" provides a general timeframe but not the specific unit of time used in the model. "," - ""where necessary, negative variances that were not signiﬁcantly different from 0 were constrained to 0 (see Table 1)."" - ""Both measures were employed at all time points except T1, when only the PCL-S was used in order to minimize participant burden in the early weeks postdeployment."" - ""Data Analysis We employed second-order GMM (SOGMM; Grimm & Ram, 2009) to test whether distinct trajectories of posttraumatic stress"" ",NO
10,1,"To determine if information about the mean and variance of time within a wave is presented, we need to look for any mention of statistical measures related to time, such as mean and variance, within the context. The context discusses statistical analyses, such as F-values and p-values, related to age and prior deployments, but does not mention mean and variance of time within a wave. There is no reference to time-related statistical measures like mean and variance within a measurement occasion or period of time. Therefore, the answer is NO. "," - ""At predeployment, Marines in the middle tertile were younger than those in the lower tertile, F(389) = 7.12, p =.008;"" - ""and had fewer prior deployments than those in the upper tertile, F(409) = 5.89, p =.016."" - ""Data were assumed to be missing at random; consequently, using Mplus (Version 7; Muthén & Muthén, 1998–2013), full information maximum likelihood estimation was employed to address ignorable missingness."" - ""The final sample comprised 617 Marines at T0, 553 (89.6%) at T1, 327 (53.0%) at T2, and 286 (46.4%) at T3."" ",NO
10,2,"To determine if the missing data mechanism is reported, we need to identify any mention of how the missing data is treated or assumed in the context. The context explicitly states that ""Data were assumed to be missing at random; consequently, using Mplus (Version 7; Muthén & Muthén, 1998–2013), full information maximum likelihood estimation was employed to address ignorable missingness."" This indicates that the missing data mechanism is reported as missing at random (MAR). "," - ""Data were assumed to be missing at random; consequently, using Mplus (Version 7; Muthén & Muthén, 1998–2013), full information maximum likelihood estimation was employed to address ignorable missingness."" ",YES
10,3,"To determine if a description of variables related to attrition or missing data is provided, we need to look for any mention of factors influencing dropout rates, auxiliary variables, or patterns in the missing data. The context discusses the assumption that data were missing at random and mentions the use of full information maximum likelihood estimation to address missingness. However, it does not specify any particular variables or factors that are related to attrition or missing data, such as dropout effects, auxiliary variables, or skip patterns. Therefore, the answer is NO. "," - ""Data were assumed to be missing at random; consequently, using Mplus (Version 7; Muthén & Muthén, 1998–2013), full information maximum likelihood estimation was employed to address ignorable missingness."" - ""These attrition rates are comparable to other longitudinal studies of military"" ",NO
10,4,"To determine if a description is provided of how missing data in the analyses were dealt with, we need to look for specific methods mentioned in the context. The context states that ""using Mplus (Version 7; Muthén & Muthén, 1998–2013), full information maximum likelihood estimation was employed to address ignorable missingness."" This indicates that the method used to handle missing data was Full Information Maximum Likelihood (FIML). Therefore, a description of how missing data were dealt with is indeed provided. "," - ""using Mplus (Version 7; Muthén & Muthén, 1998–2013), full information maximum likelihood estimation was employed to address ignorable missingness."" ",YES
10,5,"To determine if information about the distribution of the observed variables is included, we need to look for mentions of tests for normality or multivariate normality within the context. The context provides details about model estimation, criteria for selecting the best-fitting models, and mentions of constraints on negative variances. However, there is no mention of tests for normally distributed variables within classes or multivariate normality. Therefore, the answer is NO. "," - ""Model estimation was iterative—modifications were made to account for estimation difficulties; where necessary, negative variances that were not significantly different from 0 were constrained to 0 (see Table 1)."" - ""Our models were selected in"" ",NO
10,6,"To determine if the software used for statistical analysis is mentioned, we need to look for any references to specific software in the context. The context explicitly states that ""using Mplus (Version 7; Muth´en & Muth´en, 1998–2013), full information maximum likelihood estimation was employed to address ignorable missingness."" This clearly indicates that Mplus was the software used for the statistical analysis. "," - ""using Mplus (Version 7; Muth´en & Muth´en, 1998–2013), full information maximum likelihood estimation was employed to address ignorable missingness."" ",YES
10,7,"To determine if alternative specifications of within-class heterogeneity are considered and documented, we need to look for mentions of different models or approaches compared to the ones used, such as LGCA (Latent Growth Curve Analysis) versus LGMM (Latent Growth Mixture Modeling). The context discusses the use of GMM and SOGMM but does not mention any comparison or documentation of alternative models like LGCA. Therefore, there is no evidence in the context that alternative specifications are considered or documented.", - [],NO
10,8,"To determine if alternative specifications of the between-class differences in variance-covariance matrix structure are considered and clearly documented, we need to look for any mention of such specifications in the context. The context provided discusses model fit improvements and class solutions but does not mention any specific alternative specifications of the variance-covariance matrix structure, such as constraints across subgroups or fixed across subgroups. The references cited do not provide additional information on this specific aspect either. Therefore, there is no evidence in the context that alternative specifications are considered and documented. ", - [] ,NO
10,9,"To determine if alternative shape/functional forms of the trajectories were described, we need to look for evidence of testing different trajectory forms, such as quadratic or non-linear trends. The context mentions that most participants in the middle tertile followed a quadratic trajectory, and it also describes a quadratic trajectory for a subset of participants in the upper tertile. Additionally, the context refers to the use of a method that combines Growth Mixture Modeling (GMM) with multiple-indicator factor models, which is noted to better control for measurement error and limit incorrect class solutions. This suggests that different trajectory forms were considered and tested. Therefore, the answer is YES. "," - ""In the middle tertile, most participants (74.5%) followed a quadratic trajectory (B =−1.69, SE =0.33, p <.001), which we labeled True Resilience."" - ""Sixteen percent followed a quadratic trajectory ( B =− 5.35, SE = 1.07, p <.001) similar to that of the upper tertile, but with lower peak severity, which we labeled"" - ""This approach combines GMM with multiple-indicator factor models, and compared to GMM, holds the advantage of producing outcomes that better control for measurement error, limiting the likelihood that an incorrect class solution will be identified (Grimm & Ram, 2009)."" ",YES
10,10,"To determine if the analyses could be replicated based on the use of covariates or predictors, we need to check if the context provides information on how these covariates or predictors were handled, such as whether they were time-varying or time-invariant, and at what level they were applied. The context discusses model estimation, modifications for estimation difficulties, and the use of GMM with multiple-indicator factor models. However, it does not specify the use of covariates or predictors, nor does it mention how they were applied in terms of time-variation or level of application. Therefore, there is no evidence in the context to suggest that the analyses could be replicated based on the use of covariates or predictors. ", - [] ,NO
10,11,"To determine if information about the number of random start values and final iterations is reported, we need to look for specific mentions of these details in the context. The context discusses model estimation, including modifications for estimation difficulties and constraints on negative variances, but does not mention the number of random start values or final iterations. There is no evidence provided about convergence to the maximum of the ML distribution or avoiding local maxima. Therefore, the answer is NO. "," - ""Model estimation was iterative—modifications were made to account for estimation difficulties; where necessary, negative variances that were not significantly different from 0 were constrained to 0 (see Table 1)."" - No mention of the number of random start values or final iterations. ",NO
10,12,"To determine if the model comparison and selection tools are described from a statistical perspective, we need to identify references to statistical criteria or methods. The context mentions the use of Akaike’s information criteria (CAIC), Bayesian information criterion (BIC), and bootstrapped likelihood ratio test (BLRT) as tools for model selection. These are all well-known statistical methods used for comparing and selecting models based on their fit and complexity. Therefore, the tools described are indeed from a statistical perspective."," - ""Our models were selected in accordance with findings from a Monte Carlo study by Nylund, Asparouhov, and Muthén (2007), which demonstrated that for samples of approximately 200 cases, class solutions are most accurately identified by selecting the lowest consistent Akaike’s information criteria (CAIC), the lowest Bayesian information criterion (BIC), and a significant bootstrapped likelihood ratio test (BLRT)."" - ""BIC indicated selection of the 4-class solution; however, the smallest class size (0.9%) was below the 5% cutoff and thus the more parsimonious and interpretable 3-class solution was selected."" - ""Note. BIC = Bayesian information criterion; CAIC = consistent Akaike’s information criteria; BLRT = bootstrapped likelihood ratio test;""",YES
10,13,"To determine if the total number of fitted models reported includes a one-class solution, we need to examine the context for any mention of a one-class solution. The context provides a table of fit statistics for class solutions 1–5, indicating that the solutions range from 1 to 5 classes. There is no mention of a one-class solution being excluded or not considered. Therefore, the total number of fitted models reported does include a one-class solution. "," - ""Table 1 Fit Statistics for Class Solutions 1–5"" - ""Upper tertile ( n = 234) 1 SLP Significant negative variance"" ",YES
10,14,"To determine if the number of cases per class is reported for each model, we need to look for information in the context that specifies either the absolute sample size, sample size per class, or proportion for each model. The context mentions ""Upper tertile (n = 234)"" and ""Middle tertile (n = 192),"" which indicates the total sample size for each tertile but does not provide specific sample sizes or proportions for each class within the models. The table lists fit statistics for class solutions but does not include sample sizes or proportions per class. Therefore, the number of cases per class is not reported. "," - ""Upper tertile (n = 234)"" - ""Middle tertile (n = 192)"" - ""Table 1 Fit Statistics for Class Solutions 1–5"" (no sample sizes or proportions per class listed) ",NO
10,15,"To determine if entropy is reported, we need to identify any mention of entropy values or related metrics in the context. The context states that the models were selected based on ""classification quality (i.e., entropy)"" and that ""all selected solutions had good entropy."" This indicates that entropy was indeed considered and reported as part of the model selection process. However, the context does not provide specific entropy values or the number of misclassifications per model. Therefore, while entropy is mentioned as a criterion, the specific values or misclassification numbers are not provided. "," - ""The best-fitting models were selected based on prior research, class sizes of at least 5% of the total sample, parsimony, interpretability, formal fit indices, and classification quality (i.e., entropy)."" - ""All selected solutions had good entropy, high posterior probabilities, and a significant BLRT."" ",NO
10,16,"To determine if a plot is included with the estimated mean trajectories of the final solution, we need to look for any mention of a figure or plot in the context. The context references ""Figure 1"" in relation to the SOGMM revealing three distinct trajectories. This suggests that a plot or figure is indeed included with the estimated mean trajectories of the final solution. "," - ""The SOGMM revealed that three distinct trajectories best explained the data in all tertiles of combat exposure (see Table 1 and Figure 1)."" ",YES
10,17,"To determine if plots are included with the estimated mean trajectories for each model, we need to look for any mention of figures or visual representations in the context. The context references ""Figure 1"" in relation to the SOGMM revealing three distinct trajectories. This suggests that there is at least one plot included with the estimated mean trajectories for the models discussed. "," - ""The SOGMM revealed that three distinct trajectories best explained the data in all tertiles of combat exposure (see Table 1 and Figure 1)."" ",YES
10,18,"To determine if a plot is included of the combination of estimated means of the final model and the observed individual trajectories split out for each latent class, we need to look for any mention of such a plot in the context. The context discusses the results of a study using growth mixture modeling (GMM) and mentions the SOGMM revealing three distinct trajectories. It also references Table 1 and Figure 1, which likely contain relevant data or visualizations. However, there is no explicit mention of a plot that combines estimated means of the final model with observed individual trajectories split out for each latent class. Therefore, based on the provided context, there is no evidence to confirm the presence of such a plot. "," - ""The SOGMM revealed that three distinct trajectories best explained the data in all tertiles of combat exposure (see Table 1 and Figure 1)."" - No explicit mention of a plot combining estimated means and observed individual trajectories split out for each latent class. ",NO
10,19,"To determine if the characteristics of the final class solution are numerically described, we need to look for mentions of means, standard deviations (SD), standard errors (SE), sample sizes (n), confidence intervals (CI), or similar numerical descriptors in the context. The context provides information about the fit statistics for class solutions, including BIC, CAIC, BLRT, Entropy, LLP, and SCP, but does not mention specific numerical characteristics like means, SD, SE, or CI for the final class solution. Therefore, the answer is NO. "," - ""Table 1 Fit Statistics for Class Solutions 1–5"" - ""Class Variances = 0 BIC CAIC BLRT Entropy LLP SCP"" - No mention of means, SD, SE, n, CI, etc. ",NO
10,20,"To determine if the syntax files are available, we need to look for any mention of syntax files in the context provided. The context consists of download information and terms of use for an article from Wiley Online Library. There is no mention of syntax files, appendix, supplementary materials, or any indication that they are available from the authors. The context only provides information about the download and licensing terms. ", - [] ,NO
11,0,"To determine if the metric or unit of time used in the statistical model is reported, we need to look for any mention of time units in the context. The context provides information about the first work period and the number of days worked. Specifically, it mentions ""9/18/2001–6/30/2002"" and ""9/11–9/12, 2001"" as time periods, and ""1–7"" days worked. These references indicate that days are used as the unit of time in the statistical model. Therefore, the answer is YES. "," - ""First work period 9/18/2001–6/30/2002"" - ""9/11–9/12, 2001"" - ""Number of days worked 1–7"" ",YES
11,1,"To determine if information about the mean and variance of time within a wave is presented, we need to look for any mention of statistical measures related to time, such as mean and variance, within the context of the data collection waves. The context provides details about the data collection waves and the sample size but does not mention any statistical measures like mean or variance related to time within a wave. The table provided shows mean PCL scores and parameter estimates for different groups but does not include variance or time-related statistics. Therefore, there is no evidence in the context that information about the mean and variance of time within a wave is presented. ", - [] ,NO
11,2,"To determine if the missing data mechanism is reported, we need to identify any mention of how the missing data is treated or classified. The context states that ""PROC TRAJ assumes values of the dependent variable are missing at random, and uses all available values for each subject."" This indicates that the study assumes the missing data mechanism is MAR (Missing at Random). Therefore, the missing data mechanism is indeed reported. "," - ""PROC TRAJ assumes values of the dependent variable are missing at random, and uses all available values for each subject."" ",YES
11,3,"To determine if a description is provided of what variables are related to attrition or missing data, we need to look for specific mentions of variables or patterns associated with dropout or missing data. The context mentions missing data and loss to follow-up but does not specify any particular variables related to these issues. It states that additional analyses showed no substantial impact of nonrandom patterns of missing data, but it does not describe specific variables related to attrition or missing data. Therefore, the answer is NO. "," - ""Other limitations to this study included missing data (up to 7.7%), as well as loss to follow-up and the possibility of differential rates of participation based on constructs hypothesized to be explanatory."" - ""Additional analyses revealed no substantial impact of potentially nonrandom patterns of missing data occurring for either reason."" ",NO
11,4,"To determine if a description is provided of how missing data were dealt with, we need to look for specific methods such as listwise deletion, multiple imputation, or full information maximum likelihood (FIML) mentioned in the context. The context mentions ""missing data (up to 7.7%)"" and ""additional analyses revealed no substantial impact of potentially nonrandom patterns of missing data occurring for either reason."" However, it does not specify any particular method used to handle the missing data. Therefore, there is no description of how the missing data were dealt with in terms of specific methods. "," - ""missing data (up to 7.7%)"" - ""additional analyses revealed no substantial impact of potentially nonrandom patterns of missing data occurring for either reason."" ",NO
11,5,"To determine if information about the distribution of the observed variables is included, we need to look for mentions of tests for normality or distribution checks within the context. The context discusses the use of multinomial logit and multivariate regression models, BIC values, and the assessment of model fit, but it does not mention any specific tests for normality or distribution of the observed variables. There is no reference to tests for normally distributed variables within classes or multivariate normality. Therefore, the answer is NO. ", - [],NO
11,6,"To determine if the software used for statistical analysis is mentioned, we need to look for any references to specific software in the context. The context explicitly mentions the use of ""PROC TRAJ macro"" and ""SAS software (version 9.2)"" for the statistical analysis. Therefore, the software used is indeed mentioned. "," - ""Using the PROC TRAJ macro (Jones, Nagin, & Roeder, 2001) for SAS software (version 9.2)"" - ""PROC TRAJ assumes values of the dependent variable are missing at random, and uses all available values for each subject."" ",YES
