paper_id,question_id,reasoning,evidence,answer
19,5,"To determine if information about the distribution of observed variables is included, we need to look for mentions of tests for normality or distribution within the context. The context references growth mixture modeling and latent class analysis, which often involve assumptions about the distribution of variables. However, there is no specific mention of tests for normally distributed variables within classes or multivariate normality. The context discusses identifying a univariate single-class growth model and comparing multiple-class models, but it does not explicitly state that distribution tests were conducted. "," - ""A univariate single-class growth model was first identified without covariates."" - ""We then compared 2- to 6-class unconditional LGMMs and"" ",NO
19,6,"To determine if the software used for statistical analysis is mentioned, we need to look for any reference to specific software in the context. The context states, ""To characterize longitudinal trajectories of Hurricane Ike-related PTSD symptoms, we conducted latent growth mixture modeling (LGMM) using robust full-information maximum likelihood estimation in Mplus (Muthén, 2004)."" This clearly indicates that Mplus was used for the statistical analysis. "," - ""To characterize longitudinal trajectories of Hurricane Ike-related PTSD symptoms, we conducted latent growth mixture modeling (LGMM) using robust full-information maximum likelihood estimation in Mplus (Muthén, 2004)."" ",YES
19,7,"To determine if alternative specifications of within-class heterogeneity are considered and documented, we need to look for mentions of different models or approaches being compared or discussed. The context mentions the use of ""unconditional LGMMs"" and compares models with different numbers of classes. However, there is no mention of comparing LGMMs with other models like LGCA or any documentation of alternative specifications. The focus is solely on comparing different class numbers within the LGMM framework. "," - ""We then compared 2- to 6-class unconditional LGMMs and"" - ""We identiﬁed the best-ﬁtting model based on smaller BIC, SSA-BIC, and AIC values, higher entropy values, and on results of the LRT and the BLRT"" ",NO
19,8,"To determine if alternative specifications of the between-class differences in variance-covariance matrix structure are considered and clearly documented, we need to look for any mention of different specifications such as constrained or fixed across subgroups. The context discusses identifying the best-fitting model based on criteria like BIC, SSA-BIC, AIC, entropy values, and likelihood ratio tests. However, there is no mention of considering or documenting alternative specifications of the variance-covariance matrix structure across subgroups. Therefore, the answer is NO. "," - ""We identiﬁed the best-ﬁtting model based on smaller BIC, SSA-BIC, and AIC values, higher entropy values, and on results of the LRT and the BLRT, which quantify the likelihood that the data can be better described by a model with one less trajectory."" - No mention of alternative specifications of the variance-covariance matrix structure. ",NO
19,9,"To determine if alternative shape/functional forms of the trajectories were described, we need to look for any mention of testing different forms such as quadratic or non-linear trends. The context discusses the identification of the best-fitting model based on criteria like BIC, SSA-BIC, AIC, entropy values, LRT, and BLRT, and mentions comparing 2- to 6-class unconditional LGMMs. However, there is no specific mention of testing alternative shape/functional forms like quadratic or non-linear trends. The focus is on class sizes, average latent class probabilities, and the use of LGMMs without reference to different trajectory shapes. "," - ""We identiﬁed the best-ﬁtting model based on smaller BIC, SSA-BIC, and AIC values, higher entropy values, and on results of the LRT and the BLRT."" - ""We then compared 2- to 6-class unconditional LGMMs."" ",NO
19,10,"To determine if the analyses could be replicated, we need to check if the study reported the use of covariates or predictors in a detailed manner, such as specifying whether they were time-varying or time-invariant and at what level they were applied. The context mentions the use of independent variables in analyses and the computation of composite scores when variables were correlated. It also discusses the use of multivariate analysis and the consideration of covariates. However, there is no specific mention of whether these covariates were time-varying or time-invariant, nor is there detail on their application at the level of dependent or independent variables. Therefore, the necessary information for replication is not provided. "," - ""analysis of variance orc2 analyses were entered as independent variables."" - ""If a composite variable emerged as being signiﬁcantly related to trajectory group, a post-hoc analysis was conducted to evaluate which variable(s) that comprise this variable were inde-"" - ""whether the population under study is composed of a mixture of subpopulations that display distinct trajectories of change over time instead of computing a single mean for the population, as in traditional regression or growth-curve approaches (Curran and Hussong, 2003; Muthén, 2004; Nylund et al., 2007)."" - ""A univariate single-class growth model wasﬁrst identiﬁed without covariates. We then compared 2- to 6-class unconditional LGMMs and"" ",NO
19,11,"To determine if information about the number of random start values and final iterations is reported, we need to look for specific mentions of these details in the context. The context discusses the use of latent growth mixture modeling (LGMM) and criteria for model fitting, such as BIC, SSA-BIC, AIC, entropy values, LRT, and BLRT. However, there is no mention of the number of random start values or final iterations, which are typically reported to ensure convergence in maximum likelihood estimation. Therefore, the answer is NO. "," - ""To characterize longitudinal trajectories of Hurricane Ike-related PTSD symptoms, we conducted latent growth mixture modeling (LGMM) using robust full-information maximum likelihood estimation in Mplus (Muthén, 2004)."" - ""We identiﬁed the best-ﬁtting model based on smaller BIC, SSA-BIC, and AIC values, higher entropy values, and on results of the LRT and the BLRT, which quantify the likelihood that the data can be better described by a model with one less trajectory."" - No mention of the number of random start values or final iterations. ",NO
19,12,"To determine if the model comparison and selection tools are described from a statistical perspective, we need to identify if the context discusses these tools in terms of their statistical properties or criteria. The context mentions several statistical indices such as the Bayesian Information Criterion (BIC), sample size-adjusted BIC (SSA-BIC), Akaike Information Criterion (AIC), entropy, the Lo-Mendell-Rubin likelihood ratio test (LRT), and the bootstrapped likelihood ratio test (BLRT). These are all well-known statistical measures used for model comparison and selection. The context also explains how these indices are used to identify the best-fitting model, such as smaller BIC, SSA-BIC, and AIC values indicating better-fitting models, and significant values for the LRT and BLRT indicating a better description of the data with one less trajectory. This indicates a statistical perspective in describing these tools. "," - ""We then compared 2- to 6-class unconditional LGMMs and assessed their relative fit using conventional indices, including the Bayesian Information Criterion (BIC), sample size-adjusted BIC (SSA-BIC), Akaike Information Criterion (AIC), entropy, the Lo-Mendell-Rubin likelihood ratio test (LRT;Lo et al., 2001), and the bootstrapped likelihood ratio test (BLRT; McLachlan and Peel, 2000; Nylund et al., 2007)."" - ""We identified the best-fitting model based on smaller BIC, SSA-BIC, and AIC values, higher entropy values, and on results of the LRT and the BLRT, which quantify the likelihood that the data can be better described by a model with one less trajectory."" - ""Smaller BIC, SSA-BIC, and AIC values, and higher entropy values indicate better-fitting models; significant values for the LRT and the BLRT quantify the likelihood that the data can be better described by a model with one less trajectory."" ",YES
19,13,"To determine if the total number of fitted models, including a one-class solution, is reported, we need to look for any mention of the range of class solutions that were considered. The context states, ""Table 1 shows fit statistics of 1–6 class solutions of disaster-related PTSD symptoms over the three assessments."" This indicates that models with 1 to 6 classes were considered, which includes a one-class solution. "," - ""Table 1 shows fit statistics of 1–6 class solutions of disaster-related PTSD symptoms over the three assessments."" ",YES
19,14,"To determine if the number of cases per class is reported for each model, we need to look for specific mentions of absolute sample sizes, sample sizes per class, or proportions for each class within the models. The context mentions that in the 3-class model, 162 (78.7%) respondents had no/low disaster-related PTSD symptoms over time. This provides the number of cases and the proportion for one class in the 3-class model. However, there is no mention of the number of cases per class for the 2-class model or the other classes within the 3-class model. Therefore, the number of cases per class is not fully reported for each model. "," - ""In this model, 162 (78.7%) respondents had no/low disaster-related PTSD symptoms over time"" - ""entropy values were highest for the 2- and 3-class models"" - ""the BLRT suggested that the 3-class model fit significantly better than the 2-class model"" ",NO
19,15,"To determine if entropy is reported, we need to look for mentions of entropy values or related metrics in the context. The context explicitly states that entropy values were considered when identifying the best-fitting model, and it mentions that entropy values were highest for the 2- and 3-class models. This indicates that entropy was indeed reported as part of the analysis. Additionally, the context discusses the use of entropy values in the context of model fit, which is relevant to the classification of cases in a trajectory. "," - ""entropy values were highest for the 2- and 3-class models"" - ""our efforts to identify the best fitting model of longitudinal trajectories considered class sizes, average latent class probabilities, in fit of models with an increasing number of classes, entropy values were highest for the 2- and 3-class models"" ",YES
19,16,"To determine if a plot is included with the estimated mean trajectories of the final solution, we need to look for any mention of a plot or graphical representation in the context. The context discusses the use of latent growth mixture modeling to identify PTSD symptom trajectories and mentions the selection of a 3-class solution. However, there is no mention of a plot or any graphical representation being included with the estimated mean trajectories. Therefore, based on the provided context, there is no evidence to suggest that a plot is included. ", - [] ,NO
19,17,"To determine if plots are included with the estimated mean trajectories for each model, we need to look for any mention of visual representations or plots in the context. The context discusses the criteria used to identify the best-fitting model, such as BIC, SSA-BIC, AIC values, entropy values, and statistical tests like LRT and BLRT. It also mentions the use of latent growth mixture modeling to identify PTSD symptom trajectories and the characterization of these trajectories. However, there is no mention of plots or visual representations of the estimated mean trajectories for each model. Therefore, based on the provided context, there is no evidence to suggest that plots are included. ", - [] ,NO
19,18,"To determine if a plot is included of the combination of estimated means of the final model and the observed individual trajectories split out for each latent class, we need to look for any mention of such a plot in the context. The context discusses the criteria for selecting the best-fitting model and the methods used for data analysis, including latent growth mixture modeling (LGMM). However, there is no mention of a plot or any visual representation of the estimated means and observed individual trajectories split out for each latent class. Therefore, based on the provided context, there is no evidence to suggest that such a plot is included. ", - [] ,NO
19,19,"To determine if the characteristics of the final class solution are numerically described, we need to look for mentions of means, standard deviations/standard errors (SD/SE), sample sizes (n), or confidence intervals (CI) in the context. The context provides information about weighted means and standard errors (SE) for variables such as age, sex, race/ethnicity, and education. It also mentions fit statistics and entropy related to class solutions of PTSD symptoms. However, there is no specific mention of numerical descriptions (means, SD/SE, n, CI) for the final class solution itself. The context focuses on demographic and clinical characteristics by PTSD symptom trajectory group but does not provide detailed numerical descriptions for the final class solution. "," - ""weighted mean (SE)"" - ""Table 1 shows fit statistics of 1e6 class solutions of disaster-related PTSD symptoms over the three assessments."" - ""Table 2 Demographic, exposure, and clinical characteristics by PTSD symptom trajectory group."" ",NO
19,20,"To determine if the syntax files are available, we need to look for any mention of syntax files in the context provided. The context includes information about the study, acknowledgments, conflict of interest, role of funding sources, and contributors. However, there is no mention of syntax files being available in the appendix, supplementary materials, or from the authors. Therefore, based on the given context, there is no evidence to suggest that syntax files are available. ", - [] ,NO
20,0,"To determine if the metric or unit of time used in the statistical model is reported, we need to look for any mention of time units such as hours, days, weeks, months, or years in the context. The context mentions that the study tracked the longitudinal course of PTSD for roughly 10 months and refers to different assessment points (Time 1, Time 2, Time 3, and Time 4) without specifying the exact time intervals between these points. There is no explicit mention of the metric or unit of time used in the statistical model itself. Therefore, the answer is NO. "," - ""this study tracked the longitudinal course of PTSD for roughly 10 months."" - ""Nine percent of the sample was assigned membership to the third trajectory, unrealized expectations. Members of this group were characterized by a relatively higher level of symptom severity at predeployment, followed by a marked decrease at Time 2, and a low level of symptom severity at Time 3 and 4."" - ""Data were obtained from 605 (95%) participants at T1, 628 (98%) participants at T2, 381 (60%) participants at T3, and 166 (26%) participants at T4."" ",NO
20,1,"To determine if information about the mean and variance of time within a wave is presented, we need to look for any mention of these statistical measures in the context. The context discusses the estimation of parameters for latent class trajectories, the relationship with latent class assignment, and the use of covariates. It also mentions data collection points and the use of a missing data algorithm. However, there is no mention of the mean and variance of time within a wave or any related statistical measures. Therefore, the answer is NO. ", - [] ,NO
20,2,"To determine if the missing data mechanism is reported, we need to identify any mention of the type of missing data mechanism used in the context. The context explicitly states that the data were assumed to be missing at random (MAR) due to military rotation policies and human error. This assumption is supported by references to Switzer & Roth (2002) and is consistent with the use of a full information maximum likelihood (FIML) approach, which is appropriate for MAR data. Therefore, the missing data mechanism is indeed reported as MAR. "," - ""Because military rotation policies and human error likely explain most of the missing data in our sample, we assumed that these data were missing at random (MAR; e.g., Switzer & Roth, 2002)."" - ""A FIML approach assumes that data are MAR (e.g., Buhi, Goodson, & Neilands, 2008), and is therefore an appropriate technique for handling the data missing in the present sample."" ",YES
20,3,"To determine if a description is provided of what variables are related to attrition/missing data, we need to look for any mention of factors or variables that explain or are associated with the dropout rates. The context mentions attrition as a common limitation and provides attrition rates at different time points (T1, T2, T3, T4). However, it does not specify any variables or factors that are related to this attrition or missing data, such as dropout effects, auxiliary variables, or skip patterns. The context focuses on the rates of data collection and the variables used in the analysis but does not link these to the attrition rates. "," - ""Due to standard military rotation policies (e.g., sick and leave time), attrition is known to be a common limitation of research involving the prospective examination of military units."" - ""data were obtained from 605 (95%) participants at T1, 628 (98%) participants at T2, 381 (60%) participants at T3, and 166 (26%) participants at T4."" - No mention of variables related to attrition/missing data. ",NO
20,4,"To determine if a description is provided of how missing data were dealt with, we need to identify any mention of specific techniques used for handling missing data. The context explicitly states that a ""missing data algorithm found in MPlus version 5.1 that imputes data using a full information maximum likelihood (FIML) approach"" was employed. This indicates that the FIML approach was used to handle missing data. Therefore, the answer to the question is YES. "," - ""Accordingly, we employed a missing data algorithm found in MPlus version 5.1 that imputes data using a full information maximum likelihood (FIML) approach (e.g., Arbuckle, 1996)."" - ""A FIML approach was employed with the PCL data only; participants missing data"" ",YES
20,5,"To determine if information about the distribution of the observed variables is included, we need to look for mentions of tests for normality or distribution characteristics of the variables within the context. The context discusses comparisons between latent classes and their predictors, the use of a Wald test, and the inclusion of various variables in models. However, there is no mention of tests for normality, such as tests for normally distributed variables within classes or multivariate normality. The focus is on the predictors and their significance, not on the distribution of the observed variables. ", - [] ,NO
20,6,"To determine if the software used for statistical analysis is mentioned, we need to look for any references to specific software in the context. The context explicitly states that ""Mplus version 5.1 was used to perform all analyses."" This clearly identifies the software used for the statistical analysis. "," - ""Mplus version 5.1 was used to perform all analyses."" ",YES
20,7,"To determine if alternative specifications of within-class heterogeneity are considered and clearly documented, we need to identify any mention of comparing different models or specifying their differences. The context discusses Latent Class Growth Analysis (LCGA) and Growth Mixture Modeling (GMM), noting that GMM allows for variation within latent classes, unlike LCGA. However, it does not explicitly state that these alternatives are compared or documented in detail. The context only mentions the limitation of LCGA and the capability of GMM without further elaboration on a comparative analysis or documentation."," - ""One noted limitation of LCGA is that it does not allow variation to occur around the mean growth curves within a latent class (Muth´en & Muth´en, 2000)."" - ""Although one alternative form of latent growth modeling, growth mixture modeling (GMM), does allow such variation, it specifies a model with more unknown parameters than LCGA.""",NO
20,8,"To determine if alternative specifications of the between-class differences in variance-covariance matrix structure are considered and clearly documented, we need to look for any mention of such specifications in the context. The context discusses latent class growth analysis (LCGA) and growth mixture modeling (GMM) but does not provide any specific details about alternative specifications of the variance-covariance matrix structure, such as whether they are constrained or fixed across subgroups. There is no evidence in the context that these specifications are considered or documented. ", - [] ,NO
20,9,"To determine if alternative shape/functional forms of the trajectories were described, we need to look for any mention of testing different forms such as quadratic or non-linear trends. The context discusses using group-based latent growth modeling to test for heterogeneity in PTSD course and identifies the nature of the trajectories that best fit the data. However, there is no mention of testing alternative shapes or functional forms like quadratic or non-linear trends. The focus is on identifying distinct trajectory classes and comparing them with a hypothesized model, without reference to testing different functional forms."," - ""Our aims were (a) to use group-based latent growth modeling to test for heterogeneity in PTSD course, (b) to identify the nature of the trajectories best fitting the data and compare these with the trajectories hypothesized in Bonanno’s (2004) model, and (c) to examine the relationship between predictor variables and participants’ assignment to latent class."" - ""However, because all other goodness of fit indicators suggested that the 4-group solution fit the data best, it was selected as the unconditional model solution and is depicted graphically in Figure 1.""",NO
20,10,"To determine if the analyses could be replicated, we need to check if the context provides sufficient detail about how covariates or predictors were used, specifically whether they were time-varying or time-invariant and at what level they were applied. The context mentions that covariates were entered into the conditional model and includes demographic and trauma exposure variables. However, it does not specify whether these covariates were time-varying or time-invariant, nor does it detail their application at the level of dependent or independent variables. Without this information, replication of the analyses is not clearly supported. "," - ""The covariates entered into the conditional model included demographic variables (race, age, rank, and education), trauma exposure variables (previous traumatic events, peacekeeping daily hassles, and combat)."" - ""The predictors we included in our model have previously been shown to relate to PTSD (e.g., Brewin et al., 2000; Ozer et al., 2003), and were assessed either at predeployment or immediately following deployment."" ",NO
20,11,"To determine if information about the number of random start values and final iterations is reported, we need to look for any mention of these specific details in the context. The context discusses the use of Mplus version 5.1 for analyses, the establishment of latent classes, and the goodness of fit statistics considered. However, there is no mention of the number of random start values or final iterations used in the estimation process. The context does not provide any information about convergence to the maximum of the ML distribution or avoiding local maxima, which would typically involve details about random starts and iterations. ", - [] ,NO
20,12,"The question asks whether the model comparison and selection tools described are from a statistical perspective. The context mentions several statistical tools used for model comparison, including the Bayesian information criterion (BIC), the sample-size adjusted BIC, the Akaike information criterion (AIC), the Lo-Mendell-Rubin likelihood ratio test, average latent class probabilities of group membership, and entropy. These are all statistical measures used to evaluate model fit and compare different models. Therefore, the tools described are indeed from a statistical perspective. "," - ""Goodness of fit statistics considered when examining latent class solutions included the Bayesian information criterion (BIC), the sample-size adjusted BIC, the Akaike information criterion (AIC), the Lo-Mendell-Rubin likelihood ratio test, average latent class probabilities of group membership, and entropy."" - ""Goodness of fit comparisons were made between unconditional trajectory group models ranging in size from 2 to 5 groups."" ",YES
