paper_id,question_id,reasoning,evidence,answer
10,0,"To determine if the metric of time used in the statistical model is reported, we need to look for any mention of time intervals or specific time points in the context. The context mentions time points labeled as T0, T1, T2, and T3, which indicates specific time points used in the analysis. However, it does not specify the exact metric of time (e.g., days, months, years) between these points. Therefore, while the time points are mentioned, the metric of time is not explicitly reported. "," - ""Both measures have high internal consistency (CAPS: T0 α =.82; T2 α =.83; T3 α =.86; PCL: T0 α =.90; T1 α =.95; T2 α =.93; T3 α =.93)."" - ""For the SOGMMs, to obtain CAPS scaling, the means of the intercept growth factors were freed across classes and the CAPS intercepts were set to 0 (K. J. Grimm, personal communication, February 15, 2013)."" ",NO
10,1,"To determine if information about the mean and variance of time within a wave is presented, we need to look for any mention of these statistical measures in the context. The context discusses the sample sizes at different time points (T0, T1, T2, T3), attrition rates, and some statistical results related to age and prior deployments. However, there is no mention of the mean and variance of time within a wave. The context focuses on sample sizes, attrition rates, and some statistical tests, but does not provide specific details about the mean and variance of time within a wave. "," - ""The final sample comprised 617 Marines at T0, 553 (89.6%) at T1, 327 (53.0%) at T2, and 286 (46.4%) at T3."" - ""These attrition rates are comparable to other longitudinal studies of military PTSD, depression, anxiety, or overall functional capacities and disability."" - ""At predeployment, Marines in the middle tertile were younger than those in the lower tertile, F(389) = 7.12, p =.008; and had fewer prior deployments than those in the upper tertile, F(409) = 5.89, p =.016."" ",NO
10,2,"To determine if the missing data mechanism is reported, we need to identify any mention of how the missing data was handled or assumed. The context states that ""Data were assumed to be missing at random"" and that ""full information maximum likelihood estimation was employed to address ignorable missingness."" This indicates that the missing data mechanism is indeed reported as missing at random (MAR). "," - ""Data were assumed to be missing at random"" - ""full information maximum likelihood estimation was employed to address ignorable missingness"" ",YES
10,3,"To determine if a description is provided of what variables are related to attrition or missing data, we need to look for any mention of factors or variables that explain why data might be missing or why participants might drop out. The context mentions that data were assumed to be missing at random and describes the use of full information maximum likelihood estimation to address missingness. However, it does not specify any particular variables that are related to the attrition or missing data. There is no mention of factors such as demographics, baseline characteristics, or other variables that might influence attrition or missing data. "," - ""Data were assumed to be missing at random; consequently, using Mplus (Version 7; Muthén & Muthén, 1998–2013), full information maximum likelihood estimation was employed to address ignorable missingness."" - ""The final sample comprised 617 Marines at T0, 553 (89.6%) at T1, 327 (53.0%) at T2, and 286 (46.4%) at T3."" ",NO
10,4,"To determine if a description is provided of how missing data in the analyses were dealt with, we need to look for any mention of methods or techniques used to handle missing data. The context mentions that the missing CAPS data point was accommodated by creating a missing variable placeholder within each factor model (McArdle & Woodcock, 1997). Additionally, it states that data were assumed to be missing at random and that full information maximum likelihood estimation was employed using Mplus to address ignorable missingness. These statements provide a clear description of how missing data were handled in the analyses. "," - ""The missing CAPS data point was accommodated by creating a missing variable placeholder within each factor model (McArdle & Woodcock, 1997)."" - ""Data were assumed to be missing at random; consequently, using Mplus (Version 7; Muthén & Muthén, 1998–2013), full information maximum likelihood estimation was employed to address ignorable missingness."" ",YES
10,5,"To determine if information about the distribution of the observed variables is included, we need to look for any mention of statistical measures or descriptions that indicate how the data is distributed. The context provides standard deviations (SD) for Cohort 4 and Cohort 3, which are measures of variability and can give some insight into the distribution of the data. However, there is no mention of other distributional characteristics such as mean, median, skewness, kurtosis, or any graphical representation like histograms or box plots. Therefore, while there is some information about variability, there is no comprehensive information about the full distribution of the observed variables. "," - ""had the greatest variability in exposure (Cohort 4: SD = 13.12; Cohort 3: SD = 8.69)"" - No mention of mean, median, skewness, kurtosis, or graphical representations. ",NO
10,6,"To determine if software is mentioned, we need to identify any references to software tools or programs in the context. The context includes references to ""Mplus user’s guide"" by Muthén, L. K., & Muthén, B. O., which is a software tool used for statistical analysis with latent variables. This indicates that the software ""Mplus"" is indeed mentioned in the context. "," - ""Mplus user’s guide (7th ed.). Los Angeles, CA: Author."" - ""Mplus: Statistical analysis with latent variables: User’s guide(6th ed.). Los Angeles, CA: Author."" ",YES
10,7,"To determine if alternative specifications of within-class heterogeneity are considered and documented, we need to look for mentions of different models or approaches compared to the ones used, such as LGCA (Latent Growth Curve Analysis) versus LGMM (Latent Growth Mixture Modeling). The context discusses the use of GMM and SOGMM but does not mention any comparison or documentation of alternative models like LGCA. Therefore, there is no evidence in the context that alternative specifications are considered or documented. ", - [] ,NO
10,8,"To determine if alternative specifications of the between-class differences in variance-covariance matrix structure are considered and clearly documented, we need to look for explicit mentions of such considerations or documentation in the context. The context discusses model fit statistics and class solutions but does not mention any alternative specifications or documentation of variance-covariance matrix structures. There is no evidence provided in the context that alternative specifications were considered or documented. ", - [] ,NO
10,9,"To determine if alternative shape/functional forms of the trajectories are described, we need to look for any mention of different trajectory shapes or functions in the context. The context discusses three distinct trajectories within each tertile: True Resilience, New-Onset Symptoms, and Pre-existing Symptoms. However, it does not mention any alternative shapes or functional forms of these trajectories. The focus is on the prevalence and characteristics of these trajectories rather than their shapes or functional forms. Therefore, the answer is NO. "," - ""Three distinct trajectories best explained the data within each tertile."" - ""The upper tertile comprised True Resilience (73.2%), New-Onset Symptoms (18.3%), and Pre-existing Symptoms (8.5%) trajectories."" - ""The middle tertile also comprised True Resilience (74.5%), New-Onset Symptoms (16.1%), and Pre-existing Symptoms (9.4%) trajectories."" ",NO
10,10,"To determine if analyses can still be replicated when covariates have been used, we need to assess whether the context provides information on the use of covariates and the replicability of the analyses. The context discusses model estimation, selection criteria, and limitations but does not explicitly mention the use of covariates. It also suggests that the findings should be replicated in other samples, indicating an intention for replicability. However, without specific information on covariates, we cannot definitively conclude that their use affects replicability based on the given context. "," - ""The best-fitting models were selected based on prior research, class sizes of at least 5% of the total sample, parsimony, interpretability, formal fit indices, and classification quality (i.e., entropy)."" - ""Our models were selected in deployed service members given the potential heavy combat experienced by this cohort, and should be replicated in other samples."" - No explicit mention of covariates. ",NO
10,11,"To determine if information about the number of random start values and final iterations is reported, we need to look for any mention of these specific details in the context. The context provides information about the statistical methods used, such as Mplus and full information maximum likelihood estimation, but does not mention the number of random start values or final iterations. Therefore, there is no evidence in the context that addresses this specific detail. ", - [] ,NO
10,12,"To determine if the model comparison and selection tools are described from a statistical perspective, we need to identify if the context provides statistical criteria or methods used for model selection. The context mentions several statistical measures and tests, such as the Bayesian Information Criterion (BIC), bootstrapped likelihood ratio test (BLRT), chi-square statistics (χ2), Tucker-Lewis Index (TLI), Comparative Fit Index (CFI), Root Mean Square Error of Approximation (RMSEA), and Standardized Root Mean Square Residual (SRMR). These are all statistical tools used to evaluate model fit and compare models. Therefore, the context does describe the model comparison and selection tools from a statistical perspective. "," - ""The best-fitting models were selected based on prior research, class sizes of at least 5% of the total sample, parsimony, interpretability, formal fit indices, and classification quality (i.e., entropy)."" - ""Our models were selected in criterion (BIC), and a significant bootstrapped likelihood ratio test (BLRT)."" - ""All three factor models demonstrated good fit to the data, upper tertile: χ2(17, 234) = 38.95, p =.002, TLI =.96, CFI =.97, RMSEA =.074, 90% CI [.043,.105], SRMR =.053; middle tertile: χ2(17, 192) = 59.89, p <.001, TLI =.91, CFI =.93, RMSEA =.115, 90% CI [.084,.147], SRMR =.061; lower tertile: χ2(17, 208) = 39.57, p <.001, TLI =.96, CFI =.96, RMSEA =.080, 90% CI [.047,.113], SRMR =.037."" ",YES
10,13,"To determine if the total number of fitted models reported includes a one-class solution, we need to examine the context for any mention of a one-class solution. The context provides a table labeled ""Fit Statistics for Class Solutions 1–5,"" which lists solutions from 1 to 5 classes. However, it does not explicitly mention a one-class solution in the table or the surrounding text. The text discusses solutions from 2 to 5 classes and mentions a 3-class solution as optimal, but there is no direct reference to a one-class solution being fitted or considered. Therefore, based on the provided context, there is no evidence of a one-class solution being reported. "," - ""Table 1 Fit Statistics for Class Solutions 1–5"" - ""Class Variances = 0 BIC CAIC BLRT Entropy LLP SCP"" - ""Upper tertile ( n = 234) 1 SLP Significant negative variance"" - ""Middle tertile ( n = 192) 1 SLP, QRD 7,028.1 7,040.1"" ",NO
10,14,"To determine if the number of cases per class is reported, we need to look for information in the context that specifies either the absolute sample size or the proportion of cases for each class. The context mentions ""Upper tertile (n = 234)"" and ""Middle tertile (n = 192),"" which indicates the absolute sample sizes for these tertiles. However, it does not provide the number of cases per class within these tertiles. The context does not mention proportions of cases per class either. Therefore, the number of cases per class is not reported in the context. "," - ""Upper tertile (n = 234)"" - ""Middle tertile (n = 192)"" - No mention of the number of cases per class or proportions within these tertiles. ",NO
10,15,"To determine if entropy is reported in the context of classifying cases in a trajectory, we need to look for mentions of entropy in relation to model selection or classification quality. The context states that the best-fitting models were selected based on several criteria, including ""classification quality (i.e., entropy)."" Additionally, it mentions that ""all selected solutions had good entropy."" This indicates that entropy was indeed reported as part of the classification quality assessment. "," - ""The best-fitting models were selected based on prior research, class sizes of at least 5% of the total sample, parsimony, interpretability, formal fit indices, and classification quality (i.e., entropy)."" - ""All selected solutions had good entropy, high posterior probabilities, and a significant BLRT."" ",YES
10,16,"To determine if a plot is included with the estimated mean trajectories of the final solution, we need to look for any mention of a figure or plot in the context. The context references ""Figure 1"" in relation to the SOGMM revealing three distinct trajectories. This suggests that a plot or figure is indeed included with the estimated mean trajectories of the final solution. "," - ""The SOGMM revealed that three distinct trajectories best explained the data in all tertiles of combat exposure (see Table 1 and Figure 1)."" ",YES
10,17,"To determine if plots are included with the estimated mean trajectories for each model, we need to look for any mention of figures or plots in the context. The context references ""Figure 1"" in relation to the SOGMM revealing three distinct trajectories. This suggests that there is at least one plot included with the estimated mean trajectories for the models discussed. "," - ""The SOGMM revealed that three distinct trajectories best explained the data in all tertiles of combat exposure (see Table 1 and Figure 1)."" ",YES
10,18,"To determine if a plot is included of the combination of estimated means of the final model and the observed individual trajectories split out for each latent class, we need to look for any mention of such a plot in the context. The context discusses the results of a study using growth mixture modeling (GMM) and mentions the SOGMM revealing three distinct trajectories. It also references Table 1 and Figure 1, which likely contain relevant data or visualizations. However, there is no explicit mention of a plot that combines estimated means of the final model with observed individual trajectories split out for each latent class. Therefore, based on the provided context, there is no evidence to confirm the presence of such a plot. "," - ""The SOGMM revealed that three distinct trajectories best explained the data in all tertiles of combat exposure (see Table 1 and Figure 1)."" - No explicit mention of a plot combining estimated means and observed individual trajectories split out for each latent class. ",NO
10,19,"To determine if the characteristics of the final class solution are numerically described, we need to look for mentions of means, standard deviations (SD), standard errors (SE), sample sizes (n), confidence intervals (CI), or similar numerical descriptors in the context. The context provides information about the fit statistics for different class solutions, including BIC, CAIC, BLRT, Entropy, LLP, and SCP, but does not mention specific numerical characteristics like means, SD, SE, or CI for the final class solution. Therefore, the answer is NO. "," - ""Table 1 Fit Statistics for Class Solutions 1–5"" - ""Class Variances = 0 BIC CAIC BLRT Entropy LLP SCP"" - No mention of means, SD, SE, n, CI, etc. ",NO
10,20,"To determine if the syntax files are available, we need to look for any mention of syntax files in the context provided. The context consists of information about the download details of a paper from Wiley Online Library, including the DOI, the downloading institution, and the terms and conditions. There is no mention of syntax files, appendix, supplementary materials, or any availability of such files from the authors in the provided context. Therefore, based on the given information, we cannot conclude that syntax files are available. ", - [] ,NO
11,0,"To determine if the metric of time is reported in the statistical model, we need to look for any mention of how time is measured or used in the context. The context discusses the use of the PROC TRAJ macro for SAS software and mentions ""three waves"" of PCL scores, which implies a temporal aspect. However, it does not specify the exact metric of time (e.g., days, months, years) used in the model. Therefore, the metric of time is not explicitly reported in the context. "," - ""Most (92%) subjects had PCL scores at all three waves; subjects missing a single score were"" - ""Using the PROC TRAJ macro (Jones, Nagin, & Roeder, 2001) for SAS software (version 9.2) and specifying a censored normal distribution, an initial model was run with a single trajectory group, after which successive models included one additional group at a time."" ",NO
11,1,"To determine if information about the mean and variance of time within a wave is presented, we need to look for any mention of these statistical measures in the context. The context discusses the timing of traumatic life events, data collection waves, and sample characteristics, but does not provide specific details about the mean and variance of time within each wave. There is no mention of these statistical measures in the provided text. ", - [] ,NO
11,2,"To determine if the missing data mechanism is reported, we need to identify any mention of how the missing data was handled or assumed in the study. The context states that ""Additional analyses revealed no substantial impact of potentially nonrandom patterns of missing data occurring for either reason."" It also mentions that ""PROC TRAJ assumes values of the dependent variable are missing at random, and uses all available values for each subject."" These statements indicate that the study assumes the missing data mechanism to be ""missing at random"" (MAR). Therefore, the missing data mechanism is indeed reported. "," - ""Additional analyses revealed no substantial impact of potentially nonrandom patterns of missing data occurring for either reason."" - ""PROC TRAJ assumes values of the dependent variable are missing at random, and uses all available values for each subject."" ",YES
11,3,"To determine if a description is provided of what variables are related to attrition/missing data, we need to look for any mention of specific variables that are linked to missing data or attrition in the context. The context mentions missing data and loss to follow-up but does not specify any particular variables that are related to these issues. It only states that subjects missing relevant independent variables were excluded and provides the number of missing values for certain variables, but it does not describe any relationship between these variables and attrition or missing data. Therefore, the answer is NO. "," - ""Subjects missing relevant independent variables were excluded from analyses; among variables with missing values, degree of dust cloud exposure had the most (n = 1,282), whereas witnessing traumatic events on 9/11 had the least (n = 25); analytic samples ranged in size from 13,636"" - ""Other limitations to this study included missing data (up to 7.7%), as well as loss to follow-up and the possibility of differential rates of participation based on constructs hypothesized to be explanatory."" - ""Additional analyses revealed no substantial impact of potentially nonrandom patterns of missing data occurring for either reason."" ",NO
11,4,"To determine if a description is provided of how missing data in the analyses were dealt with, we need to look for specific methods or approaches mentioned in the context. The context states that ""subjects missing a single score were included in analyses, as PROC TRAJ assumes values of the dependent variable are missing at random, and uses all available values for each subject."" This indicates a specific method (PROC TRAJ) and an assumption (missing at random) used to handle missing data. Additionally, it mentions that ""subjects missing relevant independent variables were excluded from analyses."" These details provide a clear description of how missing data were addressed in the study. "," - ""subjects missing a single score were included in analyses, as PROC TRAJ assumes values of the dependent variable are missing at random, and uses all available values for each subject."" - ""subjects missing relevant independent variables were excluded from analyses"" ",YES
11,5,"To determine if information about the distribution of the observed variables is included, we need to look for any mention of statistical summaries or descriptions of the variables' distributions in the context. The context discusses the handling of missing data, the inclusion and exclusion criteria for subjects, and the use of Bayesian information criterion (BIC) for model comparison. However, there is no mention of statistical summaries such as means, standard deviations, or any other measures that describe the distribution of the observed variables. Therefore, the answer is NO. ", - [],NO
11,6,"To determine if the software is mentioned, we need to look for any references to software used in the context. The context specifically mentions ""SAS software (version 9.2)"" as the software used for running the initial model with the PROC TRAJ macro. This clearly indicates that the software is mentioned. "," - ""Using the PROC TRAJ macro (Jones, Nagin, & Roeder, 2001) for SAS software (version 9.2)"" ",YES
11,7,"To determine if alternative specifications of within-class heterogeneity are considered and documented, we need to look for mentions of different models or approaches, such as Latent Growth Curve Analysis (LGCA) versus Latent Growth Mixture Modeling (LGMM), and any documentation of these considerations. The context mentions ""Latent class growth modeling: A tutorial"" by Andruff et al. (2009), which suggests a discussion of LGCA. However, there is no explicit mention of LGMM or a comparison between LGCA and LGMM. Additionally, there is no documentation provided in the context about considering alternative specifications. Therefore, the answer is NO. "," - ""Latent class growth modeling: A tutorial. Tutorials in Quantitative Methods for Psychology, 5, 11–24."" - ""Assumptions made by the analytic model regarding homogenous trajectories with no individual variance may have misrepresented the number of latent classes, and three assessments may have been insufficient to identify"" ",NO
11,8,"To determine if alternative specifications of the between-class differences in variance-covariance matrix structure are considered and clearly documented, we need to look for any mention of such considerations or documentation in the context. The context discusses potential limitations and strengths of the study, including issues with statistical significance, selection biases, and assumptions of the analytic model. However, there is no mention of alternative specifications of the variance-covariance matrix structure or their documentation. Therefore, based on the provided context, it appears that this aspect is not addressed. ", - [] ,NO
11,9,"To determine if alternative shape/functional forms of the trajectories are described, we need to look for evidence in the context that discusses different trajectory shapes or forms. The context mentions the use of ""significant (at p <.05) linear and/or quadratic coefficients from equations describing each trajectory"" to define trajectory shape. This indicates that both linear and quadratic forms are considered in the analysis. Therefore, alternative shape/functional forms of the trajectories are indeed described. "," - ""Signiﬁcant (at p <.05) linear and/or quadratic coefﬁcients from equations describing each trajectory were used to deﬁne trajectory shape in models for subsequent analyses."" ",YES
