paper_id,question_id,reasoning,evidence,answer
19,12,"To determine if the model comparison and selection tools are described from a statistical perspective, we need to identify if the context discusses these tools in terms of statistical criteria or methods. The context mentions several conventional indices used for model comparison, such as the Bayesian Information Criterion (BIC), sample size-adjusted BIC (SSA-BIC), Akaike Information Criterion (AIC), entropy, the Lo-Mendell-Rubin likelihood ratio test (LRT), and the bootstrapped likelihood ratio test (BLRT). These are all statistical measures used to assess model fit and compare models. Therefore, the description of these tools is indeed from a statistical perspective."," - ""We then compared 2- to 6-class unconditional LGMMs and assessed their relative fit using conventional indices, including the Bayesian Information Criterion (BIC), sample size-adjusted BIC (SSA-BIC), Akaike Information Criterion (AIC), entropy, the Lo-Mendell-Rubin likelihood ratio test (LRT; Lo et al., 2001), and the bootstrapped likelihood ratio test (BLRT; McLachlan and Peel, 2000; Nylund et al., 2007).""",YES
19,13,"To determine if the total number of fitted models is reported, including a one-class solution, we need to look for any mention of the range of class solutions that were considered. The context states, ""Table 1 shows fit statistics of 1–6 class solutions of disaster-related PTSD symptoms over the three assessments."" This indicates that models with 1 to 6 classes were considered, which includes a one-class solution. "," - ""Table 1 shows fit statistics of 1–6 class solutions of disaster-related PTSD symptoms over the three assessments."" ",YES
19,14,"To determine if the number of cases per class is reported for each model, we need to look for information in the context that specifies either the absolute sample size or the proportion of cases for each class in the models. The context mentions that in the 3-class model, 162 respondents (78.7%) had no/low disaster-related PTSD symptoms over time. This provides the number of cases and the proportion for one of the classes in the 3-class model. However, there is no mention of the number of cases or proportions for the 2-class model or the other classes in the 3-class model. Therefore, the context does not provide the number of cases per class for each model. "," - ""In this model, 162 (78.7%) respondents had no/low disaster-related PTSD symptoms over time"" - ""Based on these fit statistics, average latent class probabilities (all >95%), theory, and interpretability/parsimony of the various models (Muthén, 2004; Nylund et al., 2007), we chose the 3-class model as optimal."" ",NO
19,15,"To determine if entropy is reported in the context of classifying cases in a trajectory, we need to look for mentions of entropy values in relation to model fitting. The context explicitly states that entropy values were considered when identifying the best-fitting model, with specific mention of entropy values being highest for the 2- and 3-class models. This indicates that entropy was indeed reported as part of the model evaluation process. "," - ""entropy values were highest for the 2- and 3-class models"" - ""entropy values, and the BLRT, which quantify the likelihood that the data can be better described by a model with one less trajectory"" ",YES
19,16,"To determine if a plot is included with the estimated mean trajectories of the final solution, we need to look for any mention of a plot or graphical representation in the context. The context discusses the use of latent growth mixture modeling to identify PTSD symptom trajectories and mentions the selection of a 3-class solution. However, there is no mention of a plot or any graphical representation being included with the estimated mean trajectories. Therefore, based on the provided context, there is no evidence to suggest that a plot is included. ", - [] ,NO
19,17,"To determine if plots are included with the estimated mean trajectories for each model, we need to look for any mention of visual representations or plots in the context. The context discusses the criteria used to identify the best-fitting model, such as BIC, SSA-BIC, AIC values, entropy values, and statistical tests like LRT and BLRT. It also mentions the use of latent growth mixture modeling to identify PTSD symptom trajectories and the characterization of these trajectories. However, there is no mention of plots or visual representations of the estimated mean trajectories for each model. Therefore, based on the provided context, there is no evidence to suggest that plots are included. ", - [] ,NO
19,18,"To determine if a plot is included of the combination of estimated means of the final model and the observed individual trajectories split out for each latent class, we need to look for any mention of such a plot in the context. The context discusses the criteria for selecting the best-fitting model and the methods used for data analysis, including latent growth mixture modeling (LGMM). However, there is no mention of a plot or any visual representation of the estimated means and observed individual trajectories split out for each latent class. Therefore, based on the provided context, there is no evidence to suggest that such a plot is included. ", - [] ,NO
19,19,"To determine if the characteristics of the final class solution are numerically described, we need to look for mentions of means, standard deviations/standard errors (SD/SE), sample sizes (n), or confidence intervals (CI) in the context. The context provides information about weighted means and standard errors (SE) for variables such as age, sex, race/ethnicity, and education. It also mentions fit statistics and entropy related to class solutions of PTSD symptoms. However, there is no specific mention of numerical descriptions (means, SD/SE, n, CI) for the final class solution itself. The context focuses on demographic and clinical characteristics by PTSD symptom trajectory group but does not provide detailed numerical descriptions for the final class solution. "," - ""weighted mean (SE)"" - ""Table 1 shows fit statistics of 1e6 class solutions of disaster-related PTSD symptoms over the three assessments."" - ""Table 2 Demographic, exposure, and clinical characteristics by PTSD symptom trajectory group."" ",NO
19,20,"To determine if the syntax files are available, we need to look for any mention of syntax files in the context provided. The context includes information about the study, acknowledgments, conflict of interest, role of funding sources, and contributors. However, there is no mention of syntax files being available in the appendix, supplementary materials, or from the authors. Therefore, based on the given context, there is no evidence to suggest that syntax files are available. ", - [] ,NO
20,0,"To determine if the metric of time used in the statistical model is reported, we need to look for any mention of time intervals or specific time points in the context. The context mentions ""Time 1 and Time 2,"" ""Time 3 and 4,"" and ""Time 1 and 2,"" ""Time 3 and 4"" again, but it does not specify the actual metric of time (e.g., days, weeks, months, years) used between these points. Therefore, the metric of time is not explicitly reported in the context. "," - ""Time 1 and Time 2"" - ""Time 3 and 4"" - ""Time 1 and 2, followed by a steady increase in symptoms at Time 3 and 4"" ",NO
20,1,"To determine if information about the mean and variance of time within a wave is presented, we need to look for any mention of these statistical measures in the context. The context discusses missing data, trajectory findings, and predictors of latent class assignment, but does not mention the mean and variance of time within a wave. There is no evidence in the provided text that addresses these specific statistical measures.", - [],NO
20,2,"To determine if the missing data mechanism is reported, we need to identify any mention of the assumptions or mechanisms regarding the missing data. The context states that the data were assumed to be missing at random (MAR) due to military rotation policies and human error. This assumption is explicitly mentioned, indicating that the missing data mechanism is indeed reported."," - ""Because military rotation policies and human error likely explain most of the missing data in our sample, we assumed that these data were missing at random (MAR; e.g., Switzer & Roth, 2002).""",YES
20,3,"To determine if a description is provided of what variables are related to attrition/missing data, we need to look for any mention of specific variables that influence or are associated with attrition or missing data in the context. The context mentions standard military rotation policies, such as sick and leave time, as a known limitation related to attrition. However, it does not provide a detailed description of specific variables that are related to attrition or missing data beyond this general statement. Therefore, the answer is NO. "," - ""Due to standard military rotation policies (e.g., sick and leave time), attrition is known to be a common limitation of research involving the prospective examination of military units (e.g., Adler et al., 2008)."" ",NO
20,4,"To determine if a description is provided of how missing data in the analyses were dealt with, we need to look for any mention of methods or algorithms used to handle missing data. The context mentions the use of a ""missing data algorithm found in MPlus version 5.1 that imputes data using a full information maximum likelihood (FIML) approach."" It also states that this approach assumes data are missing at random (MAR) and is appropriate for handling the missing data in the sample. Therefore, there is a clear description of how missing data were addressed in the analyses. "," - ""Accordingly, we employed a missing data algorithm found in MPlus version 5.1 that imputes data using a full information maximum likelihood (FIML) approach (e.g., Arbuckle, 1996)."" - ""A FIML approach assumes that data are MAR (e.g., Buhi, Goodson, & Neilands, 2008), and is therefore an appropriate technique for handling the data missing in the present sample."" ",YES
20,5,"To determine if information about the distribution of the observed variables is included, we need to look for any mention of statistical descriptions such as means, standard deviations, frequencies, or other distributional characteristics of the variables. The context provided discusses the types of data collected at different assessment points, the use of a missing data algorithm, and the grouping of predictor variables. However, there is no mention of any statistical details or descriptions of the distribution of these variables. Therefore, the answer is NO. ", - [] ,NO
20,6,"To determine if the software is mentioned, we need to identify any references to software in the context. The context explicitly states that a ""missing data algorithm found in MPlus version 5.1"" was employed. This clearly indicates that the software MPlus is mentioned. "," - ""Accordingly, we employed a missing data algorithm found in MPlus version 5.1"" ",YES
20,7,"To determine if alternative specifications of within-class heterogeneity are considered and clearly documented, we need to identify any mention of comparing different models, such as LCGA and GMM, and whether their differences are explicitly discussed. The context mentions that LCGA does not allow variation within latent classes, while GMM does, but it does not explicitly state that these alternatives are compared or documented in detail. The context only briefly mentions the limitation of LCGA and the alternative of GMM without a clear comparison or documentation of these alternatives."," - ""One noted limitation of LCGA is that it does not allow variation to occur around the mean growth curves within a latent class (Muth´en & Muth´en, 2000)."" - ""Although one alternative form of latent growth modeling, growth mixture modeling (GMM), does allow such variation, it specifies a model with more unknown parameters than LCGA."" - ""Latent class growth analysis (LCGA) was used to model growth curves.""",NO
20,8,"To determine if alternative specifications of the between-class differences in variance-covariance matrix structure are considered and clearly documented, we need to look for any mention of such considerations or documentation in the context. The context discusses limitations of LCGA and mentions GMM as an alternative that allows variation around mean growth curves. However, there is no mention of alternative specifications of the between-class differences in variance-covariance matrix structure being considered or documented. The context focuses on the differences between LCGA and GMM in terms of parameter specification and does not address the specific question of variance-covariance matrix structure. "," - ""One noted limitation of LCGA is that it does not allow variation to occur around the mean growth curves within a latent class (Muth´en & Muth´en, 2000)."" - ""Although one alternative form of latent growth modeling, growth mixture modeling (GMM), does allow such variation, it specifies a model with more unknown parameters than LCGA."" ",NO
20,9,"To determine if alternative shape/functional forms of the trajectories are described, we need to look for any mention of different forms or variations in the trajectories beyond the ones explicitly stated. The context describes four hypothesized symptom trajectories by Bonanno (2004): chronic, delayed, recovery, and resilience. Additionally, Orcutt et al. (2004) identified two distinct trajectories: resilience and delayed. The context does not mention any alternative shape or functional forms beyond these described trajectories. Therefore, there is no evidence of alternative forms being described. "," - ""He hypothesized four symptom trajectories: chronic, delayed, recovery, and resilience."" - ""Orcutt et al. (2004) identified two distinct trajectories: one characterized by low levels of initial PTSD symptoms with little increase over time (i.e., resilience), and the other by higher levels of initial symptoms with a significant increase over time (i.e., delayed)."" ",NO
20,10,"To determine if analyses can still be replicated when covariates have been used, we need to look for any mention of replication in the context of using covariates. The context mentions a ""4-group (including covariates)"" analysis, indicating that covariates were indeed used. Additionally, the context states, ""several of the conditional model analyses border on the null, again pointing to the need for these findings to be replicated."" This suggests that despite the use of covariates, there is a need for replication of the findings. Therefore, analyses can still be replicated even when covariates have been used. "," - ""4-group (including covariates) 10276.40 10070.05 9993.48 – 0.958"" - ""several of the conditional model analyses border on the null, again pointing to the need for these ﬁndings to be replicated."" ",YES
20,11,"To determine if information about the number of random start values and final iterations is reported, we need to look for any mention of these specific details in the context. The context discusses the use of a missing data algorithm and the FIML approach but does not provide specific details about the number of random start values or final iterations used in the analysis. There is no mention of these parameters in the provided text. ", - [] ,NO
20,12,"To determine if the model comparison and selection tools are described from a statistical perspective, we need to identify if the context mentions statistical criteria or tests used for model comparison. The context lists several statistical criteria and tests, such as the Bayesian information criterion (BIC), the sample-size adjusted BIC, the Akaike information criterion (AIC), the Lo-Mendell-Rubin likelihood ratio test, average latent class probabilities of group membership, and entropy. These are all statistical measures used to evaluate and compare model fit, indicating that the model comparison and selection tools are indeed described from a statistical perspective."," - ""Goodness of fit statistics considered when examining latent class solutions included the Bayesian information criterion (BIC), the sample-size adjusted BIC, the Akaike information criterion (AIC), the Lo-Mendell-Rubin likelihood ratio test, average latent class probabilities of group membership, and entropy.""",YES
20,13,"To determine if the total number of fitted models is reported, including a one-class solution, we need to identify any mention of models ranging from one class to the maximum number of classes considered. The context mentions that goodness of fit comparisons were made between models ranging from 2 to 5 groups. There is no mention of a one-class solution being considered or reported. Therefore, the answer is NO. "," - ""Goodness of fit comparisons were made between unconditional trajectory group models ranging in size from 2 to 5 groups."" ",NO
20,14,"To determine if the number of cases per class is reported for each model, we need to look for any mention of absolute sample sizes or proportions of cases within each class in the context. The context mentions that the first trajectory, resilience, described 84% of the current sample, which indicates a proportion. However, there is no mention of absolute sample sizes for any of the classes. The context does not provide any specific numbers or proportions for the other classes (recovery, delayed, and unrealized expectations) either. Therefore, the context only provides a proportion for one class and does not report the number of cases per class for each model in terms of absolute sample size or proportion. "," - ""The ﬁrst trajectory, resilience, described 84% of the current"" - No mention of absolute sample sizes for any classes. ",NO
20,15,"To determine if entropy is reported, we need to look for any mention of entropy in the context. Entropy is a measure used in latent class analysis to assess the quality of classification of cases into latent classes. The context provided discusses the classification of participants into different trajectories and mentions the predictors and characteristics of these trajectories. However, there is no mention of entropy or any related measure of classification quality in the context provided. ", - [] ,NO
20,16,"To determine if a plot is included with the estimated mean trajectories of the final solution, we need to look for any mention of a graphical depiction in the context. The context states that the 4-group solution is ""depicted graphically in Figure 1."" This indicates that there is indeed a plot included with the estimated mean trajectories of the final solution. "," - ""However, because all other goodness of fit indicators suggested that the 4-group solution fit the data best, it was selected as the unconditional model solution and is depicted graphically in Figure 1."" ",YES
20,17,"To determine if plots are included with the estimated mean trajectories for each model, we need to look for any mention of visual representations or plots in the context. The context discusses the modeling of growth curves, the establishment of latent classes, and the examination of goodness of fit statistics. However, there is no mention of plots or visual representations being included with the estimated mean trajectories. The context focuses on statistical methods and results but does not indicate the inclusion of plots. ", - [] ,NO
20,18,"To determine if a plot is included of the combination of estimated means of the final model and the observed individual trajectories split out for each latent class, we need to look for any mention of such a plot in the context. The context discusses the use of group-based latent growth modeling, the establishment of latent classes, and the examination of predictors. However, there is no mention of a plot or visual representation of the estimated means and observed individual trajectories for each latent class. The context focuses on the statistical methods and aims of the study but does not reference any specific figures or plots. ", - [] ,NO
20,19,"To determine if the characteristics of the final class solution are numerically described, we need to look for mentions of statistical measures such as means, standard deviations (SD), standard errors (SE), sample sizes (n), or confidence intervals (CI) in the context. The context provides information about goodness-of-fit statistics and criteria for selecting the group solution, but it does not mention any numerical descriptions of the final class solution itself, such as means, SD, SE, n, or CI. Therefore, the answer is NO. "," - ""Goodness of fit statistics considered when examining latent class solutions included the Bayesian information criterion (BIC), the sample-size adjusted BIC, the Akaike information criterion (AIC), the Lo-Mendell-Rubin likelihood ratio test, average latent class probabilities of group membership, and entropy."" - ""The most favored group solution is one having the lowest BIC, lowest sample-size adjusted BIC, lowest AIC, a significant Lo-Mendell-Rubin likelihood ratio test, latent class membership probabilities approaching a value of 1.0 (and probabilities for assignment to other groups approaching 0), and a high entropy value approaching 1.0."" - ""Following selection of the 4-group solution, potential predictors of latent class membership were entered into the analytic model, further improving model fit (Table 1)."" ",NO
20,20,"To determine if the syntax files are available, we need to look for any mention of their availability in the context. The context discusses the limitations of the study, such as the small percentage of female participants and the need for replication of findings. It also mentions the sources of data collection and presentation but does not provide any information about the availability of syntax files in the appendix, supplementary materials, or from the authors. There is no evidence in the context indicating that syntax files are available. ", - [] ,NO
21,0,"To determine if the metric of time is reported in the statistical model, we need to look for any mention of how time is treated or measured in the context of the statistical analysis. The context mentions the use of longitudinal studies and latent growth mixture modeling (LGMM), which inherently involves time as a factor. However, it does not specify the exact metric of time used in the model. The context does not provide details on whether time is measured in months, years, or any other specific unit. Therefore, based on the information provided, the metric of time is not explicitly reported. "," - ""Longitudinal studies of PTSD symptomatology have utilized statistical techniques uniquely suited for the study of longitudinal heterogeneity, specifically latent growth mixture modeling (LGMM), which allows for the empirical exploration of the underlying heterogeneity of the data that would otherwise be treated as error."" - ""Over the five time points, 49 participants were missing data at one time point, 24 at two time points, 17 at three time points, and 12 at four time points."" ",NO
21,1,"To determine if information about the mean and variance of time within a wave is presented, we need to look for any mention of these specific statistical measures in the context. The context provides descriptive statistics and correlations for study variables, including measures like Events, DES, PDEQ, and the modified PCL-M at different time points. However, there is no mention of the mean and variance of time within a wave. The context focuses on missing data, ANOVA results, and correlations between variables, but does not provide specific details about the mean and variance of time within a wave."," - ""Over the five time points, 49 participants were missing data at one time point, 24 at two time points, 17 at three time points, and 12 at four time points."" - ""An analysis of variance (ANOVA) revealed that missingness was not associated with baseline scores on the modified PCL-M, F (1, 177) = 0.63, p =.60; the DES, F (1,"" - ""Table 1. Descriptive Statistics and Correlations for All Study Variables"" - ""Measures MS D 1 2 34567 8"" - ""1. Events 3.52 4.86 –"" - ""2. DES 6.03 6.85.04 –"" - ""3. PDEQ T1 1.50 0.59.17 ∗∗.06 –"" - ""Modiﬁed PCL-M"" - ""4. Baseline 21.62 6.55.22 ∗∗∗.16∗∗.49∗∗∗ –"" - ""5. 6 months 21.06 7.00.10.13.37 ∗∗∗.54∗∗∗ –"" - ""6. 12 months 20.82 6.46.20 ∗∗.08.31 ∗∗∗.47∗∗∗.37∗∗∗ –"" - ""7. 18 months 19.97 4.57.17 ∗∗.20∗∗.47∗∗∗.49∗∗∗.48∗∗∗.71∗∗∗ –""",NO
21,2,"To determine if the missing data mechanism is reported, we need to identify any mention of assumptions or methods related to how missing data is handled. The context states that a robust full-information maximum-likelihood (FIML) estimation procedure was employed, which assumes that missing data are ""unrelated to the outcome variable (i.e., missing at random)."" Additionally, it is mentioned that the appropriateness of FIML is endorsed and that subjects with and without missing data did not differ in initial PTSD symptom scores, supporting the assumption that data were missing at random. Therefore, the missing data mechanism is indeed reported as ""missing at random."" "," - ""a robust full-information maximum-likelihood (FIML) estimation procedure for handling missing data."" - ""FIML estimation assumes missing data are unrelated to the outcome variable (i.e., missing at random)."" - ""subjects with and without missing data did not differ in initial PTSD symptom scores."" - ""we proceeded in our analysis with the assumption that data were missing at random."" ",YES
