paper_id,question_id,reasoning,evidence,answer
10,1,"To determine if information about the mean and variance of time within a wave is presented, we need to look for any mention of statistical measures (mean and variance) related to time within a specific measurement occasion or period. The context discusses various time points (T0, T1, T2, T3) and mentions statistical analyses related to combat exposure and other variables. However, it does not provide specific mean and variance values for time within a wave or measurement occasion. The context focuses on the timing of assessments and the exclusion criteria but does not detail the statistical properties of time within a wave. "," - ""Cohort 4 deployed to Helmand Province in Afghanistan during a time of heavy unrest and experienced significantly greater mean combat exposure than other cohorts, F(3, 2205) = 371.87, p <.001 (Cohort 4: M = 22.32; Cohort 3: M = 13.02), and also had the greatest variability in exposure (Cohort 4: SD = 13.12; Cohort 3: SD = 8.69)."" - ""Assessments occurring more than 10 days outside these modal time points were excluded pairwise."" ",NO
10,2,"The question asks whether the missing data mechanism is reported in the context. The context explicitly states, ""Data were assumed to be missing at random; consequently, using Mplus (Version 7; Muthén & Muthén, 1998–2013), full information maximum likelihood estimation was employed to address ignorable missingness."" This indicates that the missing data mechanism is reported as missing at random (MAR). "," - ""Data were assumed to be missing at random; consequently, using Mplus (Version 7; Muthén & Muthén, 1998–2013), full information maximum likelihood estimation was employed to address ignorable missingness."" ",YES
10,3,"To determine if a description of variables related to attrition or missing data is provided, we need to look for any mention of factors influencing dropout rates or patterns in the data. The context mentions that Marines excluded from the main analyses were more likely to report a previous deployment at baseline and had higher functional impairment, more education, were older, and reported more prior lifetime trauma. These factors are related to the characteristics of those who dropped out or were excluded, which can be considered auxiliary variables related to attrition. Therefore, the context does provide a description of variables related to attrition/missing data. "," - ""Marines excluded from the main analyses were more likely to report a previous deployment at baseline than included Marines T0: χ2(1, N = 860) = 9.88, p =.002; T1: χ2(1, N = 860) = 6.73, p =.009; T2: χ2 (1, N = 860) = 28.62, p <.001; T3: χ2(1, N = 860) = 71.35, p <.001."" - ""In addition, at T0, excluded Marines reported higher functional impairment than Marines included at T2, t(803) =3.14, p =.002; were more educated than Marines included at T3, χ2(1, N = 860) = 9.19, p =.002; were older, T2: t(859) = 2.02, p =.044; T3: t(859) = 3.66, p <.001; and reported more prior lifetime trauma, T2:"" ",YES
10,4,"To determine if a description of how missing data were handled is provided, we need to look for specific methods mentioned in the context. The context states that ""Data were assumed to be missing at random; consequently, using Mplus (Version 7; Muthén & Muthén, 1998–2013), full information maximum likelihood estimation was employed to address ignorable missingness."" This indicates that the method used to handle missing data was Full Information Maximum Likelihood (FIML). Therefore, the answer to the question is YES. "," - ""Data were assumed to be missing at random; consequently, using Mplus (Version 7; Muthén & Muthén, 1998–2013), full information maximum likelihood estimation was employed to address ignorable missingness."" ",YES
10,5,"To determine if information about the distribution of the observed variables is included, we need to look for mentions of tests for normality or multivariate normality within the context. The context provides details about model selection criteria, class sizes, and statistical tests related to model fit and class solutions. However, there is no mention of tests for the normal distribution of observed variables or multivariate normality within the classes. The focus is on fit statistics, class selection, and handling missing data, not on the distribution of the observed variables. "," - ""BIC = Bayesian information criterion; CAIC = consistent Akaike’s information criteria; BLRT = bootstrapped likelihood ratio test; LLP = lowest posterior"" - ""Model estimation was iterative—modifications were made to account for estimation difficulties; where necessary, negative variances that were not significantly different from 0 were constrained to 0 (see Table 1)."" - ""Our models were selected in accordance with findings from a Monte Carlo study by Nylund, Asparouhov, and Muth´en (2007), which demonstrated that for samples of approximately 200 cases, class solutions are most accurately identified by selecting the lowest consistent Akaike’s information criteria (CAIC), the lowest Bayesian information"" ",NO
10,6,"To determine if the software used for statistical analysis is mentioned, we need to look for references to specific software in the context. The context explicitly mentions ""Mplus"" as the software used for statistical analysis. It is cited in relation to full information maximum likelihood estimation and model estimation, indicating its use in the study. Therefore, the answer to the question is YES. "," - ""using Mplus (Version 7; Muth´en & M u t h´en, 1998–2013), full information maximum likelihood estimation was employed"" - ""Mplus user´s guide (7th ed.). Los Angeles, CA: Author."" - ""Mplus: Statistical analysis with latent variables: User’s guide(6th ed.). Los Angeles, CA: Author."" ",YES
10,7,"To determine if alternative specifications of within-class heterogeneity are considered and documented, we need to look for mentions of different models or approaches, such as Latent Growth Curve Analysis (LGCA) versus Latent Growth Mixture Modeling (LGMM), and any documentation of these alternatives. The context discusses the use of SOGMMs and mentions the comparison of GMM with multiple-indicator factor models, but it does not explicitly mention or document alternative specifications like LGCA versus LGMM. Therefore, there is no evidence in the context that alternative specifications of within-class heterogeneity are considered and clearly documented. "," - ""GMM with multiple-indicator factor models, and compared to GMM, holds the advantage of producing outcomes that better control for measurement error, limiting the likelihood that an incorrect class solution will be identified (Grimm & Ram, 2009)."" - No mention of LGCA or LGMM as alternative specifications. ",NO
10,8,"To determine if alternative specifications of the between-class differences in variance-covariance matrix structure are considered and clearly documented, we need to look for any mention of such specifications in the context. The context discusses the process of model estimation, including freeing means of intercept growth factors across classes and setting CAPS intercepts to 0. It also mentions iterative modifications for estimation difficulties and constraints on negative variances. However, there is no explicit mention of alternative specifications of the variance-covariance matrix structure, such as constraints across subgroups or fixed structures. The context focuses on model selection criteria and fit indices rather than detailing variance-covariance matrix specifications. "," - ""For the SOGMMs, to obtain CAPS scaling, the means of the intercept growth factors were freed across classes and the CAPS intercepts were set to 0."" - ""Model estimation was iterative—modifications were made to account for estimation difficulties; where necessary, negative variances that were not significantly different from 0 were constrained to 0."" - No mention of alternative specifications of the variance-covariance matrix structure. ",NO
10,9,"The context describes the use of quadratic trajectories to model the data, specifically mentioning terms like ""quadratic trajectory"" and ""quadratic trend."" It also discusses the selection of a 3-class solution based on criteria such as entropy, posterior probabilities, and a significant BLRT. However, there is no explicit mention of testing alternative shape or functional forms, such as non-linear forms, to determine if they would fit the data better. The context focuses on the quadratic form and the selection of the best model based on statistical criteria without indicating a comparison with other potential forms. "," - ""most participants (74.5%) followed a quadratic trajectory"" - ""most Marines in the upper tertile (73.2%) followed a quadratic trend"" - ""3-class solution was selected. All selected solutions had good entropy, high posterior probabilities, and a significant BLRT."" ",NO
10,10,"To determine if the analyses could be replicated based on the use of covariates or predictors, we need to check if the context provides details on how these covariates were handled, such as whether they were time-varying or time-invariant, and at what level they were applied. The context discusses the use of longitudinal factor models and growth mixture models (GMM) but does not specify the use of covariates or predictors in a manner that would allow for replication. There is no mention of time-varying or time-invariant covariates, nor is there any detail on how they were incorporated into the models. Therefore, the analyses cannot be replicated based on the given information. "," - ""The context discusses the use of longitudinal factor models and growth mixture models (GMM) but does not specify the use of covariates or predictors in a manner that would allow for replication."" - ""There is no mention of time-varying or time-invariant covariates, nor is there any detail on how they were incorporated into the models."" ",NO
10,11,"To determine if information about the number of random start values and final iterations is reported, we need to look for any mention of these details in the context. The context discusses model estimation, selection criteria, and fit statistics but does not mention the number of random start values or final iterations. There is no evidence provided about the convergence of the final class solution to the maximum of the ML distribution or any mention of local maxima. ", - [] ,NO
10,12,"The question asks whether the model comparison and selection tools described in the context are from a statistical perspective. The context mentions several statistical tools used for model comparison and selection, including the Bayesian information criterion (BIC), consistent Akaike’s information criteria (CAIC), and bootstrapped likelihood ratio test (BLRT). These are well-known statistical measures used to evaluate model fit and select the best model based on criteria such as parsimony and interpretability. The context also references a Monte Carlo study by Nylund, Asparouhov, and Muthén (2007) that supports the use of these criteria for model selection, further indicating their statistical nature. "," - ""BIC indicated selection of the 4-class solution"" - ""CAIC continually decreased and failed to identify a solution"" - ""the lowest consistent Akaike’s information criteria (CAIC), the lowest Bayesian information criterion (BIC), and a significant bootstrapped likelihood ratio test (BLRT)"" - ""findings from a Monte Carlo study by Nylund, Asparouhov, and Muthén (2007), which demonstrated that for samples of approximately 200 cases, class solutions are most accurately identified by selecting the lowest consistent Akaike’s information criteria (CAIC), the lowest Bayesian information criterion (BIC), and a significant bootstrapped likelihood ratio test (BLRT)."" ",YES
10,13,"To determine if the total number of fitted models reported includes a one-class solution, we need to examine the context for any mention of a one-class solution. The context provides details about class solutions ranging from 1 to 5 for different tertiles. However, there is no explicit mention of a one-class solution being considered or reported. The context discusses solutions from 1 to 5 classes, but it does not specify that a one-class solution was fitted or evaluated. "," - ""Fit Statistics for Class Solutions 1–5"" - ""In the upper tertile ( n = 234) 1 SLP Significant negative variance"" - ""In the middle tertile ( n = 192) 1 SLP, QRD 7,028.1 7,040.1"" - ""In the lower tertile ( n = 208) 1 QRD, T3 6,350.9 6,363.9"" ",NO
10,14,"To determine if the number of cases per class is reported, we need to look for any mention of absolute sample sizes, sample sizes per class, or proportions in the context. The context provides information about the total sample sizes for each tertile (e.g., upper tertile with n = 234, middle tertile with n = 192, lower tertile with n = 208) but does not specify the number of cases per class within these tertiles. It mentions class sizes in terms of percentages (e.g., smallest class size of 0.9%) but does not provide absolute numbers or specific proportions for each class within the models. Therefore, the context does not report the number of cases per class in the required detail. "," - ""Upper tertile ( n = 234)"" - ""Middle tertile ( n = 192)"" - ""Lower tertile ( n = 208)"" - ""the smallest class size (0.9%) was below the 5% cutoff"" ",NO
10,15,"To determine if entropy is reported for the classification of cases in a trajectory, we need to look for mentions of entropy values in the context. The context provides a table with fit statistics for class solutions, including entropy values for each class solution in the upper, middle, and lower tertiles. Additionally, the text mentions that all selected solutions had good entropy. Therefore, entropy is indeed reported in the context. "," - ""Class Variances = 0 BIC CAIC BLRT Entropy LLP SCP"" - ""2 T0 8,555.6 8,575.6 0.00.95.96.12"" - ""3 SLP, QRD 8,538.4 8,558.3 0.00.85.87.09"" - ""4 QRD, T0 8,505.0 8,529.0 0.00.96.94.01"" - ""5 QRD, T0 8,523.3 8,552.3 0.33.84.83.03"" - ""2 SLP 6,976.0 6,994.0 0.00.86.91.21"" - ""3 SLP 6,917.0 6,939.0 0.00.89.89.09"" - ""4 SLP, QRD, RES 6,906.4 6,929.4 0.00.91.88.05"" - ""5 SLP, QRD, RES 6,891.5 6,918.5 0.00.91.86.05"" - ""2 QRD T0, T3 6,266.2 6,282.2 0.00.98.95.08"" - ""3 SLP, QRD, T3 6,217.6 6,236.6 0.00.88.79.06"" - ""4 INT, T0, T3 6,178.6 6,202.6 0.00.91.81.02"" - ""5 INT, T0, T3, RES 6,130.8 6,157.8 0.00.92.74.02"" - ""All selected solutions had good entropy"" ",YES
10,16,"To determine if a plot is included with the estimated mean trajectories of the final solution, we need to look for any mention of a figure or plot in the context. The context references ""see Table 1 and Figure 1"" in relation to the SOGMM revealing distinct trajectories. This suggests that a figure, likely a plot, is included with the estimated mean trajectories of the final solution. "," - ""The SOGMM revealed that three distinct trajectories best explained the data in all tertiles of combat exposure (see Table 1 and Figure 1)."" ",YES
10,17,"To determine if plots are included with the estimated mean trajectories for each model, we need to look for any mention of figures or visual representations in the context. The context references ""see Table 1 and Figure 1"" in relation to the SOGMM revealing distinct trajectories. This indicates that there is at least one figure included in the document. Therefore, the answer to whether plots are included is YES. "," - ""see Table 1 and Figure 1"" ",YES
10,18,"To determine if a plot is included of the combination of estimated means of the final model and the observed individual trajectories split out for each latent class, we need to look for any mention of such a plot in the context. The context discusses various statistical analyses, model fit statistics, and results, but does not mention any specific figures or plots that show the combination of estimated means and observed individual trajectories for each latent class. There is a reference to ""see Table 1 and Figure 1,"" but there is no description of what Figure 1 contains, nor is there any explicit mention of a plot showing the combination of estimated means and observed individual trajectories. "," - ""see Table 1 and Figure 1"" - No description of Figure 1 or mention of a plot showing the combination of estimated means and observed individual trajectories. ",NO
10,19,"To determine if the characteristics of the final class solution are numerically described, we need to look for mentions of statistical measures such as means, standard deviations (SD), standard errors (SE), sample sizes (n), or confidence intervals (CI) in the context. The context provides details about the selection of class solutions based on fit statistics and describes the trajectories of different groups of Marines. However, it does not provide specific numerical descriptions like means, SD, SE, n, or CI for the final class solution. Instead, it focuses on the selection criteria and the qualitative description of the trajectories. "," - ""All selected solutions had good entropy, high posterior probabilities, and a significant BLRT."" - ""Most Marines in the upper tertile (73.2%) followed a quadratic trend (B =− 2.80, standard error [SE] = 0.37, p <.001); they had a clinically significant (10 or more points; Schnurr et al., 2007) increase in PTSD that abated over time, which we labeled True Resilience."" - ""Eighteen percent followed a quadratic trajectory (B =− 5.02, SE = 1.23, p <.001), such that they demonstrated a marked increase in PTSD symptoms from predeployment to postdeployment that decreased slightly towards the end of the deployment cycle, which we labeled New-Onset Symptoms."" - ""Lastly, 8.5% of Marines entered deployment with high PTSD scores that remained stable across the study period; they had a nonsignificant slope (B =− 0.04, SE = 1.21, p =.973). We labeled this trajectory Pre-existing Symptoms."" ",NO
10,20,"To determine if the syntax files are available, we need to look for any mention of syntax files being included in the appendix, supplementary materials, or available from the authors. The context provided does not mention syntax files in any of these locations. It lists references and fit statistics but does not indicate the availability of syntax files. Therefore, based on the given context, there is no evidence to suggest that syntax files are available. ", - [] ,NO
11,0,"To determine if the metric or unit of time used in the statistical model is reported, we need to look for any mention of time intervals or units in the context. The context discusses the analysis of PCL scores over a study period and mentions ""three waves"" of data collection. However, it does not specify the exact time intervals between these waves, such as whether they are in months, years, or any other unit of time. Therefore, the metric or unit of time used in the statistical model is not reported in the context. "," - ""Most (92%) subjects had PCL scores at all three waves; subjects missing a single score were included in analyses."" - ""The final trajectory pattern was tested on each of the eight occupational subsamples."" ",NO
11,1,"To determine if information about the mean and variance of time within a wave is presented, we need to look for any mention of statistical measures related to time within the context. The context provides detailed information about the mean PCL scores at different waves and the parameters of the trajectories, but it does not mention any specific statistical measures such as variance of time within a wave or within a measurement occasion. The focus is on the mean PCL scores and the trajectory patterns, not on the variance of time. "," - ""Table 2 describes the ﬁve trajectories by mean PCL values at Waves 1, 2, and 3, and linear and quadratic parameters."" - ""The context does not mention any specific statistical measures such as variance of time within a wave or within a measurement occasion."" ",NO
11,2,"To determine if the missing data mechanism is reported, we need to identify any mention of how missing data is treated or classified in the context. The context states that ""PROC TRAJ assumes values of the dependent variable are missing at random, and uses all available values for each subject."" This indicates that the missing data mechanism is assumed to be missing at random (MAR). Therefore, the missing data mechanism is indeed reported. "," - ""PROC TRAJ assumes values of the dependent variable are missing at random, and uses all available values for each subject."" ",YES
11,3,"To determine if a description is provided of what variables are related to attrition/missing data, we need to look for any mention of variables or factors associated with missing data or dropout effects. The context mentions missing data and loss to follow-up, but it does not specify any particular variables related to these issues. It states that additional analyses revealed no substantial impact of potentially nonrandom patterns of missing data, but it does not detail what variables were considered or analyzed in relation to attrition or missing data. Therefore, there is no description of variables related to attrition/missing data provided in the context. "," - ""Additional analyses revealed no substantial impact of potentially nonrandom patterns of missing data occurring for either reason."" - ""Self-report of exposures, mental health diagnosis, and other covariates may have been subject to recall and other response biases."" ",NO
11,4,"To determine if a description is provided of how missing data were dealt with, we need to look for specific methods mentioned in the context, such as listwise deletion, multiple imputation, or full information maximum likelihood (FIML). The context mentions that subjects missing a single score were included in analyses because PROC TRAJ assumes values of the dependent variable are missing at random and uses all available values for each subject. This suggests the use of a method that handles missing data by utilizing available data points, which aligns with the full information maximum likelihood (FIML) approach. Additionally, it is stated that additional analyses revealed no substantial impact of potentially nonrandom patterns of missing data, indicating that the method used was robust to such patterns. Therefore, the context does provide a description of how missing data were handled, specifically through the use of PROC TRAJ, which implies the use of FIML. "," - ""subjects missing a single score were included in analyses, as PROC TRAJ assumes values of the dependent variable are missing at random, and uses all available values for each subject."" - ""Additional analyses revealed no substantial impact of potentially nonrandom patterns of missing data occurring for either reason."" ",YES
11,5,"To determine if information about the distribution of the observed variables is included, we need to look for mentions of tests for normality or distribution assessments within the context. The context discusses the use of Bayesian information criterion (BIC) for model selection, the inclusion of covariates in models, and the use of PROC TRAJ assuming values are missing at random. However, there is no mention of tests for normality or distribution assessments of the observed variables within classes or multivariate normality. The context focuses on model selection, trajectory analysis, and covariate effects rather than distribution tests. "," - ""Bayesian information criterion (BIC) values were compared between each model and the one preceding it; the relative value of including additional groups was assessed on the basis of"" - ""PROC TRAJ assumes values of the dependent variable are missing at random, and uses all available values for each subject."" - No mention of tests for normality or distribution assessments. ",NO
11,6,"To determine if the software used for statistical analysis is mentioned, we need to identify any references to specific software in the context. The context explicitly states that the PROC TRAJ macro for SAS software (version 9.2) was used for the analysis. This indicates that SAS software was indeed used for the statistical analysis. "," - ""using the PROC TRAJ macro (Jones, Nagin, & Roeder, 2001) for SAS software (version 9.2)"" - ""specifying a censored normal distribution, an initial model was run with a single trajectory group, after which successive models included one additional group at a time."" ",YES
11,7,"To determine if alternative specifications of within-class heterogeneity were considered and documented, we need to look for mentions of different modeling approaches such as Latent Growth Curve Analysis (LGCA) or Latent Growth Mixture Modeling (LGMM) in the context. The context discusses the use of PROC TRAJ for trajectory analysis and mentions Bayesian information criterion (BIC) for model comparison, but it does not reference alternative models like LGCA or LGMM. There is no evidence in the context that alternative specifications were considered or documented. "," - ""An initial model was run with a single trajectory group, after which successive models included one additional group at a time."" - ""Bayesian information criterion (BIC) values were compared between each model and the one preceding it."" - No mention of LGCA or LGMM. ",NO
