paper_id,question_id,reasoning,evidence,answer
28,6,"To determine if the software used for statistical analysis is mentioned, we need to look for any references to specific software in the context. The context explicitly states that ""We utilized Mplus 6.0 [38], employing robust full information maximum-likelihood (FIML) procedures."" This clearly indicates that Mplus was the software used for the statistical analysis. "," - ""We utilized Mplus 6.0 [38], employing robust full information maximum-likelihood (FIML) procedures to identify heterogeneous latent classes of PTSD symptom severity over time using LGMM."" ",YES
28,7,"To determine if alternative specifications of within-class heterogeneity, such as Latent Class Analysis (LCA) versus Latent Growth Mixture Modeling (LGMM), are considered and documented, we need to look for any mention of LCA or other methods in the context. The context primarily discusses the use of LGMM for identifying latent subpopulations and modeling symptom progression. There is no mention of LCA or any other alternative methods being considered or compared to LGMM. Therefore, the answer is NO. "," - ""Latent Growth Mixture Modeling (LGMM) uses maximum-likelihood estimation to uncover discrete longitudinal mixture distributions and identify latent subpopulations, or classes."" - ""We utilized Mplus 6.0 [38], employing robust full information maximum-likelihood (FIML) procedures to identify heterogeneous latent classes of PTSD symptom severity over time using LGMM."" - No mention of LCA or alternative methods. ",NO
28,8,"To determine if alternative specifications of the between-class differences in variance-covariance matrix structure are considered and clearly documented, we need to look for any mention of different specifications such as constrained or fixed across subgroups in the context. The context discusses the use of latent growth mixture modeling (LGMM) and the comparison of models using various criteria, but it does not mention any specific alternative specifications of the variance-covariance matrix structure. There is no evidence of documentation regarding constrained or fixed structures across subgroups. ", - [] ,NO
28,9,"To determine if alternative shape/functional forms of the trajectories were described, we need to identify any mention of testing different trajectory forms, such as quadratic or non-linear trends. The context explicitly states that models were compared using both linear only and linear+quadratic parameters. The text mentions that the linear+quadratic parameters consistently out-performed the linear alone, indicating that a quadratic trend was indeed tested. Therefore, alternative shape/functional forms of the trajectories were described. "," - ""successive models continued to demonstrate improved fit through four classes, both with linear only, and linear+quadratic parameters"" - ""linear +quadratic parameters consistently out-performing linear alone"" ",YES
28,10,"To determine if the analyses could be replicated, we need to check if the study clearly reports the use of covariates or predictors, including whether they are time-varying or time-invariant, and at what level they are applied. The context mentions the use of a ""dummy-coded trauma-re-exposure variable as a time variant covariate"" and the regression of PTSD symptom scores on this variable. It also discusses the use of covariates in the Conditional Model to predict class membership and slope parameters. The context provides specific details about the modeling techniques and the variables used, which are essential for replication. Therefore, the analyses appear to be reported in a manner that would allow for replication. "," - ""We accounted for the effect of eventual trauma exposure during the study by regressing PTSD symptom scores at 7 and 15 months on our dummy-coded trauma-re-exposure variable as a time variant covariate."" - ""These modeling techniques allowed us to test whether the population under study is composed of a mixture of discrete distributions characterized as classes of individuals with differing profiles of growth, while also allowing for the modeling of covariates as predictors of class membership and slope parameters."" - ""To examine the effect of treatment on the LGMM parameters we first we regressed class membership on our dummy-coded yes/no treatment variable, conducted in the MPlus environment using a multino-mial logistic regression."" ",YES
28,11,"To determine if information about the number of random start values and final iterations is reported, we need to look for any mention of these specific details in the context. The context discusses the use of Mplus 6.0 and robust full information maximum-likelihood (FIML) procedures, as well as the modeling techniques and criteria used for model fit. However, there is no mention of the number of random start values or final iterations, which are typically reported to ensure convergence in maximum likelihood estimation. Therefore, the answer is NO. ", - [] ,NO
28,12,"The question asks whether the model comparison and selection tools described are from a statistical perspective. The context mentions several criteria used for model comparison: Akaike Information Criterion (AIC), Bayesian Information Criterion (BIC), sample-size adjusted Bayesian Information Criterion (SSBIC), and Bootstrap Likelihood Ratio Test (BLRT). These are all well-known statistical tools used for model selection and comparison. The context also references entropy, which is a measure used in statistical modeling to assess the clarity of classification. The use of these criteria and measures indicates a statistical approach to model comparison and selection. "," - ""We compared progressive nested trajectory models by assessing relative fit based on reductions in the Bayesian Information Criterion (BIC), sample-size adjusted Bayesian Information Criterion (SSBIC), Aikaike Information Criterion (AIC), and significance indicated by the Bootstrap Likelihood Ratio Test (BLRT), along with parsimony and interpretability equally weighed."" - ""Entropy was also examined but not utilized to determine the number of classes; all criteria were consistent with recommendations from the literature [41]."" ",YES
28,13,"To determine if the total number of fitted models reported includes a one-class solution, we need to examine the context for mentions of the number of classes in the models. The context provides a table labeled ""Fit Indices for One- to Four-Class Growth Mixture Models of PTSD Symptom Severity"" and lists fit indices for models ranging from one to four classes. This indicates that models with one, two, three, and four classes were indeed fitted and reported. "," - ""Fit Indices for One- to Four-Class Growth Mixture Models of PTSD Symptom Severity (n = 957)."" - ""Linear Weights Only Linear +Quadratic Weights Fit Indices 1 Class 2 Classes 3 Classes 4 Classes"" ",YES
28,14,"To determine if the number of cases per class is reported, we need to look for any mention of absolute sample size, sample size per class, or proportion of cases in each class within the context. The context discusses the selection of a three-class model and mentions the proportion of the sample in the largest class (Rapid Remitting; 56% of the sample). However, it does not provide specific numbers for the other classes or the absolute sample size per class. The context also includes fit indices for different models but does not report the number of cases per class. Therefore, the number of cases per class is not fully reported. "," - ""The largest class (Rapid Remitting; 56% of the sample) displayed a precipitous drop in symptoms..."" - ""Fit Indices for One- to Four-Class Growth Mixture Models of PTSD Symptom Severity (n = 957)."" ",NO
28,15,"To determine if entropy is reported in the context of classifying cases in a trajectory, we need to look for mentions of entropy values or related metrics. The context does mention entropy in relation to model fit and class identification. Specifically, it states that ""Entropy was also examined but not utilized to determine the number of classes; all criteria were consistent with recommendations from the literature."" Additionally, entropy values are listed in a table format, indicating that entropy was indeed reported as part of the analysis. Therefore, the answer to whether entropy is reported is YES. "," - ""Entropy was also examined but not utilized to determine the number of classes; all criteria were consistent with recommendations from the literature."" - ""Entropy —.84.82.82 —.84.78.79"" ",YES
28,16,"To determine if a plot is included with the estimated mean trajectories of the final solution, we need to look for any mention of figures or diagrams that represent these trajectories. The context mentions ""Figure 1. Three Trajectory Model of PTSD Symptom Severity Recovery Trajectories (n = 957)."" This indicates that there is indeed a figure included that represents the estimated mean trajectories of the final solution. "," - ""Figure 1. Three Trajectory Model of PTSD Symptom Severity Recovery Trajectories (n = 957)."" ",YES
28,17,"To determine if plots are included with the estimated mean trajectories for each model, we need to look for any mention of figures or visual representations of the trajectories in the context. The context mentions ""Figure 1. Three Trajectory Model of PTSD Symptom Severity Recovery Trajectories (n = 957)."" This indicates that there is a figure included that represents the trajectory model. Therefore, the answer is YES. "," - ""Figure 1. Three Trajectory Model of PTSD Symptom Severity Recovery Trajectories (n = 957)."" ",YES
28,18,"To determine if a plot is included of the combination of estimated means of the final model and the observed individual trajectories split out for each latent class, we need to look for any mention of such a plot in the context. The context discusses the analysis and results of the study, including the identification of latent classes and the use of various statistical criteria and models. However, there is no mention of a plot or visual representation of the estimated means and observed individual trajectories for each latent class. The context focuses on the statistical analysis and results rather than visualizations. ", - The context does not mention any plot or visual representation of the estimated means and observed individual trajectories for each latent class. ,NO
28,19,"To determine if the characteristics of the final class solution are numerically described, we need to look for mentions of means, standard deviations (SD), standard errors (SE), sample sizes (n), or confidence intervals (CI) related to the three-class model with linear+quadratic parameters. The context provides specific numerical details for the ""Rapid Remitting"" class, such as a significant negative slope (Est = 226.72, SE = 2.28, p <.001), and mentions of age differences and symptom severity levels. These details indicate that numerical characteristics are indeed described for the final class solution. "," - ""The largest class (Rapid Remitting; 56% of the sample) displayed a precipitous drop in symptoms from 1 to 5 months as captured by a significant negative slope (Est = 226.72, SE = 2.28, p,.001)"" - ""Participants who received treatment had higher PTSD symptom severity at 10 days (i.e., prior to treatment initiation) (PSS-I total score = 11.63, SD = 2.85 vs. 10.11, SD = 3.25)"" - ""This class was also significantly more likely to be older then the Slow Remitting class (Est = 0.02, SE = 0.01, p,.05) and more likely to have significantly higher levels of both avoidance (Est = 0.19, SE = 0.08, p,.05) and arousal symptom severity (Est = 0.22, SE = 0.10, p,.05)"" ",YES
28,20,"To determine if the syntax files are available, we need to look for any mention of syntax files being included in the appendix, supplementary materials, or available from the authors. The context provided does not mention syntax files in any of these locations or indicate that they are available from the authors. Therefore, there is no evidence to suggest that the syntax files are available. ", - [] ,NO
29,0,"To determine if the metric or unit of time used in the statistical model is reported, we need to look for any mention of time units in the context. The context mentions ""12 months"" and ""24 months"" in relation to the period over which stress scores were analyzed. This indicates that the unit of time used in the statistical model is months. "," - ""12 months, indicated by the quadratic slope term."" - ""The quadratic term in the 12-month period was not significant nor did it fit the data, which demonstrates that a small increase in stress scores occurred between 12 and 24 months after the event."" - ""Table 2 shows that, in line with their 24-month outcomes, the stress scores of all participants except those in the industrial fire decreased."" ",YES
29,1,"To determine if information about the mean and variance of time within a wave is presented, we need to look for any mention of these specific statistical measures in the context. The context discusses various statistical methods and results, such as the R-squared statistic, latent growth modeling, and the use of Mplus for analysis. However, there is no mention of the mean and variance of time within a wave, within a measurement occasion, or within a period of time. The context focuses on the analysis of posttraumatic stress symptoms, the use of latent growth factors, and the identification of response classes, but does not provide details on the mean and variance of time within a wave. "," - ""The R-squared statistic provides the proportion of variance in posttraumatic stress symptoms that is explained by the latent growth factors."" - ""We used Mplus 6.11 [27], a statistical program for the analyses of latent variable models of which LGM is one of the model features."" - ""In this approach LGM enabled us to examine individual growth trajectories for each of the four study groups."" ",NO
29,2,"To determine if the missing data mechanism is reported, we need to look for any mention of how missing data were handled or characterized in the context. The context states that ""Missing data were estimated using the full information maximum likelihood method."" This method is often used when data are assumed to be missing at random (MAR), but the context does not explicitly state the missing data mechanism. There is no direct mention of MAR, MNAR, or MCAR in the provided text. "," - ""Missing data were estimated using the full information maximum likelihood method."" ",NO
29,3,"To determine if a description is provided of what variables are related to attrition or missing data, we need to look for any mention of dropout effects, auxiliary variables, or skip patterns in the context. The context discusses the estimation of missing data using the full information maximum likelihood method and the application of a robust maximum likelihood estimator due to non-normal distribution of some variables. However, there is no mention of specific variables related to attrition or missing data, such as dropout effects, auxiliary variables, or skip patterns. "," - ""Missing data were estimated using the full information maximum likelihood method."" - ""We applied a robust maximum likelihood estimator because some of the variables were not normally distributed (e.g., IES, anxiety and dissociation)."" ",NO
29,4,"To determine if a description is provided of how missing data in the analyses were dealt with, we need to look for specific methods mentioned in the context. The context states, ""Missing data were estimated using the full information maximum likelihood method."" This clearly describes the method used to handle missing data. "," - ""Missing data were estimated using the full information maximum likelihood method."" ",YES
29,5,"To determine if information about the distribution of the observed variables is included, we need to look for mentions of tests for normality or distribution of variables. The context mentions that a robust maximum likelihood estimator was applied because some variables were not normally distributed, indicating that there was an assessment of the distribution of variables. However, there is no specific mention of tests for multivariate normality or distribution within classes. Therefore, while there is some information about the distribution of variables, it is not comprehensive in terms of tests for multivariate normality or within-class distribution. "," - ""Furthermore, we applied a robust maximum likelihood estimator because some of the variables were not normally distributed (e.g., IES, anxiety and dissociation)."" ",NO
29,6,"To determine if the software used for statistical analysis is mentioned, we need to look for any references to statistical software in the context. The context explicitly states, ""We used Mplus 6.11 [27], a statistical program for the analyses of latent variable models of which LGM is one of the model features."" This clearly indicates that Mplus was the software used for the statistical analysis. "," - ""We used Mplus 6.11 [27], a statistical program for the analyses of latent variable models of which LGM is one of the model features."" ",YES
29,7,"To determine if alternative specifications of within-class heterogeneity are considered and documented, we need to look for mentions of different modeling approaches such as Latent Growth Curve Analysis (LGCA) versus Latent Growth Mixture Modeling (LGMM). The context discusses the use of latent growth modeling (LGM) and mentions specific statistical methods and software (e.g., Mplus 6.11) but does not reference alternative models like LGCA or LGMM. There is no evidence in the context that alternative specifications are considered or documented."," - ""we conducted a four-group latent growth modeling (LGM) [26] to analyze the changes in posttraumatic stress scores over time"" - ""We used Mplus 6.11 [27], a statistical program for the analyses of latent variable models of which LGM is one of the model features."" - No mention of LGCA or LGMM or any alternative specifications.",NO
29,8,"To determine if alternative specifications of the between-class differences in variance-covariance matrix structure are considered and documented, we need to look for any mention of different matrix structures or constraints applied across subgroups in the context. The context discusses the use of latent growth modeling (LGM) and mentions the use of predictors and model fit statistics, but it does not specify any alternative specifications or constraints applied to the variance-covariance matrix structure across subgroups. There is no mention of constrained or fixed structures across subgroups in the provided text. "," - ""The R-squared statistic provides the proportion of variance in posttraumatic stress symptoms that is explained by the latent growth factors."" - ""We added gender, age, TBSA, peritraumatic anxiety, and dissociation as predictors in the LGM model to explain the individual differences in initial mean and change over time."" - ""We analyzed the LGM model again over a 12-month period."" - ""We added the same predictors as before to the model."" ",NO
29,9,"To determine if alternative shape/functional forms of the trajectories were described, we need to look for mentions of testing different models, such as quadratic or non-linear forms. The context states that a ""basic quadratic growth model of the traumatic stress scores produced an adequate fit"" and mentions a ""quadratic effect"" in the cafe´ fire group and its comparison group. This indicates that a quadratic trend was indeed tested and found to fit the data adequately. Therefore, the answer is YES. "," - ""A basic quadratic growth model of the traumatic stress scores produced an adequate fit (CFI = 0.96, TLI = 0.96, RMSEA = 0.09)."" - ""Additionally, the cafe´ fire group and its comparison group showed a small but significant quadratic effect, which indicates that stress scores increased again over time but at a much smaller rate compared to the initial decrease."" ",YES
29,10,"To determine if the analyses could be replicated, we need to check if the study provides sufficient details about the covariates or predictors used, including whether they are time-varying or time-invariant, and how they relate to the dependent or independent variables. The context mentions the use of predictors such as peritraumatic anxiety, dissociation, and burn severity, and specifies that these were used to explain variance in initial stress scores and changes over time. It also notes the use of latent growth modeling (LGM) to analyze changes in posttraumatic stress scores over time, with individual growth trajectories examined for each group. The context provides details on the statistical methods and software used (Mplus 6.11) and mentions the use of a robust maximum likelihood estimator due to non-normal distribution of some variables. However, it does not explicitly state whether the covariates are time-varying or time-invariant, nor does it provide detailed information on how these covariates are applied at the level of dependent or independent variables. Therefore, while some information is provided, it may not be sufficient for complete replication without additional details. "," - ""We used Mplus 6.11 [27], a statistical program for the analyses of latent variable models of which LGM is one of the model features."" - ""The four predictors explained a relatively large proportion of the variance in the initial stress scores measured 2 weeks post-burn for all the groups."" - ""Furthermore, these independent variables were able to predict a significant proportion of the variance in change over time (i.e., slope) for the industrial fire cohort and the comparison groups, but not for the cafe´ fire group."" - ""We added the same predictors as before to the model."" ",NO
29,11,"To determine if information about the number of random start values and final iterations is reported, we need to look for any mention of these details in the context. The context discusses the use of latent growth modeling (LGM) and mentions the use of Mplus 6.11 for the analyses, but it does not provide specific details about the number of random start values or final iterations. There is no mention of convergence criteria or the number of iterations used in the estimation process. Therefore, the answer is NO. "," - ""We used Mplus 6.11 [27], a statistical program for the analyses of latent variable models of which LGM is one of the model features."" - No mention of random start values or final iterations. ",NO
29,12,"To determine if the model comparison and selection tools are described from a statistical perspective, we need to identify any mention of statistical criteria or methods used for model comparison. The context mentions the Bayesian information criterion (BIC) as a tool used to measure the trade-off between model fit and model complexity, which is a statistical method for model comparison. Additionally, the context refers to other fit indices such as CFI, TLI, and RMSEA, which are also statistical measures used to evaluate model fit. Therefore, the context does describe model comparison tools from a statistical perspective."," - ""Moreover, the model improved according to the trade-off between model fit and model complexity as measured by the Bayesian information criterion [28] (BIC change = 106.769)."" - ""The four predictors explained a relatively"" - ""A basic quadratic growth model of the traumatic stress scores produced an adequate fit (CFI = 0.96, TLI = 0.96, RMSEA = 0.09)."" - ""Next, we added gender, age, TBSA, peritraumatic anxiety, and dissociation as predictors in the LGM model to explain the individual differences in initial mean and change over time. However, this model failed to produce a sufficient fit."" - ""We began with the basic model showing that a linear growth model of stress scores produced an adequate fit (CFI = 0.98, TLI = 0.98, RMSEA = 0.10).""",YES
29,13,"To determine if the total number of fitted models, including a one-class solution, is reported, we need to identify any mention of the number of models fitted in the context. The context discusses the identification of four latent classes and the use of latent growth modeling (LGM) to analyze changes in posttraumatic stress scores over time. However, there is no explicit mention of a one-class solution or the total number of models fitted. The context focuses on the four latent classes and the application of LGM without specifying the number of models, including any one-class solution. "," - ""In Figure 2 we present the four latent classes that could be identified in this data set (n = 207) showing the response patterns present in the total sample."" - ""We used Mplus 6.11 [27], a statistical program for the analyses of latent variable models of which LGM is one of the model features."" - ""Last, we conducted a four-group latent growth modeling (LGM) [26] to analyze the changes in posttraumatic stress scores over time, and to identify predictors in the separate groups."" ",NO
