paper_id,question_id,reasoning,evidence,answer
0,0,"To determine if the metric or unit of time used in the statistical model is reported, we need to look for any mention of time intervals in the context. The context mentions ""3 months, 12 months, and 24 months following trauma exposure"" and ""trajectories identified in the five-class solution"" over a period of ""24 months"" and ""6 years."" These references indicate that the time units used in the model are months and years. "," - ""Significant covariates included gender, mTBI and life events at 3 months, 12 months and 24 months following trauma exposure."" - ""Individuals in the chronic class (4%) displayed a pattern of initially high levels of PTSD symptoms that increase over the subsequent 24 months, and remain elevated by the 6 year"" ",YES
0,1,"To determine if information about the mean and variance of time within a wave is presented, we need to look for any mention of statistical measures related to time, such as mean and variance, within the context. The context discusses model fit, covariates, class membership, and quality of life measures, but does not mention any statistical analysis specifically related to the mean and variance of time within a wave or measurement occasion. There is no evidence in the provided text that addresses the mean and variance of time within a wave. ", - [] ,NO
0,2,"To determine if the missing data mechanism is reported, we need to look for any mention of how missing data was handled or characterized in the context. The context mentions that Mplus employs a ""robust full information maximum likelihood estimation procedure to account for missing data."" This suggests that the analysis assumes a certain mechanism for the missing data, but it does not explicitly state whether the data is missing completely at random (MCAR), missing at random (MAR), or missing not at random (MNAR). Therefore, the specific missing data mechanism is not reported in the context. "," - ""Mplus employs a robust full information maximum likelihood estimation procedure to account for missing data."" ",NO
0,3,"To determine if a description of variables related to attrition or missing data is provided, we need to look for any mention of factors influencing dropout or missing data in the context. The context mentions that individuals who did not complete the 72-month assessment differed from those who did in terms of age and baseline CAPS scores. This indicates that age and baseline CAPS scores are related to attrition. There is no mention of other variables such as dropout effects, auxiliary variables, or skip patterns."," - ""Those who did not complete the 6-year assessment differed from completers in that they were more likely to be younger (mean 36.33 (s.d. = 13.56) v. 39.53 (s.d. = 13.48), (t(1126) = 3.97,P<0.001) and have higher baseline Clinician-Administered PTSD Scale for DSM-IV (CAPS)13 scores (mean 20.21 (s.d. = 17.89) v. 16.13, (s.d. = 15.06), (t(1113.9) = 4.17, P50.001).""",YES
0,4,"To determine if a description is provided of how missing data in the analyses were dealt with, we need to look for specific methods mentioned in the context. The context mentions that ""Mplus employs a robust full information maximum likelihood estimation procedure to account for missing data."" Additionally, it states, ""We used multiple imputation in MPlus to impute missing values of covariates."" These statements indicate that both Full Information Maximum Likelihood (FIML) and multiple imputation were used to handle missing data. "," - ""Mplus employs a robust full information maximum likelihood estimation procedure to account for missing data."" - ""We used multiple imputation in MPlus to impute missing values of covariates."" ",YES
0,5,"To determine if information about the distribution of the observed variables is included, we need to look for mentions of tests for normality or distribution of variables within the context. The context discusses the use of latent class growth analysis (LCGA) and mentions the use of robust full information maximum likelihood estimation to account for missing data. However, there is no mention of tests for normality, such as tests for normally distributed variables within classes or multivariate normality. The focus is on model fit, covariates, and class membership rather than the distribution of observed variables. "," - ""We employed latent class growth analysis (LCGA) to examine PTSD trajectories, using Mplus version 6.2 for Windows."" - ""Mplus employs a robust full information maximum likelihood estimation procedure to account for missing data."" - No mention of tests for normality or distribution of variables. ",NO
0,6,"To determine if the software used for statistical analysis is mentioned, we need to look for any references to specific software in the context. The context explicitly states that ""We employed latent class growth analysis (LCGA), using Mplus version 6.2 for Windows"" and mentions ""Mplus employs a robust full information maximum likelihood estimation procedure to account for missing data."" This clearly indicates that Mplus was the software used for the statistical analysis. "," - ""We employed latent class growth analysis (LCGA), using Mplus version 6.2 for Windows."" - ""Mplus employs a robust full information maximum likelihood estimation procedure to account for missing data."" ",YES
0,7,"To determine if alternative specifications of within-class heterogeneity are considered and documented, we need to identify any mention of different models or approaches used in the study. The context mentions the use of latent class growth analysis (LCGA) and latent growth mixture modeling (LGMM) in the study of PTSD trajectories. It specifies that LCGA was employed to examine PTSD trajectories and that LGMM was applied to studying PTSD responses. However, there is no explicit documentation or comparison of alternative specifications of within-class heterogeneity, such as a detailed comparison between LCGA and LGMM. The context does not provide evidence of a clear documentation or consideration of alternative specifications beyond mentioning the use of these models. "," - ""We employed latent class growth analysis (LCGA) to examine PTSD trajectories, using Mplus version 6.2 for Windows."" - ""(LGMM) has been applied to studying PTSD responses following traumatic events."" ",NO
0,8,"To determine if alternative specifications of the between-class differences in variance-covariance matrix structure are considered and documented, we need to look for any mention of different matrix structures or constraints applied across subgroups in the context. The context discusses the inclusion of covariates, model fit, and class membership but does not mention any specific alternative specifications or constraints on the variance-covariance matrix structure. There is no evidence of documentation regarding constrained or fixed structures across subgroups. ", - [] ,NO
0,9,"To determine if alternative shape/functional forms of the trajectories were described, we need to look for mentions of different models or forms being tested, such as quadratic trends or non-linear forms. The context mentions ""intercept, linear slope and quadratic slope parameters"" and notes that the ""quadratic slope component of the resilient class was statistically significant in the unconditional model, but not in the conditional model."" This indicates that quadratic trends were indeed considered and tested in the analysis. Therefore, the answer is YES. "," - ""intercept, linear slope and quadratic slope parameters remained consistent across the unconditional and conditional models"" - ""the quadratic slope component of the resilient class, which was statistically significant in the unconditional model, but not in the conditional model"" ",YES
0,10,"To determine if the analyses could be replicated, we need to check if the paper provides sufficient details about the covariates or predictors used, including whether they are time-varying or time-invariant, and how they are incorporated into the models. The context mentions that covariates such as gender, mTBI, and life events at 3, 12, and 24 months were included and that logistic regression analyses were conducted to identify predictors of class membership. It also states that multiple imputation was used to handle missing values. However, it does not specify whether these covariates are time-varying or time-invariant, nor does it detail how they are incorporated into the models as dependent or independent variables. Without this information, replication of the analyses is not fully supported. "," - ""Significant covariates included gender, mTBI and life events at 3 months, 12 months and 24 months following trauma exposure."" - ""We tested the same covariates listed above, as well as recent stressful life events at 3 months, 12 months and 24 months."" - ""Logistic regression analyses were conducted to identify predictors of class membership for the five-class conditional model (see Table 3)."" - ""We used multiple imputation in MPlus to impute missing values of covariates."" ",NO
0,11,"To determine if information about the number of random start values and final iterations is reported, we need to look for any mention of these details in the context. The context discusses the use of latent class growth analysis (LCGA) and mentions the use of Mplus for analysis, but it does not provide specific details about the number of random start values or final iterations. There is no mention of convergence criteria or the number of iterations used in the analysis. Therefore, the answer is NO. "," - ""We employed latent class growth analysis (LCGA) to examine PTSD trajectories, using Mplus version 6.2 for Windows."" - ""Mplus employs a robust full information maximum likelihood estimation procedure to account for missing data."" - No mention of random start values or final iterations. ",NO
0,12,"To determine if the model comparison and selection tools are described from a statistical perspective, we need to look for mentions of specific statistical criteria or tools such as BIC (Bayesian Information Criterion), AIC (Akaike Information Criterion), or similar metrics. The context discusses the process of identifying the best-fitting unconditional trajectory model by comparing the model fit of progressive numbers of classes and integrating covariates into the model. However, it does not mention any specific statistical criteria or tools used for model comparison and selection. Therefore, the answer is NO. "," - ""We first identified the best-fitting unconditional trajectory model by comparing the model fit of progressive numbers of classes."" - No mention of BIC, AIC, or other statistical criteria. ",NO
0,13,"To determine if the total number of fitted models, including a one-class solution, is reported, we need to look for any mention of the specific number of classes tested in the context. The context discusses the use of nested five-class models and mentions the process of identifying the best-fitting unconditional trajectory model by comparing the model fit of progressive numbers of classes. However, it does not specify the exact number of classes tested, nor does it explicitly mention a one-class solution. Therefore, there is no evidence in the context that reports the total number of fitted models, including a one-class solution. "," - ""We first identified the best-fitting unconditional trajectory model by comparing the model fit of progressive numbers of classes."" - No specific mention of a one-class solution or the total number of classes tested. ",NO
0,14,"To determine if the number of cases per class is reported, we need to look for any mention of absolute sample sizes, sample sizes per class, or proportions of class membership. The context provides class membership proportions for both unconditional and conditional models, such as ""Chronic unconditional 5.2% v. conditional 5.2%"". However, it does not provide absolute sample sizes or sample sizes per class. Therefore, the context only reports proportions, not absolute numbers or sample sizes per class. "," - ""Class membership remained largely consistent across the unconditional and conditional models (Chronic unconditional 5.2% v. conditional 5.2%; worsening/recovery unconditional 8.1%v. conditional 8.1%, worsening unconditional 9.6% v. conditional 10.2%, recovery unconditional 5.7% v. conditional 8.2%, resilient unconditional 72.3% v. conditional 68.3%)."" ",NO
0,15,"To determine if entropy is reported, we need to look for mentions of entropy values or misclassification rates in the context. The context discusses model fit, covariates, class membership proportions, and trajectory classes, but does not mention entropy or misclassification rates. Therefore, there is no evidence in the context that entropy is reported. ", - [] ,NO
0,16,"To determine if a plot is included with the estimated mean trajectories of the final solution, we need to look for any mention of a figure or plot that displays these trajectories. The context mentions ""Figure 1 displays the trajectories identified in the five-class solution,"" which indicates that a plot is indeed included. This figure shows the trajectories of PTSD response after traumatic injury, confirming the presence of a plot with the estimated mean trajectories. "," - ""Figure 1 displays the trajectories identified in the five-class solution."" - ""Patients followed five distinct trajectories: a chronic class (4%), a recovery class (6%), a worsening/recovery class (8%), a worsening class (10%) and a resilient class (73%)."" ",YES
0,17,"To determine if plots are included with the estimated mean trajectories for each model, we need to look for any mention of figures or visual representations of the trajectories in the context. The context mentions ""Figure 1 displays the trajectories identified in the five-class solution,"" which indicates that there is a plot included with the estimated mean trajectories for the models discussed. "," - ""Figure 1 displays the trajectories identified in the five-class solution."" ",YES
0,18,"To determine if a plot is included of the combination of estimated means of the final model and the observed individual trajectories split out for each latent class, we need to look for any mention of such a plot in the context. The context discusses the results of the models, class membership, and the impact of covariates on model fit. However, there is no mention of a plot that combines estimated means of the final model with observed individual trajectories split out for each latent class. The context does mention ""Figure 1 displays the trajectories identified in the five-class solution,"" but it does not specify that this figure includes both estimated means and observed individual trajectories split out for each class. "," - ""Figure 1 displays the trajectories identified in the five-class solution."" - No mention of a plot combining estimated means and observed individual trajectories split out for each latent class. ",NO
0,19,"To determine if the characteristics of the final class solution are numerically described, we need to look for mentions of numerical descriptors such as means, standard deviations (SD), standard errors (SE), sample sizes (n), or confidence intervals (CI) in the context. The context provides information about class membership proportions, intercepts, linear slopes, and quadratic slopes, but it does not mention specific numerical descriptors like means, SD, SE, n, or CI for these parameters. Therefore, the answer is NO. "," - ""Class membership proportions, and intercept, linear slope and quadratic slope parameters for each class are presented in online Table DS2 for the unconditional and conditional models."" - ""Similarly, the magnitude and significance of intercept, linear slope and quadratic slope parameters remained consistent across the unconditional and conditional models, with the exception of the quadratic slope component of the resilient class, which was statistically significant in the unconditional model, but not in the conditional model."" ",NO
0,20,"To determine if the syntax files are available, we need to look for any mention of syntax files being provided in the appendix, supplementary materials, or from the authors. The context provided does not mention syntax files in any of these locations. It discusses model fit, covariates, class membership, and logistic regression analyses, but there is no reference to syntax files being available. ", - [] ,NO
1,0,"To determine if the metric or unit of time used in the statistical model is reported, we need to look for any mention of time intervals or units in the context. The context specifies that the intervals between follow-up time points were set to 0, 1, and 5, which suggests a scaling of time points. Additionally, it mentions that the time points are at 3 months, 1 year, and 5 years after the injury. This indicates that the units of time used in the statistical model are months and years. "," - ""In the current study, the intervals between the follow-up time points were unequal, so the first time point was set to 0, the second to 1 and the third to 5."" - ""The IES-R data were available for 114 out of the 118 patients at 3 months, 107 patients at 1 year and 89 patients at 5 years after the injury."" ",YES
1,1,"To determine if information about the mean and variance of time within a wave is presented, we need to look for any mention of statistical measures related to time intervals or periods within the context. The context discusses statistical analyses, including ANOVA and GMM, and mentions time points (3 months, 1 year, 5 years) but does not provide specific details about the mean and variance of time within these periods or measurement occasions. The context focuses on the analysis of questionnaire scores and emotional distress trajectories over time, but it does not explicitly mention the mean and variance of time within a wave. "," - ""The intervals between the follow-up time points were unequal, so the first time point was set to 0, the second to 1 and the third to 5."" - No mention of mean and variance of time within a wave. ",NO
1,2,"To determine if the missing data mechanism is reported, we need to look for any mention of how the missing data was handled or characterized in the context. The context mentions that ""Mplus 7 estimates missing data using maximum-likelihood procedures,"" but it does not specify the missing data mechanism such as MAR, MNAR, or MCAR. Therefore, there is no evidence in the context that explicitly states the missing data mechanism. "," - ""Mplus 7 estimates missing data using maximum-likelihood procedures."" ",NO
1,3,"To determine if a description is provided of what variables are related to attrition/missing data, we need to look for any mention of factors influencing dropout rates or missing data in the context. The context discusses the number of participants at different time points and mentions one case with missing data for all time points, but it does not provide specific variables related to attrition or missing data such as dropout effects, auxiliary variables, or skip patterns. Therefore, the answer is NO. "," - ""One case had missing data for the IES-R at all of the time points; thus, the data were estimated from 117 individuals."" - ""GCS 3–12 (n = 27) Deceased (n = 24) Vegetative state (n = 2) Drop-outs (n = 7) Deceased (n = 2) 5 years follow-up GCS 13–15 (n = 23) GCS 3–12 (n =66) Ongoing PTA (n = 11) Phone interview (n = 8) Drop-outs (n = 16) Not located (n = 4) 3 months follow-up GCS 13–15 (n = 40) GCS 3–12 (n =78) 1 year follow-up GCS 13–15 (n = 33) GCS 3–12 (n =76)"" ",NO
1,4,"To determine if a description is provided for how missing data were handled, we need to look for specific methods mentioned in the context. The context states, ""Mplus 7 estimates missing data using maximum-likelihood procedures."" This indicates that the method used for handling missing data is the Full Information Maximum Likelihood (FIML) approach, which is a type of maximum-likelihood estimation. Therefore, a description of how missing data were dealt with is indeed provided. "," - ""Mplus 7 estimates missing data using maximum-likelihood procedures."" ",YES
1,5,"To determine if information about the distribution of the observed variables is included, we need to look for mentions of tests for normality or multivariate normality within the context. The context discusses the use of GMM, model fit statistics, and various statistical tests (e.g., chi-square, ANOVA, Hochberg’s GT2 post-hoc testing) but does not mention any specific tests for the normality of observed variables or multivariate normality. Therefore, there is no evidence in the context that such information is included. ", - [] ,NO
1,6,"To determine if the software used for statistical analysis is mentioned, we need to identify any references to specific software tools in the context. The context explicitly mentions ""PAWS Statistics 18.0 (formerly SPSS)"" and ""Mplus version 7"" as the software used for data analyses and growth mixture modelling (GMM), respectively. Therefore, the answer to the question is YES. "," - ""Data analyses were performed using PAWS Statistics 18.0 (formerly SPSS)."" - ""we applied growth mixture modelling (GMM) using Mplus version 7 [47]."" ",YES
1,7,"To determine if alternative specifications of within-class heterogeneity are considered and documented, we need to look for mentions of different models or methods such as Latent Growth Curve Analysis (LGCA) or Latent Growth Mixture Modeling (LGMM) in the context. The context discusses the use of Growth Mixture Modeling (GMM) and mentions the use of Mplus for estimating the number of latent classes. However, there is no mention of alternative models like LGCA or LGMM being considered or compared. The context focuses on the evaluation of model fit using BIC, BLRT, and LMR for GMM without reference to other models. "," - ""The number of latent unobserved classes is inferred from the observed data (i.e. the IES-R total scores) and the GMM generates goodness-of-fit statistics."" - ""In the current study, the Bayesian Information Criterion (BIC), Bootstrap likelihood ratio test (BLRT) and Lo-Mendell-Rubin adjusted likelihood ratio test (LMR) were evaluated to compare the fit of alternative models (i.e. 1- to 6-class solutions)."" - ""The GMM is a longitudinal analysis that explores within and between individual differences in change and individual membership within growth trajectories (classes)."" ",NO
1,8,"To determine if alternative specifications of the between-class differences in variance-covariance matrix structure are considered and clearly documented, we need to look for any mention of such specifications in the context. The context discusses the use of GMM and various statistical tests (e.g., BIC, BLRT, LMR) to evaluate model fit and identify latent classes. However, there is no mention of alternative specifications of the variance-covariance matrix structure, such as constraints across subgroups or fixed structures. The context focuses on model fit indices and class membership comparisons without detailing any variance-covariance matrix specifications. "," - ""The number of latent unobserved classes is inferred from the observed data (i.e. the IES-R total scores) and the GMM generates goodness-of-fit statistics."" - ""In the current study, the Bayesian Information Criterion (BIC), Bootstrap likelihood ratio test (BLRT) and Lo-Mendell-Rubin adjusted likelihood ratio test (LMR) were evaluated to compare the fit of alternative models (i.e. 1- to 6-class solutions)."" - ""The Hochberg’s GT2 post-hoc testing was used to analyse pairwise comparisons."" - ""The GMM is a longitudinal analysis that explores within and between individual differences in change and individual membership within growth trajectories (classes)."" ",NO
1,9,"To determine if alternative shape/functional forms of the trajectories were described, we need to look for any mention of testing different models, such as quadratic or non-linear forms. The context discusses the use of growth mixture models (GMM) and the selection of a 4-class model based on fit statistics like AIC, BIC, entropy, LMR, and BLRT. However, there is no mention of testing alternative shapes or functional forms, such as quadratic or non-linear trends, to see if they would fit the data better. The focus is on the class-based model fit rather than exploring different functional forms of the trajectories. "," - ""The 4-class model provided the strongest goodness of fit to the data with significant p values for both the LMR and BLRT and lower values for the BIC."" - ""Additional classes of 5-class to 6-class solutions did not add to the model fit and a 4-class solution was selected as optimal."" ",NO
1,10,"To determine if covariates or predictors have been used in a replicable manner, we need to find information about the use of covariates or predictors in the context. The context mentions that the sample size was too small to test predictors in the trajectories, indicating that predictors were not analyzed. Additionally, there is no mention of the use of time-varying or time-invariant covariates at the level of the dependent or independent variables. Therefore, the analyses could not be replicated in terms of covariates or predictors. "," - ""Finally, the sample size was too small to test predictors in the trajectories, only 69.5% (n = 82) of participants responded at all points in time and this study may suffer from insufficient statistical power."" - ""Given the small sample size in this study it was not possible to reliably test predictors in the GMM."" ",NO
