paper_id,question_id,reasoning,evidence,answer
19,15,"To determine if entropy is reported in the context, we need to identify any mention of entropy values or related metrics. The context explicitly states that ""entropy values were highest for the 2- and 3-class models,"" indicating that entropy values were indeed reported. Additionally, it mentions that ""higher entropy values indicate better-fitting models,"" which further confirms that entropy is a reported metric in the context. Therefore, the answer to the question is YES. "," - ""entropy values were highest for the 2- and 3-class models"" - ""higher entropy values indicate better-fitting models"" ",YES
19,16,"To determine if a plot is included with the estimated mean trajectories of the final solution, we need to look for any mention of a figure or plot that represents these trajectories. The context mentions ""Fig. 1. Trajectories of disaster-related PTSD symptoms as a function of time since Hurricane Ike in older persons."" This indicates that there is indeed a figure included that shows the trajectories of PTSD symptoms over time. Therefore, the answer to the question is YES. "," - ""Fig. 1. Trajectories of disaster-related PTSD symptoms as a function of time since Hurricane Ike in older persons."" - ""Fig. 1 shows mean PCL-S scores over time for each of these groups."" ",YES
19,17,"To determine if plots are included with the estimated mean trajectories for each model, we need to look for any mention of figures or plots in the context. The context specifically mentions ""Fig. 1. Trajectories of disaster-related PTSD symptoms as a function of time since Hurricane Ike in older persons."" This indicates that there is at least one figure included that shows the trajectories of PTSD symptoms over time. Therefore, the answer is YES. "," - ""Fig. 1. Trajectories of disaster-related PTSD symptoms as a function of time since Hurricane Ike in older persons."" ",YES
19,18,"To determine if a plot is included of the combination of estimated means of the final model and the observed individual trajectories split out for each latent class, we need to look for any mention of such a plot in the context. The context discusses the analysis of PTSD symptoms and the use of various statistical models and criteria to identify the best-fitting model. However, there is no mention of a plot that combines estimated means of the final model with observed individual trajectories split out for each latent class. The context does mention ""Fig. 1. Trajectories of disaster-related PTSD symptoms as a function of time since Hurricane Ike in older persons,"" but it does not specify that this figure includes the combination of estimated means and observed individual trajectories split out for each latent class. "," - ""Fig. 1. Trajectories of disaster-related PTSD symptoms as a function of time since Hurricane Ike in older persons."" ",NO
19,19,"To determine if the characteristics of the final class solution are numerically described, we need to look for mentions of statistical measures such as means, standard deviations (SD), standard errors (SE), sample sizes (n), or confidence intervals (CI) in the context. The context provides a table (Table 2) that includes demographic, exposure, and clinical characteristics by PTSD symptom trajectory group, with numerical data such as weighted means, standard errors, and sample sizes. This indicates that the characteristics of the final class solution are indeed numerically described. "," - ""Table 2 Demographic, exposure, and clinical characteristics by PTSD symptom trajectory group."" - ""Age 69.2 (0.5) 69.3 (0.6) 68.3 (1.7) 68.1 (1.9)"" - ""F or c2 p"" - ""n (weighted %) or weighted mean (SE)"" ",YES
19,20,"To determine if the syntax files are available, we need to look for any mention of syntax files in the context, such as in the appendix, supplementary materials, or availability from the authors. The context provided does not mention syntax files, their availability, or any related information. Therefore, there is no evidence to suggest that syntax files are available. ", - [] ,NO
20,0,"To determine if the metric or unit of time used in the statistical model is reported, we need to look for any mention of time units in the context. The context describes the timing of evaluations at four separate time points: predeployment (T1) in April 2002, late deployment (T2) in October to November 2002, 3–4 months postdeployment (T3) in January to February 2003, and 8–9 months postdeployment (T4) in September to November 2003. These descriptions use months as the unit of time to indicate the intervals between evaluations. Therefore, the metric or unit of time used in the statistical model is reported as months. "," - ""The evaluations took place during the weeks leading up to deployment in April 2002 (predeployment, T1), the last month of deployment in October to November 2002 (late deployment, T2), 3–4 months postdeployment in January to February 2003 (T3), and 8–9 months postdeployment in September to November 2003 (T4)."" ",YES
20,1,"To determine if information about the mean and variance of time within a wave is presented, we need to look for any mention of statistical measures related to time, such as mean and variance, within the context. The context discusses various aspects of PTSD symptomatology, data collection, and analysis methods, but does not provide specific details about the mean and variance of time within a wave or measurement occasion. There is no mention of statistical measures related to time, such as mean and variance, within the context provided. ", - [] ,NO
20,2,"To determine if the missing data mechanism is reported, we need to identify any mention of how the missing data is characterized in the context. The context explicitly states that the missing data is assumed to be ""missing at random (MAR)"" due to military rotation policies and human error. This assumption is supported by references to Switzer & Roth (2002) and Buhi, Goodson, & Neilands (2008), which justify the use of a full information maximum likelihood (FIML) approach under the MAR assumption. Therefore, the missing data mechanism is indeed reported as MAR. "," - ""Because military rotation policies and human error likely explain most of the missing data in our sample, we assumed that these data were missing at random (MAR; e.g., Switzer & Roth, 2002)."" - ""A FIML approach assumes that data are MAR (e.g., Buhi, Goodson, & Neilands, 2008), and is therefore an appropriate technique for handling the data missing in the present sample."" ",YES
20,3,"To determine if a description is provided of what variables are related to attrition/missing data, we need to look for any mention of factors or variables that explain why data might be missing. The context mentions that ""military rotation policies and human error likely explain most of the missing data in our sample,"" suggesting these are considered reasons for missing data. However, there is no detailed description of specific variables related to attrition, such as dropout effects, auxiliary variables, or skip patterns. The context does not provide a comprehensive list or analysis of variables that might be related to attrition beyond these general reasons. "," - ""Because military rotation policies and human error likely explain most of the missing data in our sample, we assumed that these data were missing at random (MAR; e.g., Switzer & Roth, 2002)."" ",NO
20,4,"To determine if a description is provided of how missing data in the analyses were dealt with, we need to identify any mention of specific methods used for handling missing data. The context explicitly states that the data were assumed to be missing at random (MAR) and that a full information maximum likelihood (FIML) approach was employed using MPlus version 5.1 to impute data. This indicates that the method used to handle missing data is clearly described. "," - ""Because military rotation policies and human error likely explain most of the missing data in our sample, we assumed that these data were missing at random (MAR; e.g., Switzer & Roth, 2002)."" - ""Accordingly, we employed a missing data algorithm found in MPlus version 5.1 that imputes data using a full information maximum likelihood (FIML) approach (e.g., Arbuckle, 1996)."" - ""A FIML approach assumes that data are MAR (e.g., Buhi, Goodson, & Neilands, 2008), and is therefore an appropriate technique for handling the data missing in the present sample."" ",YES
20,5,"To determine if information about the distribution of the observed variables is included, we need to look for mentions of tests for normality or multivariate normality within the context. The context discusses various statistical analyses and criteria for model selection, such as BIC, AIC, and entropy, but does not mention any tests for the normality of observed variables or multivariate normality. There is no evidence in the context that such tests were conducted or reported. ", - [] ,NO
20,6,"The question asks whether the software used for statistical analysis is mentioned in the context. The context explicitly states that ""Mplus version 5.1 was used to perform all analyses."" This directly answers the question by identifying the software used. "," - ""Mplus version 5.1 was used to perform all analyses."" - ""a missing data algorithm found in MPlus version 5.1 that imputes data using a full information maximum likelihood (FIML) approach."" - ""Latent class growth analysis (LCGA) was used to model growth curves... Mplus version 5.1 was used to perform all analyses."" ",YES
20,7,"To determine if alternative specifications of within-class heterogeneity are considered and documented, we need to identify any mention of comparing different models, such as Latent Class Growth Analysis (LCGA) and Growth Mixture Modeling (GMM). The context discusses the use of LCGA and mentions GMM as an alternative that allows for variation but requires more parameters, leading to an underidentified model with the current dataset. The decision to use LCGA over GMM is clearly documented due to the limitations of the dataset. Therefore, alternative specifications are considered and documented. "," - ""Although one alternative form of latent growth modeling, growth mixture modeling (GMM), does allow such variation, it speciﬁes a model with more unknown parameters than LCGA."" - ""A growth mixture model containing a quadratic factor would require more identiﬁed parameters than are available with the present dataset, and would result in an underidentiﬁed model."" - ""Latent class growth analysis was therefore used to model growth curves."" ",YES
20,8,"To determine if alternative specifications of the between-class differences in variance-covariance matrix structure are considered and clearly documented, we need to look for any mention of such specifications in the context. The context discusses the use of latent class growth analysis (LCGA) and mentions goodness-of-fit statistics, but it does not provide any specific information about alternative specifications of the variance-covariance matrix structure, such as constraints across subgroups or fixed structures. There is no evidence in the context that these aspects were considered or documented. ", - [] ,NO
20,9,"The context discusses the use of latent class growth analysis (LCGA) to model growth curves and mentions the consideration of a quadratic factor in the models. It states that a growth mixture model (GMM) with a quadratic factor would require more parameters than available, leading to an underidentified model. This indicates that while a quadratic trend was considered, it was not feasible with the dataset. The context does not mention testing other non-linear forms beyond the quadratic factor. Therefore, alternative shape/functional forms beyond the quadratic trend were not described as being tested. "," - ""Because Bonanno’s theory hypothesizes curvilinear patterns of adaptation to trauma, we wanted to include a quadratic factor in our unconditional and conditional growth models."" - ""A growth mixture model containing a quadratic factor would require more identified parameters than are available with the present dataset, and would result in an underidentified model."" - ""The linear (B =− 1.45, SE B = 4.13, 95% CI=− 9.63–6.73, ns) and quadratic ( B = 2.21, SE B = 1.38, 95% CI =− 0.52–4.94, ns) change parameters did not indicate a significant increase in symptoms."" ",NO
20,10,"To determine if the analyses could be replicated, we need to check if the paper specifies how covariates or predictors were used, such as whether they were time-varying or time-invariant, and at what level they were applied. The context mentions that predictor variables were grouped by type and tested as separate analytic models, and significant predictors were included in a final combined model. It also specifies that certain variables were collected at different time points (e.g., predeployment and late-deployment). However, it does not explicitly state whether these covariates were time-varying or time-invariant, nor does it specify their application level in the analyses. Therefore, the necessary details for replication are not fully provided. "," - ""Predictor variables were grouped by type (demographics, trauma exposure variables, psychiatric comorbidities, personality and coping variables, and heart rate), and tested as separate analytic models."" - ""With two exceptions, predictor variables were comprised of data collected at the predeployment assessment point. Peacekeeping daily hassles and combat exposure variables were comprised of data collected at the late-deployment assessment point."" ",NO
20,11,"To determine if information about the number of random start values and final iterations is reported, we need to look for any mention of these details in the context. The context discusses the use of Mplus version 5.1 for analyses, the criteria for model fit, and the results of the latent class growth analysis. However, there is no mention of the number of random start values or final iterations used in the estimation process. The context does not provide any information about convergence to the maximum of the ML distribution or avoiding local maxima, which would typically be addressed by reporting these details. ", - [] ,NO
20,12,"The question asks whether the model comparison and selection tools described are from a statistical perspective. The context mentions several statistical tools used for model comparison, including the Bayesian information criterion (BIC), the sample-size adjusted BIC, the Akaike information criterion (AIC), and the Lo-Mendell-Rubin likelihood ratio test. These are all well-known statistical measures used to evaluate model fit and compare different models. Therefore, the tools described are indeed from a statistical perspective. "," - ""Goodness of fit statistics considered when examining latent class solutions included the Bayesian information criterion (BIC), the sample-size adjusted BIC, the Akaike information criterion (AIC), the Lo-Mendell-Rubin likelihood ratio test, average latent class probabilities of group membership, and entropy."" - ""The most favored group solution is one having the lowest BIC, lowest sample-size adjusted BIC, lowest AIC, a significant Lo-Mendell-Rubin likelihood ratio test, latent class membership probabilities approaching a value of 1.0 (and probabilities for assignment to other groups approaching 0), and a high entropy value approaching 1.0."" ",YES
20,13,"To determine if the total number of fitted models reported includes a one-class solution, we need to examine the context for any mention of models with one class. The context provides information about models ranging from 2 to 5 groups, as well as a 4-group solution with covariates. There is no mention of a one-class solution in the goodness of fit statistics or any other part of the context. Therefore, the answer is NO. "," - ""Goodness of fit comparisons were made between unconditional trajectory group models ranging in size from 2 to 5 groups."" - ""The 4-group solution had the smallest BIC value (Table 1), the smallest sample-size adjusted BIC value, and the smallest AIC value."" - ""Table 1. Goodness of Fit Statistics for Unconditional Group-Based Models"" lists models from 2-group to 5-group, but not a one-class solution. ",NO
20,14,"To determine if the number of cases per class is reported, we need to look for any mention of absolute sample size, sample size per class, or proportion in the context. The context discusses various statistical analyses and criteria for evaluating latent class solutions, but it does not provide specific numbers or proportions for the cases in each class. There is no mention of absolute sample size, sample size per class, or proportion in the provided text. ", - [] ,NO
20,15,"The question asks whether entropy is reported in the context of classifying cases in a trajectory. The context mentions that entropy values are considered when examining latent class solutions, specifically noting that the 4-group solution had an entropy value approaching 1.0, which is consistent with good model fit. This indicates that entropy is indeed reported as part of the analysis. "," - ""The entropy value for the 4-group solution approached 1.0, and was also consistent with good model ﬁt."" - ""Goodness of ﬁt statistics considered when examining latent class solutions included [...] entropy."" ",YES
20,16,"To determine if a plot is included with the estimated mean trajectories of the final solution, we need to look for any mention of a figure or plot that represents these trajectories. The context mentions ""Figure 1. Longitudinal course of posttraumatic stress disorder (PTSD) symptoms across four time points as suggested by the unconditional 4-group model solution."" This indicates that a plot is indeed included with the estimated mean trajectories of the final solution. "," - ""Figure 1. Longitudinal course of posttraumatic stress disorder (PTSD) symptoms across four time points as suggested by the unconditional 4-group model solution."" ",YES
20,17,"To determine if plots are included with the estimated mean trajectories for each model, we need to look for any mention of graphical representations or plots in the context. The context discusses various statistical analyses, goodness of fit statistics, and trajectory group models, but it does not mention any plots or graphical representations of the estimated mean trajectories. The context focuses on numerical data and statistical results without reference to visual plots. "," - The context discusses ""Goodness of Fit Statistics for Unconditional Group-Based Models"" and provides numerical data such as BIC, AIC, and entropy values. - There is no mention of plots or graphical representations in the context. ",NO
20,18,"To determine if a plot is included of the combination of estimated means of the final model and the observed individual trajectories split out for each latent class, we need to look for any mention of such a plot in the context. The context discusses the use of latent class growth analysis (LCGA) and mentions various statistical parameters and results, but it does not explicitly mention the inclusion of a plot showing the estimated means and observed individual trajectories for each latent class. There is no evidence in the provided text that such a plot is included. ", - [] ,NO
20,19,"To determine if the characteristics of the final class solution are numerically described, we need to look for mentions of statistical measures such as means, standard deviations (SD), standard errors (SE), sample sizes (n), or confidence intervals (CI) in the context. The context provides details about the statistical significance of predictors, odds ratios, and confidence intervals for predictors of latent class assignment. However, it does not mention any numerical descriptions of the class characteristics themselves, such as means, SD, SE, n, or CI for the classes. Therefore, the answer is NO. "," - ""The odds ratios and confidence intervals, generated from a final regression containing all of the significant predictors, are presented in Table 3."" - ""Odds ratios were generated by comparing the classes listed vertically to those listed above."" ",NO
20,20,"To determine if the syntax files are available, we need to look for any mention of syntax files being included in the appendix, supplementary materials, or available from the authors. The context provided does not mention syntax files in any of these locations or indicate that they are available from the authors. Therefore, there is no evidence to suggest that the syntax files are available. ", - [] ,NO
21,0,"To determine if the metric or unit of time used in the statistical model is reported, we need to look for any mention of time units in the context. The context describes the assessment of PTSD symptom levels at specific time points: 6, 12, 18, 24, and 36 months into active duty. This indicates that the unit of time used in the statistical model is months. Therefore, the answer to the question is YES. "," - ""The PTSD symptom levels were assessed at each time point (6, 12, 18, 24, and 36 months into active duty)"" - ""participants could endorse a single item multiple times if they were exposed to that event multiple times within the 6-month assessment time frame."" ",YES
21,1,"To determine if information about the mean and variance of time within a wave is presented, we need to look for any mention of statistical measures related to time, such as mean and variance, within the context. The context discusses various aspects of data analysis, including the use of latent growth mixture models (LGMMs) and the handling of missing data. However, there is no mention of calculating or reporting the mean and variance of time within a wave or any specific time-related statistical measures. The focus is on PTSD symptom trajectories, exposure to life-threatening events, and statistical methods for handling data, but not on the mean and variance of time. "," - ""Using Mplus 6.0, we employed LGMMs to construct trajectories of PTSD symptoms over five time points."" - ""Subjects with and without missing data did not differ in initial PTSD symptom scores."" - ""Maximum-likelihood estimators provide unbiased estimates when data are both missing completely at random and when data are missing at random."" ",NO
21,2,"To determine if the missing data mechanism is reported, we need to identify any mention of the assumptions or classifications of missing data in the context. The context explicitly states that the analysis proceeded with the assumption that data were missing at random (MAR). This is supported by the statement, ""As such, we proceeded in our analysis with the assumption that data were missing at random."" Additionally, the context discusses the use of full-information maximum-likelihood (FIML) estimation, which assumes missing data are unrelated to the outcome variable, aligning with the MAR assumption. Therefore, the missing data mechanism is indeed reported as MAR. "," - ""As such, we proceeded in our analysis with the assumption that data were missing at random."" - ""A FIML estimation assumes missing data are unrelated to the outcome variable (i.e., missing at random)."" ",YES
21,3,"To determine if a description is provided of what variables are related to attrition/missing data, we need to look for any mention of variables or factors that might influence the missing data. The context mentions that an ANOVA was conducted to check if missingness was associated with baseline scores on specific scales (modified PCL-M, DES, PDEQ), and it was found that missingness was not associated with these scores. This suggests that the study considered these specific variables in relation to missing data. However, there is no mention of other variables such as dropout effects, auxiliary variables, or skip patterns. Therefore, the context does not provide a comprehensive description of all possible variables related to attrition/missing data. "," - ""An analysis of variance (ANOVA) revealed that missingness was not associated with baseline scores on the modified PCL-M, F (1, 177) = 0.63, p =.60; the DES, F (1, 177) = 0.54, p =.65; or PDEQ, F (1, 177) = 0.62, p =.60."" - ""As discussed above, subjects with and without missing data did not differ in initial PTSD symptom scores."" ",NO
21,4,"The context provides a description of how missing data were handled in the analyses. It mentions that a robust full-information maximum-likelihood (FIML) estimation procedure was employed to address missing data. This method assumes that the missing data are unrelated to the outcome variable, i.e., missing at random. The context also references the appropriateness of FIML and compares it to other methods like listwise deletion and single imputation techniques, indicating that FIML was chosen for its advantages. Therefore, the context clearly describes the method used to handle missing data. "," - ""To address missing data, we employed a robust full-information maximum-likelihood (FIML) estimation procedure for handling missing data."" - ""A FIML estimation assumes missing data are unrelated to the outcome variable (i.e., missing at random)."" - ""The appropriateness of FIML is widely endorsed (Enders, 2001)."" - ""Simulation studies have demonstrated that maximum-likelihood estimators provide more accurate estimates than removing data listwise (Muth´en, 1987)."" ",YES
